source_result_id	result_label	source_family	source_directness	coding_status	local_evidence_path	local_evidence_sha256	local_evidence_kind	doi_list	pmid_list	pmcid_list	nct_list	url_list	aea_trial_list	dataverse_dvn_list	source_bib_key	source_bib_doi	source_bib_url	source_bib_title	source_bib_real_world_url	crossref_resolved_doi	crossref_resolved_title	crossref_score	crossref_title_similarity	crossref_resolution_method	crossref_resolution_status	crossref_query_url	primary_real_world_url	primary_real_world_url_basis	grounding_status	literal_number_status	number_verified_against_original_source	grounding_note	evidence_level	evidence_level_name	source_is_original	number_verified_by_us	represented_work_identified	source_is_external	requires_manual_review	conversion_verified
sr_df1f5890afec	Morphine Milligram Equivalents (MME)	ctgov_finer_grained_kg	candidate_child_numeric_row	coded_with_schema_gaps	data/raw/corpus_candidates/ctgov_kg/efficacy_df.csv	b41c171dad525c18cd25b9df1429a9590282e9cb91fbcf606b72ef00d7222af1	external_corpus_mirror				NCT02887989				du2024	10.6084/m9.figshare.24225166	https://doi.org/10.6084/m9.figshare.24225166	Clinical trials efficacy results dataset (derivative of AACT)	https://doi.org/10.6084/m9.figshare.24225166						not_needed_or_not_attempted		https://clinicaltrials.gov/study/NCT02887989	nct	registry_identifier_nct	literal_number_from_external_corpus_mirror	not_yet	NCT registry row is treated as authoritative registry source for the literal result.	4	target_source_independently_grounded	false	false	true	true	true	false
sr_f5b1fa84ce27	Durgin, F. H., Fox, L. F., & Kim, D. H. (2003). Not Letting the Left Leg Know What the Right Leg is Doing Limb-Specific Locomotor Adaptation to Sensory-Cue Conflict. Psychological Science, 14(6), 567-572.	motyl_2017_critical_tests	candidate_child_numeric_row	coded_with_schema_gaps	data/raw/corpus_candidates/motyl_2017/ScienceStatus_C.csv	c3e0e57e2910bc82f9d05740f52f53857a2ebc34353320d73ec5b74ba3613769	external_corpus_mirror								motyl2017state	10.1037/pspa0000084	https://doi.org/10.1037/pspa0000084	The State of Social and Personality Science: Rotten to the Core, Not So Bad, Getting Better, or Getting Worse?	https://doi.org/10.1037/pspa0000084	10.1046/j.0956-7976.2003.psci_1466.x	Not Letting the Left Leg Know What the Right Leg is Doing		1.000	title_year_journal	candidate_high_similarity	https://api.crossref.org/works?rows=1&query.bibliographic=Durgin%2C+F.+H.%2C+Fox%2C+L.+F.%2C+%26+Kim%2C+D.+H.+%282003%29.+Not+Letting+the+Left+Leg+Know+What+the+Right+Leg+is+Doing+Limb-Specific+Locomotor+Adaptation+to+Sensory-Cue+Conflict.+Psychological+Science%2C+14%286%29%2C+567-572.+Psych+Science+2003.0	https://doi.org/10.1046/j.0956-7976.2003.psci_1466.x	crossref_doi	represented_work_crossref_resolved	literal_number_from_external_corpus_mirror	not_yet	Real-world handle found, but the numeric result still needs original/source verification.	4	target_source_independently_grounded	false	false	true	true	true	false
sr_17b0cfe42e6d	Period 1: Endoscopic Remission	ctgov_finer_grained_kg	candidate_child_numeric_row	coded_with_schema_gaps	data/raw/corpus_candidates/ctgov_kg/efficacy_df.csv	b41c171dad525c18cd25b9df1429a9590282e9cb91fbcf606b72ef00d7222af1	external_corpus_mirror				NCT01903252				du2024	10.6084/m9.figshare.24225166	https://doi.org/10.6084/m9.figshare.24225166	Clinical trials efficacy results dataset (derivative of AACT)	https://doi.org/10.6084/m9.figshare.24225166						not_needed_or_not_attempted		https://clinicaltrials.gov/study/NCT01903252	nct	registry_identifier_nct	literal_number_from_external_corpus_mirror	not_yet	NCT registry row is treated as authoritative registry source for the literal result.	4	target_source_independently_grounded	false	false	true	true	true	false
sr_c1cbd6657a4e	plot2::JAP-84-3-445	metaBUS open Bosco subset	candidate_child_numeric_row	coded_with_schema_gaps	data/raw/corpus_candidates/metabus/Ver2-08_MasterDB_JAP-PPsych_1980-2010.xlsx	6ddc9c27ad135da96a982ed20004713fe4904741e34caee71828d7efbce9df1b	external_corpus_mirror								bosco2020metabus	10.1177/2515245919882693	https://doi.org/10.1177/2515245919882693	Advancing Meta-Analysis With Knowledge-Management Platforms: Using metaBUS in Psychology	https://doi.org/10.1177/2515245919882693	10.1037/a0020373	Equality versus differentiation: The effects of power dispersion on group interaction.	29.360758		metabus_journal_volume_issue_page	candidate_high_similarity	https://api.crossref.org/works?rows=1&query.bibliographic=Journal+of+Applied+Psychology+2010.0+95+6+1032	https://doi.org/10.1037/a0020373	crossref_doi	represented_work_crossref_resolved	literal_number_from_external_corpus_mirror	not_yet	Real-world handle found, but the numeric result still needs original/source verification.	4	target_source_independently_grounded	false	false	true	true	true	false
sr_6e06fcfca537	The spectrum of association in HLA region with rheumatoid arthritis in a diverse Asian population: evidence from the MyEIRA case-control study.	gwas_catalog	candidate_child_numeric_row	coded_with_schema_gaps	data/raw/corpus_candidates/gwas_catalog/gwas-catalog-download-associations-alt-full.tsv	d54e13c7e17b4809c5d57202a5c76b8315dc5beb6e154377255df1de550fc8d2	external_corpus_mirror		33514426						yengo2022	10.1038/s41586-022-05275-y	https://doi.org/10.1038/s41586-022-05275-y	A saturated map of common genetic variants associated with human height	https://doi.org/10.1038/s41586-022-05275-y						not_needed_or_not_attempted		https://pubmed.ncbi.nlm.nih.gov/33514426/	pmid	represented_work_identifier_in_source_row	literal_number_from_external_corpus_mirror	not_yet	Real-world handle found, but the numeric result still needs original/source verification.	4	target_source_independently_grounded	false	false	true	true	true	false
sr_307943984453	schaefer_2019_np_SOC.079	schaefer_schwarz_2019_without_prereg	candidate_child_numeric_row	coded_with_schema_gaps	data/raw/corpus_candidates/schaefer_schwarz_2019/studies_without_prereg.xlsx	62dfc5e065a94a3dbfdbdd1c97a97c92c54021438c6e34f22f61be4c61771c9e	external_corpus_mirror								schaefer2019meaningfulness	10.3389/fpsyg.2019.00813	https://doi.org/10.3389/fpsyg.2019.00813	The Meaningfulness of Effect Sizes in Psychological Research: Differences Between Sub-Disciplines and the Impact of Potential Biases	https://doi.org/10.3389/fpsyg.2019.00813	10.3765/plsa.v4i1.4501	NP internal syntax: High tone and quantifier conditions		0.231	title_year_journal	candidate_low_similarity	https://api.crossref.org/works?rows=1&query.bibliographic=schaefer_2019_np_SOC.079+1980.0	https://doi.org/10.3765/plsa.v4i1.4501	crossref_doi	represented_work_crossref_candidate_low_similarity	literal_number_from_external_corpus_mirror	not_yet	Real-world handle found, but the numeric result still needs original/source verification.	2	external_source_assertion	false	false	false	true	true	false
sr_61bbdea80744	Forest, A. L., Kille, D. R., Wood, J. V., & Holmes, J. G. (2014). Discount and disengage: How chronic negative expressivity undermines partner responsiveness to negative disclosures. Journal of personality and social psychology, 107(6), 1013.	Motyl social/personality critical tests	candidate_child_numeric_row	coded_with_schema_gaps	data/raw/corpus_candidates/motyl_2017/ScienceStatus_C.csv	c3e0e57e2910bc82f9d05740f52f53857a2ebc34353320d73ec5b74ba3613769	external_corpus_mirror								motyl2017state	10.1037/pspa0000084	https://doi.org/10.1037/pspa0000084	The State of Social and Personality Science: Rotten to the Core, Not So Bad, Getting Better, or Getting Worse?	https://doi.org/10.1037/pspa0000084	10.1037/a0038163	Discount and disengage: How chronic negative expressivity undermines partner responsiveness to negative disclosures.		1.000	title_year_journal	candidate_high_similarity	https://api.crossref.org/works?rows=1&query.bibliographic=Forest%2C+A.+L.%2C+Kille%2C+D.+R.%2C+Wood%2C+J.+V.%2C+%26+Holmes%2C+J.+G.+%282014%29.+Discount+and+disengage%3A+How+chronic+negative+expressivity+undermines+partner+responsiveness+to+negative+disclosures.+Journal+of+personality+and+social+psychology%2C+107%286%29%2C+1013.+JPSP+2014.0	https://doi.org/10.1037/a0038163	crossref_doi	represented_work_crossref_resolved	literal_number_from_external_corpus_mirror	not_yet	Real-world handle found, but the numeric result still needs original/source verification.	4	target_source_independently_grounded	false	false	true	true	true	false
sr_1ed207224a85	JAP-87-1-185	metabus_open_bosco	candidate_child_numeric_row	coded_with_schema_gaps	data/raw/corpus_candidates/metabus/Ver2-08_MasterDB_JAP-PPsych_1980-2010.xlsx	6ddc9c27ad135da96a982ed20004713fe4904741e34caee71828d7efbce9df1b	external_corpus_mirror								bosco2020metabus	10.1177/2515245919882693	https://doi.org/10.1177/2515245919882693	Advancing Meta-Analysis With Knowledge-Management Platforms: Using metaBUS in Psychology	https://doi.org/10.1177/2515245919882693	10.1037/0021-9010.87.1.185	Effects of procedure and outcome accountability on interview validity.	28.550423		metabus_journal_volume_issue_page	candidate_high_similarity	https://api.crossref.org/works?rows=1&query.bibliographic=Journal+of+Applied+Psychology+2002.0+87+1+185	https://doi.org/10.1037/0021-9010.87.1.185	crossref_doi	represented_work_crossref_resolved	literal_number_from_external_corpus_mirror	not_yet	Real-world handle found, but the numeric result still needs original/source verification.	4	target_source_independently_grounded	false	false	true	true	true	false
sr_fdf78d9e9f66	Forced Expiratory Volume in One Second (FEV1) Area Under Curve 0-3 Hour (h) (AUC 0-3h) Response at 24 Weeks	ctgov_finer_grained_kg	candidate_child_numeric_row	coded_with_schema_gaps	data/raw/corpus_candidates/ctgov_kg/efficacy_df.csv	b41c171dad525c18cd25b9df1429a9590282e9cb91fbcf606b72ef00d7222af1	external_corpus_mirror				NCT00796653 | NCT00793624				du2024	10.6084/m9.figshare.24225166	https://doi.org/10.6084/m9.figshare.24225166	Clinical trials efficacy results dataset (derivative of AACT)	https://doi.org/10.6084/m9.figshare.24225166						not_needed_or_not_attempted		https://clinicaltrials.gov/study/NCT00796653	nct	registry_identifier_nct	literal_number_from_external_corpus_mirror	not_yet	NCT registry row is treated as authoritative registry source for the literal result.	4	target_source_independently_grounded	false	false	true	true	true	false
sr_72511a245c94	Percentage of Participants With a ≥90% Improvement in Psoriasis Area and Severity Index (PASI 90) From Baseline	ctgov_finer_grained_kg	candidate_child_numeric_row	coded_with_schema_gaps	data/raw/corpus_candidates/ctgov_kg/efficacy_df.csv	b41c171dad525c18cd25b9df1429a9590282e9cb91fbcf606b72ef00d7222af1	external_corpus_mirror				NCT02561806				du2024	10.6084/m9.figshare.24225166	https://doi.org/10.6084/m9.figshare.24225166	Clinical trials efficacy results dataset (derivative of AACT)	https://doi.org/10.6084/m9.figshare.24225166						not_needed_or_not_attempted		https://clinicaltrials.gov/study/NCT02561806	nct	registry_identifier_nct	literal_number_from_external_corpus_mirror	not_yet	NCT registry row is treated as authoritative registry source for the literal result.	4	target_source_independently_grounded	false	false	true	true	true	false
sr_c5752f09223e	Genome-wide association and longitudinal analyses reveal genetic loci linking pubertal height growth, pubertal timing and childhood adiposity.	gwas_catalog	candidate_child_numeric_row	coded_with_schema_gaps	data/raw/corpus_candidates/gwas_catalog/gwas-catalog-download-associations-alt-full.tsv	d54e13c7e17b4809c5d57202a5c76b8315dc5beb6e154377255df1de550fc8d2	external_corpus_mirror		23449627						yengo2022	10.1038/s41586-022-05275-y	https://doi.org/10.1038/s41586-022-05275-y	A saturated map of common genetic variants associated with human height	https://doi.org/10.1038/s41586-022-05275-y						not_needed_or_not_attempted		https://pubmed.ncbi.nlm.nih.gov/23449627/	pmid	represented_work_identifier_in_source_row	literal_number_from_external_corpus_mirror	not_yet	Real-world handle found, but the numeric result still needs original/source verification.	4	target_source_independently_grounded	false	false	true	true	true	false
sr_9c4daeb580e8	the Occurrence of Cardiovascular Event and Peritonitis Events	ctgov_finer_grained_kg	candidate_child_numeric_row	coded_with_schema_gaps	data/raw/corpus_candidates/ctgov_kg/efficacy_df.csv	b41c171dad525c18cd25b9df1429a9590282e9cb91fbcf606b72ef00d7222af1	external_corpus_mirror				NCT01391468				du2024	10.6084/m9.figshare.24225166	https://doi.org/10.6084/m9.figshare.24225166	Clinical trials efficacy results dataset (derivative of AACT)	https://doi.org/10.6084/m9.figshare.24225166						not_needed_or_not_attempted		https://clinicaltrials.gov/study/NCT01391468	nct	registry_identifier_nct	literal_number_from_external_corpus_mirror	not_yet	NCT registry row is treated as authoritative registry source for the literal result.	4	target_source_independently_grounded	false	false	true	true	true	false
sr_c25aa56f24e3	Melanesian blond hair is caused by an amino acid change in TYRP1.	gwas_catalog	candidate_child_numeric_row	coded_with_schema_gaps	data/raw/corpus_candidates/gwas_catalog/gwas-catalog-download-associations-alt-full.tsv	d54e13c7e17b4809c5d57202a5c76b8315dc5beb6e154377255df1de550fc8d2	external_corpus_mirror		22556244						yengo2022	10.1038/s41586-022-05275-y	https://doi.org/10.1038/s41586-022-05275-y	A saturated map of common genetic variants associated with human height	https://doi.org/10.1038/s41586-022-05275-y						not_needed_or_not_attempted		https://pubmed.ncbi.nlm.nih.gov/22556244/	pmid	represented_work_identifier_in_source_row	literal_number_from_external_corpus_mirror	not_yet	Real-world handle found, but the numeric result still needs original/source verification.	4	target_source_independently_grounded	false	false	true	true	true	false
sr_4871288bad74	PCR-Corrected Adequate Clinical and Parasitological Response (ACPR) Rate on Day 28	ctgov_finer_grained_kg	candidate_child_numeric_row	coded_with_schema_gaps	data/raw/corpus_candidates/ctgov_kg/efficacy_df.csv	b41c171dad525c18cd25b9df1429a9590282e9cb91fbcf606b72ef00d7222af1	external_corpus_mirror				NCT00422084				du2024	10.6084/m9.figshare.24225166	https://doi.org/10.6084/m9.figshare.24225166	Clinical trials efficacy results dataset (derivative of AACT)	https://doi.org/10.6084/m9.figshare.24225166						not_needed_or_not_attempted		https://clinicaltrials.gov/study/NCT00422084	nct	registry_identifier_nct	literal_number_from_external_corpus_mirror	not_yet	NCT registry row is treated as authoritative registry source for the literal result.	4	target_source_independently_grounded	false	false	true	true	true	false
sr_92b015f56f77	Narcotic Use	ctgov_finer_grained_kg	candidate_child_numeric_row	coded_with_schema_gaps	data/raw/corpus_candidates/ctgov_kg/efficacy_df.csv	b41c171dad525c18cd25b9df1429a9590282e9cb91fbcf606b72ef00d7222af1	external_corpus_mirror				NCT01163214				du2024	10.6084/m9.figshare.24225166	https://doi.org/10.6084/m9.figshare.24225166	Clinical trials efficacy results dataset (derivative of AACT)	https://doi.org/10.6084/m9.figshare.24225166						not_needed_or_not_attempted		https://clinicaltrials.gov/study/NCT01163214	nct	registry_identifier_nct	literal_number_from_external_corpus_mirror	not_yet	NCT registry row is treated as authoritative registry source for the literal result.	4	target_source_independently_grounded	false	false	true	true	true	false
sr_2c54a948cfe2	The Primary Outcome is the Area Under the Stimulated C-peptide Curve (AUC) at the One Year Visit	ctgov_finer_grained_kg	candidate_child_numeric_row	coded_with_schema_gaps	data/raw/corpus_candidates/ctgov_kg/efficacy_df.csv	b41c171dad525c18cd25b9df1429a9590282e9cb91fbcf606b72ef00d7222af1	external_corpus_mirror				NCT00529399				du2024	10.6084/m9.figshare.24225166	https://doi.org/10.6084/m9.figshare.24225166	Clinical trials efficacy results dataset (derivative of AACT)	https://doi.org/10.6084/m9.figshare.24225166						not_needed_or_not_attempted		https://clinicaltrials.gov/study/NCT00529399	nct	registry_identifier_nct	literal_number_from_external_corpus_mirror	not_yet	NCT registry row is treated as authoritative registry source for the literal result.	4	target_source_independently_grounded	false	false	true	true	true	false
sr_6884c920951c	Halberda, J. (2006). Is this a dax which I see before me? Use of the logical argument disjunctive syllogism supports word-learning in children and adults.Cognitive psychology, 53(4), 310-344.	MetaLab	candidate_child_numeric_row	coded_with_schema_gaps	data/raw/corpus_candidates/metalab/metalab.Rdata	e3dcd2ccf198f6aabc9285575dfcc1a604fc1b185ddfc508791db9bb3d0a5b55	external_corpus_mirror								bergmann2018metalab	10.1111/cdev.13079	https://doi.org/10.1111/cdev.13079	Promoting Replicability in Developmental Research Through Meta-analyses: Insights From Language Acquisition Research	https://doi.org/10.1111/cdev.13079	10.1016/j.cogpsych.2006.04.003	Is this a dax which I see before me? Use of the logical argument disjunctive syllogism supports word-learning in children and adults		1.000	title_year_journal	candidate_high_similarity	https://api.crossref.org/works?rows=1&query.bibliographic=Halberda%2C+J.+%282006%29.+Is+this+a+dax+which+I+see+before+me%3F+Use+of+the+logical+argument+disjunctive+syllogism+supports+word-learning+in+children+and+adults.Cognitive+psychology%2C+53%284%29%2C+310-344.+2006.0	https://doi.org/10.1016/j.cogpsych.2006.04.003	crossref_doi	represented_work_crossref_resolved	literal_number_from_external_corpus_mirror	not_yet	Real-world handle found, but the numeric result still needs original/source verification.	4	target_source_independently_grounded	false	false	true	true	true	false
sr_333ef50a595e	Percentage of Subjects Who Achieved a Composite P-GAPS1/CPnS2 Response	ctgov_finer_grained_kg	candidate_child_numeric_row	coded_with_schema_gaps	data/raw/corpus_candidates/ctgov_kg/efficacy_df.csv	b41c171dad525c18cd25b9df1429a9590282e9cb91fbcf606b72ef00d7222af1	external_corpus_mirror				NCT02398188				du2024	10.6084/m9.figshare.24225166	https://doi.org/10.6084/m9.figshare.24225166	Clinical trials efficacy results dataset (derivative of AACT)	https://doi.org/10.6084/m9.figshare.24225166						not_needed_or_not_attempted		https://clinicaltrials.gov/study/NCT02398188	nct	registry_identifier_nct	literal_number_from_external_corpus_mirror	not_yet	NCT registry row is treated as authoritative registry source for the literal result.	4	target_source_independently_grounded	false	false	true	true	true	false
sr_03355505d651	Young, L., & Durwin, A. J. (2013). Moral realism as moral motivation: The impact of meta-ethics on everyday decision-making. Journal of Experimental Social Psychology, 49(2), 302-306.	Motyl social/personality critical tests	candidate_child_numeric_row	coded_with_schema_gaps	data/raw/corpus_candidates/motyl_2017/ScienceStatus_C.csv	c3e0e57e2910bc82f9d05740f52f53857a2ebc34353320d73ec5b74ba3613769	external_corpus_mirror								motyl2017state	10.1037/pspa0000084	https://doi.org/10.1037/pspa0000084	The State of Social and Personality Science: Rotten to the Core, Not So Bad, Getting Better, or Getting Worse?	https://doi.org/10.1037/pspa0000084	10.1016/j.jesp.2012.11.013	Moral realism as moral motivation: The impact of meta-ethics on everyday decision-making		1.000	title_year_journal	candidate_high_similarity	https://api.crossref.org/works?rows=1&query.bibliographic=Young%2C+L.%2C+%26+Durwin%2C+A.+J.+%282013%29.+Moral+realism+as+moral+motivation%3A+The+impact+of+meta-ethics+on+everyday+decision-making.+Journal+of+Experimental+Social+Psychology%2C+49%282%29%2C+302-306.+JESP+2013.0	https://doi.org/10.1016/j.jesp.2012.11.013	crossref_doi	represented_work_crossref_resolved	literal_number_from_external_corpus_mirror	not_yet	Real-world handle found, but the numeric result still needs original/source verification.	4	target_source_independently_grounded	false	false	true	true	true	false
sr_e89d75ebfd8e	schaefer_2019_np_CLI.064	schaefer_schwarz_2019_without_prereg	candidate_child_numeric_row	coded_with_schema_gaps	data/raw/corpus_candidates/schaefer_schwarz_2019/studies_without_prereg.xlsx	62dfc5e065a94a3dbfdbdd1c97a97c92c54021438c6e34f22f61be4c61771c9e	external_corpus_mirror								schaefer2019meaningfulness	10.3389/fpsyg.2019.00813	https://doi.org/10.3389/fpsyg.2019.00813	The Meaningfulness of Effect Sizes in Psychological Research: Differences Between Sub-Disciplines and the Impact of Potential Biases	https://doi.org/10.3389/fpsyg.2019.00813	10.1158/1557-3265.ovcasymp18-tmim-064	Abstract TMIM-064: AMPKA-LIKE PROTEINS IN OVARIAN CANCER TUMORIGENESIS AND NECROPTOSIS		0.250	title_year_journal	candidate_low_similarity	https://api.crossref.org/works?rows=1&query.bibliographic=schaefer_2019_np_CLI.064+2015.0	https://doi.org/10.1158/1557-3265.ovcasymp18-tmim-064	crossref_doi	represented_work_crossref_candidate_low_similarity	literal_number_from_external_corpus_mirror	not_yet	Real-world handle found, but the numeric result still needs original/source verification.	2	external_source_assertion	false	false	false	true	true	false
sr_61aeb1d7281e	kuhberger_669	kuhberger_2014_main_results	candidate_child_numeric_row	coded_with_schema_gaps	data/raw/corpus_candidates/kuhberger_2014/pone.0105825.s002.sav	28553027e6ee949e6b47a8992123218fb1a635610e44d46c045991a67a498f78	external_corpus_mirror	10.1371/journal.pone.0105825							kuhberger2014publicationBias	10.1371/journal.pone.0105825	https://doi.org/10.1371/journal.pone.0105825	Publication Bias in Psychology: A Diagnosis Based on the Correlation between Effect Size and Sample Size	https://doi.org/10.1371/journal.pone.0105825						not_needed_or_not_attempted		https://doi.org/10.1371/journal.pone.0105825	doi	represented_work_identifier_in_source_row	literal_number_from_external_corpus_mirror	not_yet	Real-world handle found, but the numeric result still needs original/source verification.	4	target_source_independently_grounded	false	false	true	true	true	false
sr_c6091d70fcc5	Change From Baseline in Hamilton Depression Rating Scale (HDRS-17) Total Score at Week 12	ClinicalTrials.gov phase-2+ primary randomized registry rows	raw_ctgov_registry_row	fully_coded	data/raw/corpus_candidates/ctgov_kg/efficacy_df.csv	b41c171dad525c18cd25b9df1429a9590282e9cb91fbcf606b72ef00d7222af1	external_corpus_mirror				NCT02473289				du2024	10.6084/m9.figshare.24225166	https://doi.org/10.6084/m9.figshare.24225166	Clinical trials efficacy results dataset (derivative of AACT)	https://doi.org/10.6084/m9.figshare.24225166						not_needed_or_not_attempted		https://clinicaltrials.gov/study/NCT02473289	nct	registry_identifier_nct	literal_number_from_registry_mirror	yes	NCT registry row is treated as authoritative registry source for the literal result.	6	original_number_extracted	true	true	true	true	false	true
sr_e786a4f0bdc3	Meltzoff, A. N., & Moore, M. K. (1989). Imitation in newborn infants: Exploring the range of gestures imitated and the underlying mechanisms. Developmental Psychology, 25, 954ñ962	metalab	candidate_child_numeric_row	coded_with_schema_gaps	data/raw/corpus_candidates/metalab/metalab.Rdata	e3dcd2ccf198f6aabc9285575dfcc1a604fc1b185ddfc508791db9bb3d0a5b55	external_corpus_mirror								bergmann2018metalab	10.1111/cdev.13079	https://doi.org/10.1111/cdev.13079	Promoting Replicability in Developmental Research Through Meta-analyses: Insights From Language Acquisition Research	https://doi.org/10.1111/cdev.13079	10.1037/0012-1649.25.6.954	Imitation in newborn infants: Exploring the range of gestures imitated and the underlying mechanisms.		1.000	title_year_journal	candidate_high_similarity	https://api.crossref.org/works?rows=1&query.bibliographic=Meltzoff%2C+A.+N.%2C+%26+Moore%2C+M.+K.+%281989%29.+Imitation+in+newborn+infants%3A+Exploring+the+range+of+gestures+imitated+and+the+underlying+mechanisms.+Developmental+Psychology%2C+25%2C+954%C3%B1962+1989.0	https://doi.org/10.1037/0012-1649.25.6.954	crossref_doi	represented_work_crossref_resolved	literal_number_from_external_corpus_mirror	not_yet	Real-world handle found, but the numeric result still needs original/source verification.	4	target_source_independently_grounded	false	false	true	true	true	false
sr_81dcacb19b9f	Computer-Assisted Remedial Reading Intervention For School Beginners At Risk For Reading Disability	DARPA SCORE / COS claims	candidate_child_numeric_row	coded_with_schema_gaps	data/raw/corpus_candidates/score/extracted_claims.csv	a86ba837b95738f3cb6d876cd9b0ab86db540208fb8eb89c0fa2d5f47829f60a	external_corpus_mirror	10.1111/j.1467-8624.2011.01580.x							tyner2026	10.31222/osf.io/b7x8f_v1	https://doi.org/10.31222/osf.io/b7x8f\_v1	Investigating the replicability of the social and behavioural sciences	https://doi.org/10.31222/osf.io/b7x8f_v1						not_needed_or_not_attempted		https://doi.org/10.1111/j.1467-8624.2011.01580.x	doi	represented_work_identifier_in_source_row	literal_number_from_external_corpus_mirror	not_yet	Real-world handle found, but the numeric result still needs original/source verification.	4	target_source_independently_grounded	false	false	true	true	true	false
