dedupe_baseline_id	candidate_id	candidate_name	candidate_route	final_row_status	dedupe_action	original_title	original_doi	replication_title	replication_doi	result_option_labels	current_root_pair_ids	current_root_source_datasets	value_scan_ids	scan_decisions	dedupe_key_text	source_object_urls_json	created_at
dedupe_6428215e6b55ebdd	api_candidate_e1d480fa16f7df49	unresolved original target -> Investigating Variation in Replicability	coverage_only	already_in_current_root_table	skip_exact_pair_already_represented			Investigating Variation in Replicability	10.1027/1864-9335/a000178		fig1_pair_22a4bfe5b457b4f6|fig1_pair_3c228006a3c4d3f6|fig1_pair_441b71be37e980c3|fig1_pair_5db7bea39f1909a0|fig1_pair_708e77c18ece2614|fig1_pair_7e929be3dc70bd91|fig1_pair_c937d9ffb68530f5|fig1_pair_e89e177a49170690|fig1_pair_ea811f90b8396f2d|fig1_pair_f717b40f12d4d366|fig1_pair_fa30b157dd6d5beb	FReD filtered pair table			10 1027 1864 9335 a000178 investigating variation in replicability unresolved original target investigating variation in replicability	"[""https://doi.org/10.1027/1864-9335/a000178"", ""http://eprints.lse.ac.uk/65158/1/__lse.ac.uk_storage_LIBRARY_Secondary_libfile_shared_repository_Content_Kappes%2C%20H_Investigating%20variation_Kappes_Investigating%20variation_2016.pdf"", ""https://orcid.org/0000-0002-6335-3888>,"", ""http://hdl.handle.net/2066/131506"", ""https://hdl.handle.net/2066/131506"", ""https://pure.uvt.nl/ws/files/3053309/SP_Ijzerman_investigating_SP_2014.pdf"", ""https://research.tilburguniversity.edu/en/publications/a53e2ea1-bea5-447d-8f4d-8d89eb640448"", ""http://hdl.handle.net/10211.3/204641"", ""http://osf.io/project/WX7Ck"", ""https://openalex.org/W1941783251""]"	2026-05-06T03:12:07+00:00
dedupe_1e46dd42c8dc4622	api_candidate_9db26ff9b8058473	Effects on Social and Food Judgments -> Priming of Social Distance? Failure to Replicate Effects on Social and Food Judgments	coverage_only	not_row_rejected_after_value_scan	skip_under_current_figure1_policy	Effects on Social and Food Judgments		Priming of Social Distance? Failure to Replicate Effects on Social and Food Judgments	10.1371/journal.pone.0042510	Social-distance priming Study 1 near-versus-far food-judgment replication			batch003_notrow_social_distance_study1_policy	not_row_replication_n_not_larger_or_original_effect_missing	10 1371 journal pone 0042510 effects on social and food judgments priming of social distance failure to replicate effects on social and food judgments effects on social and food judgments priming of social distance failure to replicate effects on social and food judgments	"[""https://journals.plos.org/plosone/article/file?id=10.1371/journal.pone.0042510&type=printable"", ""https://doi.org/10.1371/journal.pone.0042510"", ""https://pubmed.ncbi.nlm.nih.gov/22952597"", ""http://citeseerx.ist.psu.edu/viewdoc/summary?doi=10.1.1.776.7525"", ""https://journals.plos.org/plosone/article?id=10.1371/journal.pone.0042510"", ""https://doaj.org/article/e8e46da29cce40e8a55999b5cda66f5d"", ""https://www.ncbi.nlm.nih.gov/pmc/articles/3430642"", ""https://openalex.org/W2106777508""]"	2026-05-06T03:12:07+00:00
dedupe_9747b3907a25329c	api_candidate_2510abd248029365	unresolved original target -> Two Failures to Replicate High-Performance-Goal Priming Effects	coverage_only	already_in_current_root_table	skip_exact_pair_already_represented			Two Failures to Replicate High-Performance-Goal Priming Effects	10.1371/journal.pone.0072467		fig1_pair_d296a67b1df1c9c1	Individual replication paper value scan			10 1371 journal pone 0072467 two failures to replicate high performance goal priming effects unresolved original target two failures to replicate high performance goal priming effects	"[""https://journals.plos.org/plosone/article/file?id=10.1371/journal.pone.0072467&type=printable"", ""https://doi.org/10.1371/journal.pone.0072467"", ""https://pubmed.ncbi.nlm.nih.gov/23977304"", ""https://journals.plos.org/plosone/article?id=10.1371/journal.pone.0072467"", ""https://doaj.org/article/6f59e7d3802b42108cf3c50cc4da11ed"", ""https://www.ncbi.nlm.nih.gov/pmc/articles/3745413"", ""https://openalex.org/W2156734073""]"	2026-05-06T03:12:07+00:00
dedupe_b69e7169ef3a47bd	api_candidate_f3e7061d478e1e53	unresolved original target -> Is there a Publication Bias in Behavioural Intranasal Oxytocin Research on Humans? Opening the File Drawer of One Laboratory	coverage_only	not_row_rejected_seed_or_non_pair	skip_seed_or_non_pair			Is there a Publication Bias in Behavioural Intranasal Oxytocin Research on Humans? Opening the File Drawer of One Laboratory	10.1111/jne.12384						10 1111 jne 12384 is there a publication bias in behavioural intranasal oxytocin research on humans opening the file drawer of one laboratory unresolved original target is there a publication bias in behavioural intranasal oxytocin research on humans opening the file drawer of one laboratory	"[""https://doi.org/10.1111/jne.12384"", ""https://pubmed.ncbi.nlm.nih.gov/26991328"", ""https://resolver.caltech.edu/CaltechAUTHORS:20160321-103005344"", ""https://authors.library.caltech.edu/65528/2/jne12384-sup-0001-AppendixS1.docx"", ""http://hdl.handle.net/2078.1/170508"", ""https://openalex.org/W2300073160""]"	2026-05-06T03:12:07+00:00
dedupe_cba64711cfc2f272	api_candidate_78899310c37a23ff	Oxytocin Effects on Trust -> Failed Replication of Oxytocin Effects on Trust: The Envelope Task Case	coverage_only	already_in_current_root_table	skip_exact_pair_already_represented	Oxytocin Effects on Trust		Failed Replication of Oxytocin Effects on Trust: The Envelope Task Case	10.1371/journal.pone.0137000		fig1_pair_48321f50417489a1	Individual replication paper value scan			10 1371 journal pone 0137000 oxytocin effects on trust failed replication of oxytocin effects on trust the envelope task case oxytocin effects on trust failed replication of oxytocin effects on trust the envelope task case	"[""https://journals.plos.org/plosone/article/file?id=10.1371/journal.pone.0137000&type=printable"", ""https://doi.org/10.1371/journal.pone.0137000"", ""https://pubmed.ncbi.nlm.nih.gov/26368396"", ""https://journals.plos.org/plosone/article?id=10.1371/journal.pone.0137000"", ""http://hdl.handle.net/2078.1/165103"", ""http://hdl.handle.net/2078.1/170511"", ""http://hdl.handle.net/2078.1/170920"", ""https://doaj.org/article/141551d430c6428dbe87fc7c3aba2204"", ""https://www.ncbi.nlm.nih.gov/pmc/articles/4569325"", ""https://openalex.org/W1846667482""]"	2026-05-06T03:12:07+00:00
dedupe_7038e388b78d70e9	api_candidate_dfaca8efbd8c31d7	the Predictive Validity of the Suicide–Implicit Association Test -> Forecasting a Fatal Decision: Direct Replication of the Predictive Validity of the Suicide–Implicit Association Test	coverage_only	not_row_rejected_after_value_scan	skip_under_current_figure1_policy	the Predictive Validity of the Suicide–Implicit Association Test		Forecasting a Fatal Decision: Direct Replication of the Predictive Validity of the Suicide–Implicit Association Test	10.1177/0956797619893062	Suicide-IAT predictive-validity direct replication			batch004_notrow_suicide_iat_prognostic_native	not_row_native_prognostic_validity_no_current_d_route	10 1177 0956797619893062 the predictive validity of the suicide implicit association test forecasting a fatal decision direct replication of the predictive validity of the suicide implicit association test the predictive validity of the suicide implicit association test forecasting a fatal decision direct replication of the predictive validity of the suicide implicit association test	"[""https://doi.org/10.1177/0956797619893062"", ""https://pubmed.ncbi.nlm.nih.gov/31825760"", ""https://hal.science/hal-02440256/document"", ""https://hal.science/hal-02440256"", ""https://openalex.org/W2995835788""]"	2026-05-06T03:12:07+00:00
dedupe_fdad138458084fd4	api_candidate_561f7e73dce87e5b	unresolved original target -> The CASA theory no longer applies to desktop computers	coverage_only	not_row_rejected_or_duplicate	manual_review_before_repull			The CASA theory no longer applies to desktop computers	10.1038/s41598-023-46527-9						10 1038 s41598 023 46527 9 the casa theory no longer applies to desktop computers unresolved original target the casa theory no longer applies to desktop computers	"[""https://www.nature.com/articles/s41598-023-46527-9.pdf"", ""https://doi.org/10.1038/s41598-023-46527-9"", ""https://pubmed.ncbi.nlm.nih.gov/37952037"", ""https://pmc.ncbi.nlm.nih.gov/articles/PMC10640629/pdf/41598_2023_Article_46527.pdf"", ""https://www.ncbi.nlm.nih.gov/pmc/articles/10640629"", ""https://repository.ubn.ru.nl//bitstream/handle/2066/301737/301737.pdf"", ""https://hdl.handle.net/2066/301737"", ""https://doaj.org/article/06b5ccc69bba45b6a2352460c85342bf"", ""https://openalex.org/W4388592748""]"	2026-05-06T03:12:07+00:00
dedupe_4b6e06443cfca5c4	api_candidate_eaa8a0f32f7aab10	unresolved original target -> Direct Replication and Additional Sensitivity and Robustness Analyses for Frederiksen (2022): A Replication Report from the Nottingham Replication Games	coverage_only	not_row_rejected_or_duplicate	manual_review_before_repull			Direct Replication and Additional Sensitivity and Robustness Analyses for Frederiksen (2022): A Replication Report from the Nottingham Replication Games	10.2139/ssrn.4437368						10 2139 ssrn 4437368 direct replication and additional sensitivity and robustness analyses for frederiksen 2022 a replication report from the nottingham replication games unresolved original target direct replication and additional sensitivity and robustness analyses for frederiksen 2022 a replication report from the nottingham replication games	"[""https://doi.org/10.2139/ssrn.4437368""]"	2026-05-06T03:12:07+00:00
dedupe_9b5869a80fbde106	api_candidate_5b170b3d5b414951	unresolved original target -> Kinds of Replication: Examining the Meanings of “Conceptual Replication” and “Direct Replication”	coverage_only	not_row_rejected_seed_or_non_pair	skip_seed_or_non_pair			Kinds of Replication: Examining the Meanings of “Conceptual Replication” and “Direct Replication”	10.1177/17456916211041116						10 1177 17456916211041116 kinds of replication examining the meanings of conceptual replication and direct replication unresolved original target kinds of replication examining the meanings of conceptual replication and direct replication	"[""https://doi.org/10.1177/17456916211041116""]"	2026-05-06T03:12:07+00:00
dedupe_874d402dd1b9592a	api_candidate_30df9bd015197ff3	unresolved original target -> Replication matters: Advances in Translational Research's commitment to Direct Replication Studies	coverage_only	not_row_rejected_seed_or_non_pair	skip_seed_or_non_pair			Replication matters: Advances in Translational Research's commitment to Direct Replication Studies	10.1556/1661.2025.00102						10 1556 1661 2025 00102 replication matters advances in translational research s commitment to direct replication studies unresolved original target replication matters advances in translational research s commitment to direct replication studies	"[""https://doi.org/10.1556/1661.2025.00102""]"	2026-05-06T03:12:07+00:00
dedupe_4b3fc6724a44445e	api_candidate_00a1031c6c027f6a	Pickett and Baker (2014) -> The Pragmatic American Revisited: A Direct Replication of Pickett and Baker (2014)	coverage_only	already_in_current_root_table	skip_exact_pair_already_represented	Pickett and Baker (2014)		The Pragmatic American Revisited: A Direct Replication of Pickett and Baker (2014)	10.21428/cb6ab371.ea00ca58		fig1_pair_61eaf2dbf15d5d0a				10 21428 cb6ab371 ea00ca58 pickett and baker 2014 the pragmatic american revisited a direct replication of pickett and baker 2014 pickett and baker 2014 the pragmatic american revisited a direct replication of pickett and baker 2014	"[""https://doi.org/10.21428/cb6ab371.ea00ca58""]"	2026-05-06T03:12:07+00:00
dedupe_0ac7e4100d93d110	api_candidate_da16e390f5f2516a	Pickett and Baker (2014) -> The Pragmatic American Revisited: A Direct Replication of Pickett and Baker (2014)	coverage_only	already_in_current_root_table	skip_exact_pair_already_represented	Pickett and Baker (2014)		The Pragmatic American Revisited: A Direct Replication of Pickett and Baker (2014)	10.21428/cb6ab371.c346e3b9		fig1_pair_61eaf2dbf15d5d0a				10 21428 cb6ab371 c346e3b9 pickett and baker 2014 the pragmatic american revisited a direct replication of pickett and baker 2014 pickett and baker 2014 the pragmatic american revisited a direct replication of pickett and baker 2014	"[""https://doi.org/10.21428/cb6ab371.c346e3b9""]"	2026-05-06T03:12:07+00:00
dedupe_1fe7a73a9155a5ff	api_candidate_c482b68e388efb4c	porcine circovirus type 1 -> Regeneration of the replication-associated proteins tandem direct repeat recognition nucleotide sequence at the origin of DNA replication of porcine circovirus type 1	coverage_only	not_row_rejected_after_value_scan	skip_under_current_figure1_policy	porcine circovirus type 1		Regeneration of the replication-associated proteins tandem direct repeat recognition nucleotide sequence at the origin of DNA replication of porcine circovirus type 1	10.1016/j.virol.2005.10.004	Porcine circovirus origin-of-replication sequence recognition			batch002_notrow_porcine_circovirus_molecular_sequence	not_row_reject_molecular_sequence_mechanism_not_effect_pair	10 1016 j virol 2005 10 004 porcine circovirus type 1 regeneration of the replication associated proteins tandem direct repeat recognition nucleotide sequence at the origin of dna replication of porcine circovirus type 1 porcine circovirus type 1 regeneration of the replication associated proteins tandem direct repeat recognition nucleotide sequence at the origin of dna replication of porcine circovirus type 1	"[""https://doi.org/10.1016/j.virol.2005.10.004""]"	2026-05-06T03:12:07+00:00
dedupe_c9629420fbd6463c	api_candidate_33fc74a340d30a53	unresolved original target -> Investigation of direct replication techniques on periodic multilayers	coverage_only	not_row_rejected_or_duplicate	manual_review_before_repull			Investigation of direct replication techniques on periodic multilayers	10.1117/1.3609797						10 1117 1 3609797 investigation of direct replication techniques on periodic multilayers unresolved original target investigation of direct replication techniques on periodic multilayers	"[""https://doi.org/10.1117/1.3609797""]"	2026-05-06T03:12:07+00:00
dedupe_528a5eff86af0c25	api_candidate_b69b48c6b5202546	unresolved original target -> Direct replication and clinical psychological science	coverage_only	not_row_rejected_or_duplicate	manual_review_before_repull			Direct replication and clinical psychological science	10.1017/s0140525x18000754						10 1017 s0140525x18000754 direct replication and clinical psychological science unresolved original target direct replication and clinical psychological science	"[""https://doi.org/10.1017/s0140525x18000754""]"	2026-05-06T03:12:07+00:00
dedupe_c23a466d234f91e8	api_candidate_e93d5e20d7b766a7	Plasmid pIJ101 in Streptomyces lividans -> Sequences Essential for Replication of Plasmid pIJ101 in Streptomyces lividans	coverage_only	not_row_rejected_after_value_scan	skip_under_current_figure1_policy	Plasmid pIJ101 in Streptomyces lividans		Sequences Essential for Replication of Plasmid pIJ101 in Streptomyces lividans	10.1006/plas.1995.1020	Plasmid pIJ101 molecular replication sequence			batch003_notrow_plasmid_pij101_molecular_replication	not_row_reject_molecular_replication_mechanism	10 1006 plas 1995 1020 plasmid pij101 in streptomyces lividans sequences essential for replication of plasmid pij101 in streptomyces lividans plasmid pij101 in streptomyces lividans sequences essential for replication of plasmid pij101 in streptomyces lividans	"[""https://doi.org/10.1006/plas.1995.1020""]"	2026-05-06T03:12:07+00:00
dedupe_7cfbd544758d496c	api_candidate_ccb2301b1827be82	unresolved original target -> Mechanisms of direct replication restart at stressed replisomes	coverage_only	not_row_rejected_or_duplicate	manual_review_before_repull			Mechanisms of direct replication restart at stressed replisomes	10.1016/j.dnarep.2020.102947						10 1016 j dnarep 2020 102947 mechanisms of direct replication restart at stressed replisomes unresolved original target mechanisms of direct replication restart at stressed replisomes	"[""https://doi.org/10.1016/j.dnarep.2020.102947""]"	2026-05-06T03:12:07+00:00
dedupe_cd215ed014f70ffc	api_candidate_f618ec94840bd7eb	unresolved original target -> Supplemental Material for The Prevalence of Direct Replication Articles in Top-Ranking Psychology Journals	coverage_only	not_row_rejected_seed_or_non_pair	skip_seed_or_non_pair			Supplemental Material for The Prevalence of Direct Replication Articles in Top-Ranking Psychology Journals	10.1037/amp0001385.supp						10 1037 amp0001385 supp supplemental material for the prevalence of direct replication articles in top ranking psychology journals unresolved original target supplemental material for the prevalence of direct replication articles in top ranking psychology journals	"[""https://doi.org/10.1037/amp0001385.supp""]"	2026-05-06T03:12:07+00:00
dedupe_e0c231fc8a410c4d	api_candidate_9706339e8a624a3e	tandem genes in Drosophila -> Evidence for rolling circle replication of tandem genes in Drosophila	coverage_only	not_row_rejected_after_value_scan	skip_under_current_figure1_policy	tandem genes in Drosophila		Evidence for rolling circle replication of tandem genes in Drosophila	10.1093/nar/gki764	Rolling-circle replication of tandem genes in Drosophila			batch004_notrow_tandem_genes_molecular_replication	not_row_reject_molecular_replication_mechanism	10 1093 nar gki764 tandem genes in drosophila evidence for rolling circle replication of tandem genes in drosophila tandem genes in drosophila evidence for rolling circle replication of tandem genes in drosophila	"[""https://doi.org/10.1093/nar/gki764""]"	2026-05-06T03:12:07+00:00
dedupe_ebbd3f6bbb413dcd	api_candidate_77398a2c8e043ed1	Mortality Salience Effect With and Without Original Author Involvement -> Many Labs 4: Failure to Replicate Mortality Salience Effect With and Without Original Author Involvement	coverage_only	not_row_rejected_or_duplicate	manual_review_before_repull	Mortality Salience Effect With and Without Original Author Involvement		Many Labs 4: Failure to Replicate Mortality Salience Effect With and Without Original Author Involvement	10.1525/collabra.35271						10 1525 collabra 35271 mortality salience effect with and without original author involvement many labs 4 failure to replicate mortality salience effect with and without original author involvement mortality salience effect with and without original author involvement many labs 4 failure to replicate mortality salience effect with and without original author involvement	"[""https://online.ucpress.edu/collabra/article-pdf/8/1/35271/662625/collabra_2022_8_1_35271.pdf"", ""https://doi.org/10.1525/collabra.35271"", ""https://openalex.org/W4225656869""]"	2026-05-06T03:12:07+00:00
dedupe_333ccc69cafccab2	api_candidate_57a84c07c9be2d2e	unresolved original target -> No evidence for unethical amnesia for imagined actions: A failed replication and extension	coverage_only	not_row_rejected_or_duplicate	manual_review_before_repull			No evidence for unethical amnesia for imagined actions: A failed replication and extension	10.3758/s13421-018-0803-y						10 3758 s13421 018 0803 y no evidence for unethical amnesia for imagined actions a failed replication and extension unresolved original target no evidence for unethical amnesia for imagined actions a failed replication and extension	"[""https://link.springer.com/content/pdf/10.3758/s13421-018-0803-y.pdf"", ""https://doi.org/10.3758/s13421-018-0803-y"", ""https://pubmed.ncbi.nlm.nih.gov/29532400"", ""http://api.osf.io/v2/nodes/haegq/"", ""http://osf.io/haegq/"", ""https://osf.io/haegq"", ""https://openalex.org/W2791057285""]"	2026-05-06T03:12:07+00:00
dedupe_7fb1452e4a171181	api_candidate_2f615658dde21b4e	unresolved original target -> Infants’ perception of goal-directed actions: A multi-lab replication reveals that infants anticipate paths and not goals	coverage_only	not_row_rejected_or_duplicate	manual_review_before_repull			Infants’ perception of goal-directed actions: A multi-lab replication reveals that infants anticipate paths and not goals	10.1016/j.infbeh.2019.101340						10 1016 j infbeh 2019 101340 infants perception of goal directed actions a multi lab replication reveals that infants anticipate paths and not goals unresolved original target infants perception of goal directed actions a multi lab replication reveals that infants anticipate paths and not goals	"[""https://doi.org/10.1016/j.infbeh.2019.101340"", ""https://pubmed.ncbi.nlm.nih.gov/31387059"", ""https://www.zora.uzh.ch/id/eprint/180832/1/1-s2.0-S0163638318301346-main.pdf"", ""http://hdl.handle.net/21.11116/0000-0004-A3F2-2"", ""http://hdl.handle.net/20.500.11850/381405"", ""https://doi.org/10.3929/ethz-b-000381405"", ""https://doi.org/10.5167/uzh-180832"", ""https://openalex.org/W2966515407""]"	2026-05-06T03:12:07+00:00
dedupe_e564eb0a68be59f5	api_candidate_6c465f7f2bf7618a	unresolved original target -> Can race really be erased? A pre-registered replication study	coverage_only	not_row_rejected_or_duplicate	manual_review_before_repull			Can race really be erased? A pre-registered replication study	10.3389/fpsyg.2014.01035						10 3389 fpsyg 2014 01035 can race really be erased a pre registered replication study unresolved original target can race really be erased a pre registered replication study	"[""https://www.frontiersin.org/articles/10.3389/fpsyg.2014.01035/pdf"", ""https://doi.org/10.3389/fpsyg.2014.01035"", ""https://pubmed.ncbi.nlm.nih.gov/25278922"", ""https://lirias.kuleuven.be/handle/123456789/462507"", ""https://doaj.org/article/d82adc71a6984bc9bbaa162a8d04d557"", ""https://www.ncbi.nlm.nih.gov/pmc/articles/4165323"", ""https://openalex.org/W1972863007""]"	2026-05-06T03:12:07+00:00
dedupe_b361540dc76a7903	api_candidate_1643fbb013b2f857	unresolved original target -> A creative destruction approach to replication: Implicit work and sex morality across cultures	coverage_only	not_row_rejected_or_duplicate	manual_review_before_repull			A creative destruction approach to replication: Implicit work and sex morality across cultures	10.1016/j.jesp.2020.104060						10 1016 j jesp 2020 104060 a creative destruction approach to replication implicit work and sex morality across cultures unresolved original target a creative destruction approach to replication implicit work and sex morality across cultures	"[""https://www.sciencedirect.com/science/article/pii/S0022103120304005?via%3Dihub"", ""https://doi.org/10.1016/j.jesp.2020.104060"", ""https://research.rug.nl/en/publications/f08965b3-b38f-42e1-9b61-eefd746318fc"", ""https://research.rug.nl/en/publications/145671b5-a896-4e09-8e2f-8a7907229cc1"", ""https://eprints.keele.ac.uk/9996/1/1-s2.0-S0022103120304005-main.pdf"", ""http://dro.dur.ac.uk/33048/"", ""https://digitalcommons.ithaca.edu/scopus_articles/9"", ""https://hal.science/hal-03492735"", ""https://dare.uva.nl/personal/pure/en/publications/a-creative-destruction-approach-to-replication-implicit-work-and-sex-morality-across-cultures(45329e60-9427-41c5-9118-f1ad6cb745ac).html"", ""https://figshare.com/articles/journal_contribution/A_creative_destruction_approach_to_replication_Implicit_work_and_sex_morality_across_cultures/14215940"", ""http://hdl.handle.net/10026.1/19404"", ""https://research.birmingham.ac.uk/en/publications/0fe74dbe-6cc7-423d-ad91-7461327c9c56"", ""https://researchprofiles.ku.dk/da/publications/8d50582e-ad5d-458c-a189-9c00729515c8"", ""https://pure.eur.nl/en/publications/7219681d-1eee-4f2a-8965-acf38d7b1e94"", ""https://research.vu.nl/en/publications/8e5193ce-008d-4428-bb71-1e13a06987f9"", ""http://www.scopus.com/inward/record.url?scp=85097902093&partnerID=8YFLogxK"", ""https://openalex.org/W3095810629""]"	2026-05-06T03:12:07+00:00
dedupe_519a923f1eb8d14d	api_candidate_87b0df2d2fd9b39f	unresolved original target -> No effect of ‘watching eyes’: An attempted replication and extension investigating individual differences	coverage_only	not_row_rejected_or_duplicate	manual_review_before_repull			No effect of ‘watching eyes’: An attempted replication and extension investigating individual differences	10.1371/journal.pone.0255531						10 1371 journal pone 0255531 no effect of watching eyes an attempted replication and extension investigating individual differences unresolved original target no effect of watching eyes an attempted replication and extension investigating individual differences	"[""https://journals.plos.org/plosone/article/file?id=10.1371/journal.pone.0255531&type=printable"", ""https://doi.org/10.1371/journal.pone.0255531"", ""https://pubmed.ncbi.nlm.nih.gov/34613975"", ""https://eprints.kingston.ac.uk/id/eprint/49670/1/Rotella-A-49670-VoR.pdf"", ""https://journals.plos.org/plosone/article?id=10.1371/journal.pone.0255531"", ""https://doaj.org/article/1851b8a299af43df872134831bdd6b5d"", ""http://europepmc.org/pmc/articles/PMC8494318"", ""https://www.ncbi.nlm.nih.gov/pmc/articles/8494318"", ""https://openalex.org/W3201322086""]"	2026-05-06T03:12:07+00:00
