dedupe_baseline_id	candidate_id	candidate_name	candidate_route	final_row_status	dedupe_action	original_title	original_doi	replication_title	replication_doi	result_option_labels	current_root_pair_ids	current_root_source_datasets	value_scan_ids	scan_decisions	dedupe_key_text	source_object_urls_json	created_at
dedupe_bfb4d5db3d09a5ca	api_candidate_6000aff0af587ba7	unresolved original target -> Association between glucagon-like peptide-1 receptor agonists and risk of dementia in older adults with type 2 diabetes: A target trial emulation.	coverage_only	not_row_rejected_or_duplicate	manual_review_before_repull			Association between glucagon-like peptide-1 receptor agonists and risk of dementia in older adults with type 2 diabetes: A target trial emulation.	10.1111/dom.70384						10 1111 dom 70384 association between glucagon like peptide 1 receptor agonists and risk of dementia in older adults with type 2 diabetes a target trial emulation unresolved original target association between glucagon like peptide 1 receptor agonists and risk of dementia in older adults with type 2 diabetes a target trial emulation	"[""https://doi.org/10.1111/dom.70384"", ""https://pmc.ncbi.nlm.nih.gov/articles/PMC12890729/"", ""https://pubmed.ncbi.nlm.nih.gov/41424236/""]"	2026-05-06T03:12:07+00:00
dedupe_5b54131eae570274	api_candidate_38a533cdcb5c6bd0	unresolved original target -> Unsupervised Machine Learning Reveals Novel Traumatic Brain Injury Patient Phenotypes with Distinct Acute Injury Profiles and Long-Term Outcomes.	coverage_only	not_row_rejected_or_duplicate	manual_review_before_repull			Unsupervised Machine Learning Reveals Novel Traumatic Brain Injury Patient Phenotypes with Distinct Acute Injury Profiles and Long-Term Outcomes.	10.1089/neu.2019.6705						10 1089 neu 2019 6705 unsupervised machine learning reveals novel traumatic brain injury patient phenotypes with distinct acute injury profiles and long term outcomes unresolved original target unsupervised machine learning reveals novel traumatic brain injury patient phenotypes with distinct acute injury profiles and long term outcomes	"[""https://doi.org/10.1089/neu.2019.6705"", ""https://pmc.ncbi.nlm.nih.gov/articles/PMC7249479/"", ""https://pubmed.ncbi.nlm.nih.gov/32008422/""]"	2026-05-06T03:12:07+00:00
dedupe_ed07d2a093c04a34	api_candidate_804fc8b002ac898b	unresolved original target -> Vaccines for preventing infection with Pseudomonas aeruginosa in cystic fibrosis.	coverage_only	not_row_rejected_or_duplicate	manual_review_before_repull			Vaccines for preventing infection with Pseudomonas aeruginosa in cystic fibrosis.	10.1002/14651858.cd001399.pub4						10 1002 14651858 cd001399 pub4 vaccines for preventing infection with pseudomonas aeruginosa in cystic fibrosis unresolved original target vaccines for preventing infection with pseudomonas aeruginosa in cystic fibrosis	"[""https://doi.org/10.1002/14651858.cd001399.pub4"", ""https://pmc.ncbi.nlm.nih.gov/articles/PMC7055511/"", ""https://pubmed.ncbi.nlm.nih.gov/26298311/""]"	2026-05-06T03:12:07+00:00
dedupe_8d74922235e525d5	api_candidate_62872a0730bff4c1	unresolved original target -> Thoracic epidural analgesia in intensive care unit patients with acute pancreatitis: the EPIPAN multicenter randomized controlled trial.	coverage_only	not_row_rejected_or_duplicate	manual_review_before_repull			Thoracic epidural analgesia in intensive care unit patients with acute pancreatitis: the EPIPAN multicenter randomized controlled trial.	10.1186/s13054-023-04502-w						10 1186 s13054 023 04502 w thoracic epidural analgesia in intensive care unit patients with acute pancreatitis the epipan multicenter randomized controlled trial unresolved original target thoracic epidural analgesia in intensive care unit patients with acute pancreatitis the epipan multicenter randomized controlled trial	"[""https://doi.org/10.1186/s13054-023-04502-w"", ""https://pmc.ncbi.nlm.nih.gov/articles/PMC10230742/"", ""https://pubmed.ncbi.nlm.nih.gov/37259157/""]"	2026-05-06T03:12:07+00:00
dedupe_5fff8597b4407214	api_candidate_9a85abcabde97cdc	unresolved original target -> Fluid Management in Sepsis.	coverage_only	not_row_rejected_or_duplicate	manual_review_before_repull			Fluid Management in Sepsis.	10.1177/0885066618784861						10 1177 0885066618784861 fluid management in sepsis unresolved original target fluid management in sepsis	"[""https://doi.org/10.1177/0885066618784861"", ""https://pmc.ncbi.nlm.nih.gov/articles/PMC6532631/"", ""https://pubmed.ncbi.nlm.nih.gov/29986619/""]"	2026-05-06T03:12:07+00:00
dedupe_39b1f49cf0499dad	api_candidate_a5ede59a1099816b	unresolved original target -> Noninvasive inhaled nitric oxide does not prevent bronchopulmonary dysplasia in premature newborns.	coverage_only	not_row_rejected_or_duplicate	manual_review_before_repull			Noninvasive inhaled nitric oxide does not prevent bronchopulmonary dysplasia in premature newborns.	10.1016/j.jpeds.2014.06.018						10 1016 j jpeds 2014 06 018 noninvasive inhaled nitric oxide does not prevent bronchopulmonary dysplasia in premature newborns unresolved original target noninvasive inhaled nitric oxide does not prevent bronchopulmonary dysplasia in premature newborns	"[""https://doi.org/10.1016/j.jpeds.2014.06.018"", ""https://pmc.ncbi.nlm.nih.gov/articles/PMC4464845/"", ""https://pubmed.ncbi.nlm.nih.gov/25063725/""]"	2026-05-06T03:12:07+00:00
dedupe_477d6568f19e604d	api_candidate_856c767fbc3f6dfe	unresolved original target -> Endogenous antioxidants predicted outcome and increased after treatment: A benzoate dose-finding, randomized, double-blind, placebo-controlled trial for Alzheimer's disease.	coverage_only	not_row_rejected_or_duplicate	manual_review_before_repull			Endogenous antioxidants predicted outcome and increased after treatment: A benzoate dose-finding, randomized, double-blind, placebo-controlled trial for Alzheimer's disease.	10.1111/pcn.13504						10 1111 pcn 13504 endogenous antioxidants predicted outcome and increased after treatment a benzoate dose finding randomized double blind placebo controlled trial for alzheimer s disease unresolved original target endogenous antioxidants predicted outcome and increased after treatment a benzoate dose finding randomized double blind placebo controlled trial for alzheimer s disease	"[""https://doi.org/10.1111/pcn.13504"", ""https://pmc.ncbi.nlm.nih.gov/articles/PMC10099492/"", ""https://pubmed.ncbi.nlm.nih.gov/36335573/""]"	2026-05-06T03:12:07+00:00
dedupe_dcf243cdd1a80885	api_candidate_caee3ace1c68c4e3	unresolved original target -> Tobacco dependence treatment in the emergency department: A randomized trial using the Multiphase Optimization Strategy.	coverage_only	not_row_rejected_or_duplicate	manual_review_before_repull			Tobacco dependence treatment in the emergency department: A randomized trial using the Multiphase Optimization Strategy.	10.1016/j.cct.2017.12.016						10 1016 j cct 2017 12 016 tobacco dependence treatment in the emergency department a randomized trial using the multiphase optimization strategy unresolved original target tobacco dependence treatment in the emergency department a randomized trial using the multiphase optimization strategy	"[""https://doi.org/10.1016/j.cct.2017.12.016"", ""https://pmc.ncbi.nlm.nih.gov/articles/PMC5851600/"", ""https://pubmed.ncbi.nlm.nih.gov/29287665/""]"	2026-05-06T03:12:07+00:00
dedupe_1e304b5f07f05a1a	api_candidate_3b68b1c7113eed7e	unresolved original target -> Replication in Genome-Wide Association Studies	coverage_only	not_row_rejected_or_duplicate	manual_review_before_repull			Replication in Genome-Wide Association Studies	10.1214/09-sts290						10 1214 09 sts290 replication in genome wide association studies unresolved original target replication in genome wide association studies	"[""https://projecteuclid.org/journals/statistical-science/volume-24/issue-4/Replication-in-Genome-Wide-Association-Studies/10.1214/09-STS290.pdf"", ""https://doi.org/10.1214/09-sts290"", ""https://pubmed.ncbi.nlm.nih.gov/20454541"", ""https://arxiv.org/pdf/1010.5095"", ""http://arxiv.org/abs/1010.5095"", ""http://projecteuclid.org/euclid.ss/1271770349"", ""https://www.ncbi.nlm.nih.gov/pmc/articles/2865141"", ""https://openalex.org/W2086702905""]"	2026-05-06T03:12:07+00:00
dedupe_99a434adf753e216	api_candidate_82f4a34ce6636a71	a Genetic Association May Provide Important Clues About Genetic Architecture -> Failure to Replicate a Genetic Association May Provide Important Clues About Genetic Architecture	coverage_only	not_row_rejected_after_value_scan	skip_under_current_figure1_policy	a Genetic Association May Provide Important Clues About Genetic Architecture		Failure to Replicate a Genetic Association May Provide Important Clues About Genetic Architecture	10.1371/journal.pone.0005639	Failure to replicate a genetic association			batch003_notrow_genetics_association_native_batch	not_row_native_genetic_association_no_current_d_route	10 1371 journal pone 0005639 a genetic association may provide important clues about genetic architecture failure to replicate a genetic association may provide important clues about genetic architecture a genetic association may provide important clues about genetic architecture failure to replicate a genetic association may provide important clues about genetic architecture	"[""https://journals.plos.org/plosone/article/file?id=10.1371/journal.pone.0005639&type=printable"", ""https://doi.org/10.1371/journal.pone.0005639"", ""https://pubmed.ncbi.nlm.nih.gov/19503614"", ""https://journals.plos.org/plosone/article?id=10.1371/journal.pone.0005639"", ""https://doaj.org/article/f4ef53a8701d428ebd7cd3b0aef7ae99"", ""https://figshare.com/articles/dataset/Failure_to_Replicate_a_Genetic_Association_May_Provide_Important_Clues_About_Genetic_Architecture/147451"", ""https://www.ncbi.nlm.nih.gov/pmc/articles/2685469"", ""https://openalex.org/W2076011171""]"	2026-05-06T03:12:07+00:00
dedupe_22cd2a455a89dfdc	api_candidate_b0a5218ee73e9cad	unresolved original target -> Schizophrenia Polygenic Risk Score as a Predictor of Antipsychotic Efficacy in First-Episode Psychosis	coverage_only	not_row_rejected_or_duplicate	manual_review_before_repull			Schizophrenia Polygenic Risk Score as a Predictor of Antipsychotic Efficacy in First-Episode Psychosis	10.1176/appi.ajp.2018.17121363						10 1176 appi ajp 2018 17121363 schizophrenia polygenic risk score as a predictor of antipsychotic efficacy in first episode psychosis unresolved original target schizophrenia polygenic risk score as a predictor of antipsychotic efficacy in first episode psychosis	"[""https://ajp.psychiatryonline.org/doi/pdf/10.1176/appi.ajp.2018.17121363"", ""https://doi.org/10.1176/appi.ajp.2018.17121363"", ""https://pubmed.ncbi.nlm.nih.gov/30392411"", ""https://www.ncbi.nlm.nih.gov/pmc/articles/6461047"", ""https://dspace.library.uu.nl/handle/1874/388048"", ""https://openalex.org/W2899876723""]"	2026-05-06T03:12:07+00:00
dedupe_eb6bbc0dc60c863c	api_candidate_3008e1baf5eb4ed9	unresolved original target -> A two-stage genome-wide association study of sporadic amyotrophic lateral sclerosis	coverage_only	not_row_rejected_or_duplicate	manual_review_before_repull			A two-stage genome-wide association study of sporadic amyotrophic lateral sclerosis	10.1093/hmg/ddp059						10 1093 hmg ddp059 a two stage genome wide association study of sporadic amyotrophic lateral sclerosis unresolved original target a two stage genome wide association study of sporadic amyotrophic lateral sclerosis	"[""https://academic.oup.com/hmg/article-pdf/18/8/1524/17249029/ddp059.pdf"", ""https://doi.org/10.1093/hmg/ddp059"", ""https://pubmed.ncbi.nlm.nih.gov/19193627"", ""http://hdl.handle.net/10447/71826"", ""http://discovery.ucl.ac.uk/126626/"", ""http://discovery.ucl.ac.uk/19935/"", ""http://hdl.handle.net/11567/293886"", ""http://hdl.handle.net/11380/1237916"", ""http://hdl.handle.net/10447/50610"", ""http://hmg.oxfordjournals.org/cgi/content/short/18/8/1524"", ""https://push-zb.helmholtz-muenchen.de/frontdoor.php?source_opus=2243"", ""https://ora.ox.ac.uk/objects/uuid:3fcf025c-23d0-4ac8-b0fb-6ef8a00b2cd8"", ""https://www.ncbi.nlm.nih.gov/pmc/articles/2664150"", ""http://hdl.handle.net/11365/24455"", ""https://openalex.org/W2152896700""]"	2026-05-06T03:12:07+00:00
dedupe_9f21047fbd84c529	api_candidate_89e6b8d0f8c82999	unresolved original target -> Genetic variants associated with sepsis-associated acute kidney injury.	coverage_only	not_row_rejected_or_duplicate	manual_review_before_repull			Genetic variants associated with sepsis-associated acute kidney injury.	10.1371/journal.pone.0311318						10 1371 journal pone 0311318 genetic variants associated with sepsis associated acute kidney injury unresolved original target genetic variants associated with sepsis associated acute kidney injury	"[""https://doi.org/10.1371/journal.pone.0311318"", ""https://pmc.ncbi.nlm.nih.gov/articles/PMC11620412/"", ""https://pubmed.ncbi.nlm.nih.gov/39636799/""]"	2026-05-06T03:12:07+00:00
dedupe_5f7f8be82e7413e0	api_candidate_339cd723a3c0cacb	unresolved original target -> Systematic druggable genome-wide Mendelian randomization identifies therapeutic targets for lung cancer.	coverage_only	not_row_rejected_or_duplicate	manual_review_before_repull			Systematic druggable genome-wide Mendelian randomization identifies therapeutic targets for lung cancer.	10.1186/s12885-024-12449-6						10 1186 s12885 024 12449 6 systematic druggable genome wide mendelian randomization identifies therapeutic targets for lung cancer unresolved original target systematic druggable genome wide mendelian randomization identifies therapeutic targets for lung cancer	"[""https://doi.org/10.1186/s12885-024-12449-6"", ""https://pmc.ncbi.nlm.nih.gov/articles/PMC11151555/"", ""https://pubmed.ncbi.nlm.nih.gov/38834983/""]"	2026-05-06T03:12:07+00:00
dedupe_4e79e179959d7b41	api_candidate_45eec60c076ca8f8	unresolved original target -> Genetic predisposition may not improve prediction of cardiac surgery-associated acute kidney injury.	coverage_only	not_row_rejected_or_duplicate	manual_review_before_repull			Genetic predisposition may not improve prediction of cardiac surgery-associated acute kidney injury.	10.3389/fgene.2023.1094908						10 3389 fgene 2023 1094908 genetic predisposition may not improve prediction of cardiac surgery associated acute kidney injury unresolved original target genetic predisposition may not improve prediction of cardiac surgery associated acute kidney injury	"[""https://doi.org/10.3389/fgene.2023.1094908"", ""https://pmc.ncbi.nlm.nih.gov/articles/PMC10133500/"", ""https://pubmed.ncbi.nlm.nih.gov/37124606/""]"	2026-05-06T03:12:07+00:00
dedupe_ec4f296c86bb69f7	api_candidate_928025b87456b484	unresolved original target -> Lack of Association of Polymorphism Located Upstream of <i>ABCA1</i> (rs2472493), in <i>FNDC3B</i> (rs7636836), and Near <i>ANKRD55</i>-<i>MAP3K1</i> Genes (rs61275591) in Primary Open-Angle Glaucoma Patients of Saudi Origin.	coverage_only	not_row_rejected_or_duplicate	manual_review_before_repull			Lack of Association of Polymorphism Located Upstream of <i>ABCA1</i> (rs2472493), in <i>FNDC3B</i> (rs7636836), and Near <i>ANKRD55</i>-<i>MAP3K1</i> Genes (rs61275591) in Primary Open-Angle Glaucoma Patients of Saudi Origin.	10.3390/genes14030704						10 3390 genes14030704 lack of association of polymorphism located upstream of i abca1 i rs2472493 in i fndc3b i rs7636836 and near i ankrd55 i i map3k1 i genes rs61275591 in primary open angle glaucoma patients of saudi origin unresolved original target lack of association of polymorphism located upstream of i abca1 i rs2472493 in i fndc3b i rs7636836 and near i ankrd55 i i map3k1 i genes rs61275591 in primary open angle glaucoma patients of saudi origin	"[""https://doi.org/10.3390/genes14030704"", ""https://pmc.ncbi.nlm.nih.gov/articles/PMC10048255/"", ""https://pubmed.ncbi.nlm.nih.gov/36980976/""]"	2026-05-06T03:12:07+00:00
dedupe_981cd5bbf5faa727	api_candidate_b7a37f63ebe1a3e6	unresolved original target -> A blood-based prognostic biomarker in IBD	coverage_only	not_row_rejected_or_duplicate	manual_review_before_repull			A blood-based prognostic biomarker in IBD	10.1136/gutjnl-2019-318343						10 1136 gutjnl 2019 318343 a blood based prognostic biomarker in ibd unresolved original target a blood based prognostic biomarker in ibd	"[""https://gut.bmj.com/content/gutjnl/68/8/1386.full.pdf"", ""https://doi.org/10.1136/gutjnl-2019-318343"", ""https://pubmed.ncbi.nlm.nih.gov/31030191"", ""http://gut.bmj.com/cgi/content/short/68/8/1386"", ""https://www.ncbi.nlm.nih.gov/pmc/articles/6691955"", ""https://rde.dspace-express.com/handle/11287/621111"", ""https://openalex.org/W2942200926""]"	2026-05-06T03:12:07+00:00
dedupe_572e1a062c47a87c	api_candidate_3e9ed825ab643ecd	unresolved original target -> A Molecular Biomarker to Diagnose Community-acquired Pneumonia on Intensive Care Unit Admission	coverage_only	not_row_rejected_or_duplicate	manual_review_before_repull			A Molecular Biomarker to Diagnose Community-acquired Pneumonia on Intensive Care Unit Admission	10.1164/rccm.201502-0355oc						10 1164 rccm 201502 0355oc a molecular biomarker to diagnose community acquired pneumonia on intensive care unit admission unresolved original target a molecular biomarker to diagnose community acquired pneumonia on intensive care unit admission	"[""https://doi.org/10.1164/rccm.201502-0355oc"", ""https://pubmed.ncbi.nlm.nih.gov/26121490"", ""https://pure.amsterdamumc.nl/ws/files/168285024/A-molecular-biomarker-to-diagnose-community-acquired-pneumonia-on-intensive-care-unit-admission.pdf"", ""https://pure.amsterdamumc.nl/en/publications/71d362fb-5756-451e-9e73-84a83d365bd0"", ""https://pure.amc.nl/en/publications/a-molecular-biomarker-to-diagnose-communityacquired-pneumonia-on-intensive-care-unit-admission(e398a19f-31a9-4a47-b621-378b4e7fe317).html"", ""https://dspace.library.uu.nl/handle/1874/331525"", ""http://dspace.library.uu.nl/handle/1874/331525"", ""https://openalex.org/W4233441564""]"	2026-05-06T03:12:07+00:00
dedupe_8f62703af078c0c0	api_candidate_250ea2ea6430916f	unresolved original target -> STROGAR – STrengthening the Reporting Of Genetic Association studies in Radiogenomics	coverage_only	not_row_rejected_or_duplicate	manual_review_before_repull			STROGAR – STrengthening the Reporting Of Genetic Association studies in Radiogenomics	10.1016/j.radonc.2013.07.011						10 1016 j radonc 2013 07 011 strogar strengthening the reporting of genetic association studies in radiogenomics unresolved original target strogar strengthening the reporting of genetic association studies in radiogenomics	"[""http://www.thegreenjournal.com/article/S0167814013003630/pdf"", ""https://doi.org/10.1016/j.radonc.2013.07.011"", ""https://pubmed.ncbi.nlm.nih.gov/23993398"", ""https://research.manchester.ac.uk/en/publications/fe752441-6742-4ba8-aa46-d008a6198dc9"", ""https://www.ncbi.nlm.nih.gov/pmc/articles/4786020"", ""https://pure.au.dk/portal/en/publications/c8795628-9227-476e-8e82-e4e40879d3e1"", ""http://www.elsevier.com/locate/radonc"", ""https://openalex.org/W1997747933""]"	2026-05-06T03:12:07+00:00
dedupe_294ba8018c99a562	api_candidate_e9d47f1fa66304b7	unresolved original target -> Exploratory Analysis of Autophagy-Lysosomal Pathway Proteins in Dermal Fibroblasts as Potential Peripheral Biomarkers for Alzheimer's Disease: A Pilot Study.	coverage_only	not_row_rejected_or_duplicate	manual_review_before_repull			Exploratory Analysis of Autophagy-Lysosomal Pathway Proteins in Dermal Fibroblasts as Potential Peripheral Biomarkers for Alzheimer's Disease: A Pilot Study.	10.3390/biomedicines14010034						10 3390 biomedicines14010034 exploratory analysis of autophagy lysosomal pathway proteins in dermal fibroblasts as potential peripheral biomarkers for alzheimer s disease a pilot study unresolved original target exploratory analysis of autophagy lysosomal pathway proteins in dermal fibroblasts as potential peripheral biomarkers for alzheimer s disease a pilot study	"[""https://doi.org/10.3390/biomedicines14010034"", ""https://pmc.ncbi.nlm.nih.gov/articles/PMC12838323/"", ""https://pubmed.ncbi.nlm.nih.gov/41595571/""]"	2026-05-06T03:12:07+00:00
dedupe_6d79b155dbcd1ae2	api_candidate_16cafb0bf7998b5c	unresolved original target -> Discovery of serum APOD as an early sarcopenia biomarker in older adults with low muscle mass: a cross-sectional proteomic and transcriptomic investigation.	coverage_only	not_row_rejected_or_duplicate	manual_review_before_repull			Discovery of serum APOD as an early sarcopenia biomarker in older adults with low muscle mass: a cross-sectional proteomic and transcriptomic investigation.	10.7717/peerj.21058						10 7717 peerj 21058 discovery of serum apod as an early sarcopenia biomarker in older adults with low muscle mass a cross sectional proteomic and transcriptomic investigation unresolved original target discovery of serum apod as an early sarcopenia biomarker in older adults with low muscle mass a cross sectional proteomic and transcriptomic investigation	"[""https://doi.org/10.7717/peerj.21058"", ""https://pmc.ncbi.nlm.nih.gov/articles/PMC13089219/"", ""https://pubmed.ncbi.nlm.nih.gov/42004707/""]"	2026-05-06T03:12:07+00:00
dedupe_0861ad1259e908ef	api_candidate_d4311731923600b5	unresolved original target -> Pooled extreme-phenotype genome-wide association study XP-GWAS reveals an association between &lt;i&gt;4-hydroxyphenylpyruvate dioxygenase&lt;/i&gt; and β-carotene variation in &lt;i&gt;Capsicum annuum&lt;/i&gt;.	coverage_only	not_row_rejected_or_duplicate	manual_review_before_repull			Pooled extreme-phenotype genome-wide association study XP-GWAS reveals an association between &lt;i&gt;4-hydroxyphenylpyruvate dioxygenase&lt;/i&gt; and β-carotene variation in &lt;i&gt;Capsicum annuum&lt;/i&gt;.	10.7717/peerj.21010						10 7717 peerj 21010 pooled extreme phenotype genome wide association study xp gwas reveals an association between lt i gt 4 hydroxyphenylpyruvate dioxygenase lt i gt and carotene variation in lt i gt capsicum annuum lt i gt unresolved original target pooled extreme phenotype genome wide association study xp gwas reveals an association between lt i gt 4 hydroxyphenylpyruvate dioxygenase lt i gt and carotene variation in lt i gt capsicum annuum lt i gt	"[""https://doi.org/10.7717/peerj.21010"", ""https://pmc.ncbi.nlm.nih.gov/articles/PMC13092231/"", ""https://pubmed.ncbi.nlm.nih.gov/42011360/""]"	2026-05-06T03:12:07+00:00
dedupe_2f93fc78eba71fc4	api_candidate_40032567ba4b2983	unresolved original target -> GWAS and Regularised Regression Identify SNPs Associated with Candidate Genes for Stage-Specific Salinity Tolerance in Rice.	coverage_only	not_row_rejected_or_duplicate	manual_review_before_repull			GWAS and Regularised Regression Identify SNPs Associated with Candidate Genes for Stage-Specific Salinity Tolerance in Rice.	10.3390/plants15071046						10 3390 plants15071046 gwas and regularised regression identify snps associated with candidate genes for stage specific salinity tolerance in rice unresolved original target gwas and regularised regression identify snps associated with candidate genes for stage specific salinity tolerance in rice	"[""https://doi.org/10.3390/plants15071046"", ""https://pmc.ncbi.nlm.nih.gov/articles/PMC13075185/"", ""https://pubmed.ncbi.nlm.nih.gov/41977707/""]"	2026-05-06T03:12:07+00:00
dedupe_6e842e478fba3838	api_candidate_78e273426970c46c	unresolved original target -> A hybrid molecular-imaging model for high-accuracy early colorectal cancer diagnosis.	coverage_only	not_row_rejected_or_duplicate	manual_review_before_repull			A hybrid molecular-imaging model for high-accuracy early colorectal cancer diagnosis.	10.21037/jgo-2025-687						10 21037 jgo 2025 687 a hybrid molecular imaging model for high accuracy early colorectal cancer diagnosis unresolved original target a hybrid molecular imaging model for high accuracy early colorectal cancer diagnosis	"[""https://doi.org/10.21037/jgo-2025-687"", ""https://pmc.ncbi.nlm.nih.gov/articles/PMC12972023/"", ""https://pubmed.ncbi.nlm.nih.gov/41816600/""]"	2026-05-06T03:12:07+00:00
dedupe_c17ca7b7562f2145	api_candidate_7c059fd0ea40d4f3	unresolved original target -> Artificial Intelligence in Recurrent Pregnancy Loss: Current Evidence, Limitations, and Future Directions.	coverage_only	not_row_rejected_or_duplicate	manual_review_before_repull			Artificial Intelligence in Recurrent Pregnancy Loss: Current Evidence, Limitations, and Future Directions.	10.3390/jcm15020686						10 3390 jcm15020686 artificial intelligence in recurrent pregnancy loss current evidence limitations and future directions unresolved original target artificial intelligence in recurrent pregnancy loss current evidence limitations and future directions	"[""https://doi.org/10.3390/jcm15020686"", ""https://pmc.ncbi.nlm.nih.gov/articles/PMC12841627/"", ""https://pubmed.ncbi.nlm.nih.gov/41598624/""]"	2026-05-06T03:12:07+00:00
