dedupe_baseline_id	candidate_id	candidate_name	candidate_route	final_row_status	dedupe_action	original_title	original_doi	replication_title	replication_doi	result_option_labels	current_root_pair_ids	current_root_source_datasets	value_scan_ids	scan_decisions	dedupe_key_text	source_object_urls_json	created_at
dedupe_92e406dcd0f213fc	api_candidate_0921978f51da17da	unresolved original target -> Does Social Exclusion Improve Detection of Real and Fake Smiles? A Replication Study	coverage_only	not_row_rejected_or_duplicate	manual_review_before_repull			Does Social Exclusion Improve Detection of Real and Fake Smiles? A Replication Study	10.3389/fpsyg.2021.626087						10 3389 fpsyg 2021 626087 does social exclusion improve detection of real and fake smiles a replication study unresolved original target does social exclusion improve detection of real and fake smiles a replication study	"[""https://www.frontiersin.org/articles/10.3389/fpsyg.2021.626087/pdf"", ""https://doi.org/10.3389/fpsyg.2021.626087"", ""https://pubmed.ncbi.nlm.nih.gov/33584484"", ""https://doaj.org/article/2d94461a878d444ba484bdda59f93bab"", ""http://doi.org/doi:10.17170/kobra-202103053427"", ""https://www.ncbi.nlm.nih.gov/pmc/articles/7876225"", ""https://osf.io/paedq"", ""http://api.osf.io/v2/nodes/paedq/"", ""https://doi.org/10.17170/kobra-202103053427"", ""https://openalex.org/W3128143484""]"	2026-05-06T03:12:07+00:00
dedupe_737ec86589ea31e7	api_candidate_c49eb133d5977b06	Rabbitt (1968) Experiment 2 -> Recall of Speech is Impaired by Subsequent Masking Noise: A Replication of Rabbitt (1968) Experiment 2	coverage_only	not_row_source_blocked_or_manual_acquisition	route_to_manual_acquisition_not_new_search	Rabbitt (1968) Experiment 2		Recall of Speech is Impaired by Subsequent Masking Noise: A Replication of Rabbitt (1968) Experiment 2	10.1080/25742442.2021.1896908	Rabbitt Experiment 2 speech masking direct replication			batch003_notrow_rabbitt_original_n_missing	manual_acquisition_needed_original_n	10 1080 25742442 2021 1896908 rabbitt 1968 experiment 2 recall of speech is impaired by subsequent masking noise a replication of rabbitt 1968 experiment 2 rabbitt 1968 experiment 2 recall of speech is impaired by subsequent masking noise a replication of rabbitt 1968 experiment 2	"[""https://doi.org/10.1080/25742442.2021.1896908"", ""https://www.ncbi.nlm.nih.gov/pmc/articles/8262135"", ""https://openalex.org/W3122990348""]"	2026-05-06T03:12:07+00:00
dedupe_99a6a050265cd35d	api_candidate_28c2fe1d602af67c	“citizens' blame of politicians for public service failure -> A cross‐cultural replication of “citizens' blame of politicians for public service failure: Experimental evidence about blame reduction through delegation and contracting”	coverage_only	already_in_current_root_table	skip_exact_pair_already_represented	“citizens' blame of politicians for public service failure		A cross‐cultural replication of “citizens' blame of politicians for public service failure: Experimental evidence about blame reduction through delegation and contracting”	10.1111/puar.13845		fig1_pair_304a6225a7511f02|fig1_pair_3418f2fa77f0ab81|fig1_pair_5b669e817c3bdbd9|fig1_pair_6354aa74af5614df|fig1_pair_d66726faa5655a34|fig1_pair_d7b61fe17b5d3f7e|fig1_pair_e449a6987f62689e|fig1_pair_e60370d4575fe9c3|fig1_pair_edd654024fc8eea9	Public-admin blame Wiley table reconstruction			10 1111 puar 13845 citizens blame of politicians for public service failure a cross cultural replication of citizens blame of politicians for public service failure experimental evidence about blame reduction through delegation and contracting citizens blame of politicians for public service failure a cross cultural replication of citizens blame of politicians for public service failure experimental evidence about blame reduction through delegation and contracting	"[""https://onlinelibrary.wiley.com/doi/pdfdirect/10.1111/puar.13845"", ""https://doi.org/10.1111/puar.13845"", ""http://hdl.handle.net/10871/136081"", ""https://scholars.cityu.edu.hk/files/277490731/229077902.pdf"", ""https://hdl.handle.net/2031/0679574a-60cb-4946-8c7e-7563088827fc"", ""https://openalex.org/W4398229317""]"	2026-05-06T03:12:07+00:00
dedupe_5b337fa3f2217989	api_candidate_e224769ca5daf536	unresolved original target -> Mixed findings in directly replicated experimental studies on fake news	coverage_only	not_row_rejected_or_duplicate	manual_review_before_repull			Mixed findings in directly replicated experimental studies on fake news	10.5210/fm.v26i12.11774						10 5210 fm v26i12 11774 mixed findings in directly replicated experimental studies on fake news unresolved original target mixed findings in directly replicated experimental studies on fake news	"[""https://doi.org/10.5210/fm.v26i12.11774""]"	2026-05-06T03:12:07+00:00
dedupe_9385a3bc0e3977cc	api_candidate_5820a95a7334907e	unresolved original target -> “I Remember Having Chicken Pox at Age 3”: How Can Age Manipulations Affect One’s Earliest Childhood Memories?	coverage_only	not_row_rejected_or_duplicate	manual_review_before_repull			“I Remember Having Chicken Pox at Age 3”: How Can Age Manipulations Affect One’s Earliest Childhood Memories?	10.1525/collabra.21963						10 1525 collabra 21963 i remember having chicken pox at age 3 how can age manipulations affect one s earliest childhood memories unresolved original target i remember having chicken pox at age 3 how can age manipulations affect one s earliest childhood memories	"[""https://online.ucpress.edu/collabra/article-pdf/7/1/21963/459337/collabra_2021_7_1_21963.pdf"", ""https://doi.org/10.1525/collabra.21963"", ""https://research.rug.nl/en/publications/6e09aea4-16a1-4658-860c-75bfa2bd74fc"", ""https://pure.eur.nl/en/publications/b3463922-9cbb-4ac2-9f82-a17f63a52bec"", ""https://openalex.org/W3152776483""]"	2026-05-06T03:12:07+00:00
dedupe_a2d67bcb3bfd12c8	api_candidate_4c81f1c12188acdd	unresolved original target -> Role of Colour Priming on Memory and Sustained Attention: A Direct Replication Study	coverage_only	not_row_rejected_or_duplicate	manual_review_before_repull			Role of Colour Priming on Memory and Sustained Attention: A Direct Replication Study	10.36948/ijfmr.2025.v07i06.61995						10 36948 ijfmr 2025 v07i06 61995 role of colour priming on memory and sustained attention a direct replication study unresolved original target role of colour priming on memory and sustained attention a direct replication study	"[""https://doi.org/10.36948/ijfmr.2025.v07i06.61995""]"	2026-05-06T03:12:07+00:00
dedupe_1d5949e4ce680efd	api_candidate_00e27cab90640913	unresolved original target -> Understanding the (perverse) effects of disclosing conflicts of interest: A direct replication study	coverage_only	not_row_rejected_or_duplicate	manual_review_before_repull			Understanding the (perverse) effects of disclosing conflicts of interest: A direct replication study	10.1016/j.joep.2018.10.010						10 1016 j joep 2018 10 010 understanding the perverse effects of disclosing conflicts of interest a direct replication study unresolved original target understanding the perverse effects of disclosing conflicts of interest a direct replication study	"[""https://doi.org/10.1016/j.joep.2018.10.010""]"	2026-05-06T03:12:07+00:00
dedupe_724390c203342c7d	api_candidate_f6fe02e8fc6a4794	unresolved original target -> Confirmation of No Causal Relationship Between Tracheotomy and Aspiration Status: A Direct Replication Study	coverage_only	not_row_rejected_or_duplicate	manual_review_before_repull			Confirmation of No Causal Relationship Between Tracheotomy and Aspiration Status: A Direct Replication Study	10.1007/s00455-009-9226-z						10 1007 s00455 009 9226 z confirmation of no causal relationship between tracheotomy and aspiration status a direct replication study unresolved original target confirmation of no causal relationship between tracheotomy and aspiration status a direct replication study	"[""https://doi.org/10.1007/s00455-009-9226-z""]"	2026-05-06T03:12:07+00:00
dedupe_64105aa821e13988	api_candidate_b6908a974331b8bf	unresolved original target -> Vocal Fold Immobility and Aspiration Status: A Direct Replication Study	coverage_only	not_row_rejected_after_value_scan	skip_under_current_figure1_policy			Vocal Fold Immobility and Aspiration Status: A Direct Replication Study	10.1007/s00455-011-9362-0	Vocal fold immobility after cardiovascular surgery case-series replication			batch002_notrow_vocal_fold_case_series_native	not_row_native_only_no_comparative_d_route	10 1007 s00455 011 9362 0 vocal fold immobility and aspiration status a direct replication study unresolved original target vocal fold immobility and aspiration status a direct replication study	"[""https://doi.org/10.1007/s00455-011-9362-0""]"	2026-05-06T03:12:07+00:00
dedupe_6f41954cfd275915	api_candidate_09fc517904a40142	unresolved original target -> Lateral Eye Movements Do Not Increase False-Memory Rates: A Failed Direct-Replication Study	coverage_only	not_row_rejected_or_duplicate	manual_review_before_repull			Lateral Eye Movements Do Not Increase False-Memory Rates: A Failed Direct-Replication Study	10.1177/2167702619859335						10 1177 2167702619859335 lateral eye movements do not increase false memory rates a failed direct replication study unresolved original target lateral eye movements do not increase false memory rates a failed direct replication study	"[""https://doi.org/10.1177/2167702619859335""]"	2026-05-06T03:12:07+00:00
dedupe_7d01534febef7e6d	api_candidate_bb6c827070cfa1f7	Zajonc, Heingartner, and Herman’s (1969) Social-Facilitation Study -> Replicating Roaches: A Preregistered Direct Replication of Zajonc, Heingartner, and Herman’s (1969) Social-Facilitation Study	coverage_only	not_row_rejected_after_value_scan	skip_under_current_figure1_policy	Zajonc, Heingartner, and Herman’s (1969) Social-Facilitation Study		Replicating Roaches: A Preregistered Direct Replication of Zajonc, Heingartner, and Herman’s (1969) Social-Facilitation Study	10.1177/0956797620902101	Cockroach audience by task-difficulty social-facilitation interaction			batch003_notrow_zajonc_roaches_original_interaction_not_tested	not_row_original_effect_not_statistically_mapped	10 1177 0956797620902101 zajonc heingartner and herman s 1969 social facilitation study replicating roaches a preregistered direct replication of zajonc heingartner and herman s 1969 social facilitation study zajonc heingartner and herman s 1969 social facilitation study replicating roaches a preregistered direct replication of zajonc heingartner and herman s 1969 social facilitation study	"[""https://doi.org/10.1177/0956797620902101""]"	2026-05-06T03:12:07+00:00
dedupe_9af081cf2c0831bb	api_candidate_50123881cbf08349	the Scaffolding Experimental Study by D. Wood et al. (1978) -> Supplemental Material for What It Takes to Tutor—A Preregistered Direct Replication of the Scaffolding Experimental Study by D. Wood et al. (1978)	coverage_only	not_row_rejected_seed_or_non_pair	skip_seed_or_non_pair	the Scaffolding Experimental Study by D. Wood et al. (1978)		Supplemental Material for What It Takes to Tutor—A Preregistered Direct Replication of the Scaffolding Experimental Study by D. Wood et al. (1978)	10.1037/edu0000965.supp						10 1037 edu0000965 supp the scaffolding experimental study by d wood et al 1978 supplemental material for what it takes to tutor a preregistered direct replication of the scaffolding experimental study by d wood et al 1978 the scaffolding experimental study by d wood et al 1978 supplemental material for what it takes to tutor a preregistered direct replication of the scaffolding experimental study by d wood et al 1978	"[""https://doi.org/10.1037/edu0000965.supp""]"	2026-05-06T03:12:07+00:00
dedupe_7f2212002b48567b	api_candidate_b5436d689117e031	unresolved original target -> The psychophysiology of mixed emotional states: Internal and external replicability analysis of a direct replication study	coverage_only	not_row_rejected_or_duplicate	manual_review_before_repull			The psychophysiology of mixed emotional states: Internal and external replicability analysis of a direct replication study	10.1111/psyp.12425						10 1111 psyp 12425 the psychophysiology of mixed emotional states internal and external replicability analysis of a direct replication study unresolved original target the psychophysiology of mixed emotional states internal and external replicability analysis of a direct replication study	"[""https://doi.org/10.1111/psyp.12425""]"	2026-05-06T03:12:07+00:00
dedupe_e101c5466ecfed8d	api_candidate_d98523e0ce3e5e0d	Shen et al.'s (2019) Study on Online Image Credibility -> Contextual Changes, Credible Conclusions? A Direct and Conceptual Replication of Shen et al.'s (2019) Study on Online Image Credibility	coverage_only	not_row_source_blocked_or_manual_acquisition	route_to_manual_acquisition_not_new_search	Shen et al.'s (2019) Study on Online Image Credibility		Contextual Changes, Credible Conclusions? A Direct and Conceptual Replication of Shen et al.'s (2019) Study on Online Image Credibility	10.1080/15213269.2025.2595452	Online image credibility contextual direct/conceptual replication			batch003_notrow_shen_image_credibility_source_blocked	source_blocked_needs_manual_acquisition	10 1080 15213269 2025 2595452 shen et al s 2019 study on online image credibility contextual changes credible conclusions a direct and conceptual replication of shen et al s 2019 study on online image credibility shen et al s 2019 study on online image credibility contextual changes credible conclusions a direct and conceptual replication of shen et al s 2019 study on online image credibility	"[""https://doi.org/10.1080/15213269.2025.2595452""]"	2026-05-06T03:12:07+00:00
dedupe_f42e9d07cdc9b850	api_candidate_fe1ba4ad981d697c	unresolved original target -> Using Interval Likelihood Ratios in Gated Screening: A Direct Replication Study	coverage_only	not_row_rejected_or_duplicate	manual_review_before_repull			Using Interval Likelihood Ratios in Gated Screening: A Direct Replication Study	10.1177/1534508420953894						10 1177 1534508420953894 using interval likelihood ratios in gated screening a direct replication study unresolved original target using interval likelihood ratios in gated screening a direct replication study	"[""https://doi.org/10.1177/1534508420953894""]"	2026-05-06T03:12:07+00:00
dedupe_98a6b9e15087f0cd	api_candidate_2c82e73321400e34	unresolved original target -> Challenges to Replication and Iteration in Field Experiments: Evidence from Two Direct Mail Shots	coverage_only	not_row_rejected_or_duplicate	manual_review_before_repull			Challenges to Replication and Iteration in Field Experiments: Evidence from Two Direct Mail Shots	10.1257/aer.p20171060						10 1257 aer p20171060 challenges to replication and iteration in field experiments evidence from two direct mail shots unresolved original target challenges to replication and iteration in field experiments evidence from two direct mail shots	"[""https://doi.org/10.1257/aer.p20171060""]"	2026-05-06T03:12:07+00:00
dedupe_e38ca327fed8c3d6	api_candidate_79a60b36adeac558	unresolved original target -> Pointing gestures do not influence the perception of lexical stress	coverage_only	not_row_rejected_or_duplicate	manual_review_before_repull			Pointing gestures do not influence the perception of lexical stress	10.21437/interspeech.2011-586						10 21437 interspeech 2011 586 pointing gestures do not influence the perception of lexical stress unresolved original target pointing gestures do not influence the perception of lexical stress	"[""https://doi.org/10.21437/interspeech.2011-586"", ""https://www.um.edu.mt/library/oar//handle/123456789/25356"", ""http://www.isca-speech.org/archive/interspeech_2011/"", ""http://hdl.handle.net/11858/00-001M-0000-0011-F2D9-1"", ""https://openalex.org/W247994436""]"	2026-05-06T03:12:07+00:00
dedupe_2a6a2d1461d15b71	api_candidate_4047d23b0380c97b	Kovács and Mehler (2009) -> Robustness of the cognitive gains in 7‐month‐old bilingual infants: A close multi‐center replication of Kovács and Mehler (2009)	coverage_only	not_row_rejected_after_value_scan	skip_under_current_figure1_policy	Kovács and Mehler (2009)		Robustness of the cognitive gains in 7‐month‐old bilingual infants: A close multi‐center replication of Kovács and Mehler (2009)	10.1111/desc.13377	Kovacs and Mehler infant anticipatory-looking switch task			batch003_notrow_kovacs_mehler_native_mixed_eye_tracking	not_row_native_eye_tracking_mixed_models_no_current_d_route	10 1111 desc 13377 kov cs and mehler 2009 robustness of the cognitive gains in 7 month old bilingual infants a close multi center replication of kov cs and mehler 2009 kov cs and mehler 2009 robustness of the cognitive gains in 7 month old bilingual infants a close multi center replication of kov cs and mehler 2009	"[""https://onlinelibrary.wiley.com/doi/pdfdirect/10.1111/desc.13377"", ""https://doi.org/10.1111/desc.13377"", ""https://pubmed.ncbi.nlm.nih.gov/36851852"", ""https://handle.uba.uva.nl/personal/pure/en/publications/robustness-of-the-cognitive-gains-in-7monthold-bilingual-infants-a-close-multicenter-replication-of-kovcs-and-mehler-2009(5fb929d9-4d04-46b8-967e-ffa7da1f1a7c).html"", ""https://repository.ubn.ru.nl//bitstream/handle/2066/290026/290026.pdf"", ""https://repository.ubn.ru.nl/handle/2066/290026"", ""https://scholarlypublications.universiteitleiden.nl/access/item%3A4210085/view"", ""https://hdl.handle.net/1887/4210084"", ""https://hdl.handle.net/11245.1/5fb929d9-4d04-46b8-967e-ffa7da1f1a7c"", ""https://dspace.library.uu.nl/handle/1874/432838"", ""https://hdl.handle.net/10037/30423"", ""http://hdl.handle.net/2066/290026"", ""https://openalex.org/W4322616924""]"	2026-05-06T03:12:07+00:00
dedupe_126cdbec4c4110f9	api_candidate_28e50579766f477c	unresolved original target -> Predicting long-distance lexical content in German verb-particle constructions	coverage_only	not_row_rejected_or_duplicate	manual_review_before_repull			Predicting long-distance lexical content in German verb-particle constructions	10.25932/publishup-47679						10 25932 publishup 47679 predicting long distance lexical content in german verb particle constructions unresolved original target predicting long distance lexical content in german verb particle constructions	"[""https://nbn-resolving.org/urn:nbn:de:kobv:517-opus4-476798"", ""https://publishup.uni-potsdam.de/frontdoor/index/index/docId/47679"", ""https://doi.org/10.25932/publishup-47679"", ""https://publishup.uni-potsdam.de/files/47679/stone_diss.pdf"", ""https://openalex.org/W3153650910""]"	2026-05-06T03:12:07+00:00
dedupe_7cc299928c82876f	api_candidate_39fd826b8a364bf3	unresolved original target -> The Olfactory Stress Test does not replicate in a larger sample	coverage_only	not_row_rejected_or_duplicate	manual_review_before_repull			The Olfactory Stress Test does not replicate in a larger sample	10.1002/alz.078041						10 1002 alz 078041 the olfactory stress test does not replicate in a larger sample unresolved original target the olfactory stress test does not replicate in a larger sample	"[""https://doi.org/10.1002/alz.078041""]"	2026-05-06T03:12:07+00:00
dedupe_cfef36e9782e53cd	api_candidate_fbe05a26e9edabb8	the Procedures from Bem (2010, Study 8) and a Failure to Replicate the Same Results -> A Replication of the Procedures from Bem (2010, Study 8) and a Failure to Replicate the Same Results	coverage_only	already_in_current_root_table	skip_exact_pair_already_represented	the Procedures from Bem (2010, Study 8) and a Failure to Replicate the Same Results		A Replication of the Procedures from Bem (2010, Study 8) and a Failure to Replicate the Same Results	10.2139/ssrn.1699970	Bem Study 8 procedure replication	fig1_pair_522390bddbfb99c0	Galak et al. 2012 psi meta-analysis (manual)	batch003_notrow_bem_study8_source_blocked	not_row_duplicate_represented_by_existing_galak2012_aggregate	10 2139 ssrn 1699970 the procedures from bem 2010 study 8 and a failure to replicate the same results a replication of the procedures from bem 2010 study 8 and a failure to replicate the same results the procedures from bem 2010 study 8 and a failure to replicate the same results a replication of the procedures from bem 2010 study 8 and a failure to replicate the same results	"[""https://doi.org/10.2139/ssrn.1699970""]"	2026-05-06T03:12:07+00:00
dedupe_a53a8633006b26b4	api_candidate_5b9f95d4c0a9b686	methods caused the failure to replicate results. -> Panero et al. (2016): Failure to replicate methods caused the failure to replicate results.	coverage_only	not_row_rejected_after_value_scan	skip_under_current_figure1_policy	methods caused the failure to replicate results.		Panero et al. (2016): Failure to replicate methods caused the failure to replicate results.	10.1037/pspa0000072	Panero methods-caused-failure commentary/dispute			batch003_notrow_panero_commentary	not_row_reject_commentary_or_method_dispute	10 1037 pspa0000072 methods caused the failure to replicate results panero et al 2016 failure to replicate methods caused the failure to replicate results methods caused the failure to replicate results panero et al 2016 failure to replicate methods caused the failure to replicate results	"[""https://doi.org/10.1037/pspa0000072""]"	2026-05-06T03:12:07+00:00
dedupe_b872bed04d7f7fc4	api_candidate_9b24b3097426c83d	unresolved original target -> The Effects of Repeated Finger Flexion Movements on Self-Reported Affect and Reward System Activation Are Weak and Inconsistent.	coverage_only	not_row_rejected_or_duplicate	manual_review_before_repull			The Effects of Repeated Finger Flexion Movements on Self-Reported Affect and Reward System Activation Are Weak and Inconsistent.	10.1002/jclp.70017						10 1002 jclp 70017 the effects of repeated finger flexion movements on self reported affect and reward system activation are weak and inconsistent unresolved original target the effects of repeated finger flexion movements on self reported affect and reward system activation are weak and inconsistent	"[""https://doi.org/10.1002/jclp.70017"", ""https://pmc.ncbi.nlm.nih.gov/articles/PMC12501816/"", ""https://pubmed.ncbi.nlm.nih.gov/40662266/""]"	2026-05-06T03:12:07+00:00
dedupe_deebdc59a7bd6221	api_candidate_dae655618ec4c3be	unresolved original target -> New evidence finds young people in Mainland China are now bicultural.	coverage_only	not_row_rejected_or_duplicate	manual_review_before_repull			New evidence finds young people in Mainland China are now bicultural.	10.1111/bjop.12767						10 1111 bjop 12767 new evidence finds young people in mainland china are now bicultural unresolved original target new evidence finds young people in mainland china are now bicultural	"[""https://doi.org/10.1111/bjop.12767"", ""https://pmc.ncbi.nlm.nih.gov/articles/PMC11984341/"", ""https://pubmed.ncbi.nlm.nih.gov/39804441/""]"	2026-05-06T03:12:07+00:00
dedupe_9eb09261ac52dbaf	api_candidate_af2810096cc74997	unresolved original target -> The tainted altruism effect: a successful pre-registered replication.	coverage_only	not_row_rejected_or_duplicate	manual_review_before_repull			The tainted altruism effect: a successful pre-registered replication.	10.1098/rsos.211152						10 1098 rsos 211152 the tainted altruism effect a successful pre registered replication unresolved original target the tainted altruism effect a successful pre registered replication	"[""https://doi.org/10.1098/rsos.211152"", ""https://pmc.ncbi.nlm.nih.gov/articles/PMC8790362/"", ""https://pubmed.ncbi.nlm.nih.gov/35116147/""]"	2026-05-06T03:12:07+00:00
dedupe_960bc1fa0da693a3	api_candidate_6609346be8040f27	unresolved original target -> The first direct replication on using verbal credibility assessment for the detection of deceptive intentions.	coverage_only	not_row_rejected_or_duplicate	manual_review_before_repull			The first direct replication on using verbal credibility assessment for the detection of deceptive intentions.	10.1002/acp.3439						10 1002 acp 3439 the first direct replication on using verbal credibility assessment for the detection of deceptive intentions unresolved original target the first direct replication on using verbal credibility assessment for the detection of deceptive intentions	"[""https://doi.org/10.1002/acp.3439"", ""https://pmc.ncbi.nlm.nih.gov/articles/PMC6174984/"", ""https://pubmed.ncbi.nlm.nih.gov/30333683/""]"	2026-05-06T03:12:07+00:00
dedupe_ec016808bf8e69c9	api_candidate_38f85ce298c4da7a	unresolved original target -> Expectation of irrelevant novel stimuli has no consistent effect on recognition memory.	coverage_only	not_row_rejected_after_value_scan	skip_under_current_figure1_policy			Expectation of irrelevant novel stimuli has no consistent effect on recognition memory.	10.1111/sjop.12807	Novelty recognition-memory expectancy effect			batch002_notrow_novelty_recognition_paired_interaction	not_row_native_paired_interaction_no_current_d_route	10 1111 sjop 12807 expectation of irrelevant novel stimuli has no consistent effect on recognition memory unresolved original target expectation of irrelevant novel stimuli has no consistent effect on recognition memory	"[""https://doi.org/10.1111/sjop.12807"", ""https://pmc.ncbi.nlm.nih.gov/articles/PMC9542624/"", ""https://pubmed.ncbi.nlm.nih.gov/35390179/""]"	2026-05-06T03:12:07+00:00
