disposition_id	disposition_label	row_count	route	usable_for	has_pair_mapping	has_effect	has_n	has_common_axis	definition	next_action	source_basis	percent_of_accounted_row_grain_universe
figure1a_strict_direct_d_axis	Strict Figure 1A direct D/N rows	1736	figure1a_strict_current_d_axis	main Figure 1A	yes	yes	yes	yes	Rows included by the current strict Figure 1 D/N plot rule.	Promote into source_result/source_result_support when provenance hardening resumes.	steps/corpus_results/figure1/universe_coverage/figure1-universe-coverage-summary.tsv	51.5
strict_dn_blocked_by_current_rule	D/N rows blocked by current Figure 1A rule	752	coverage_denominator_or_rule_audit	denominator, rule audit, robustness checks	yes	yes	yes	yes, but not current-rule eligible	Root rows have D_original, D_replication, N_original, and N_replication but fail a current plot gate.	Keep out of Figure 1A unless the failed gate is intentionally changed.	steps/corpus_results/figure1/universe_coverage/figure1-universe-coverage-summary.tsv	22.3
figure1b_binary_d_equivalent	Comparative binary rows with D-equivalent conversion	88	figure1b_clinical_binary_d_equivalent	Figure 1B diagnostic	yes	yes	yes	D-equivalent tier, not direct D	Active/control count rows can be converted by log(OR) * sqrt(3) / pi.	Use only with conversion-tier fields and caption caveats.	steps/corpus_results/figure1/universe_coverage/figure1-universe-coverage-summary.tsv | steps/corpus_results/figure1/alternate_route_recheck/figure1-rejected-alternate-route-summary.tsv	2.6
native_effect_retention	Native-effect rows not on D axis	91	native_scale_retention_panel_or_appendix	native-scale diagnostic, not common-D plot	yes	yes	yes	no	Response-rate or similar rows with original/follow-up values and N but no defensible D conversion.	Retain separately; do not mix into D or D-equivalent panels.	steps/corpus_results/figure1/alternate_route_recheck/figure1-rejected-alternate-route-summary.tsv	2.7
roster_only_denominator	Pair roster only, public values unavailable	248	source_object_coverage_denominator	coverage denominator only	yes	no	no	no	Rows identify original/follow-up linkage but public/local bytes do not expose effect and N values.	Do not mine further unless public value files appear or policy changes to author-request data.	steps/corpus_results/figure1/universe_coverage/figure1-universe-coverage-summary.tsv	7.4
effect_present_missing_n	Effect present, N missing	172	missing_n_repair_worklist	repair queue and denominator	yes	yes	no	not until N is recovered	Public result rows expose effect-like values but no original/follow-up sample-size columns.	Recover N from source articles, appendices, or project owners before plotting.	steps/corpus_results/figure1/universe_coverage/figure1-universe-coverage-summary.tsv	5.1
parsed_row_grain_no_effect_n	Parsed row grain, no copied effect/N evidence	271	parser_repair_or_demotion	denominator with parser caveat	unclear	no	no	no	A parser found row-grain records, but current extraction did not copy effect or N evidence.	Repair parser signals or demote; do not treat as result rows.	steps/corpus_results/figure1/alternate_route_recheck/figure1-rejected-alternate-route-recheck.tsv	8.0
duplicate_risk_dn_candidate	D/N-looking rows with duplicate risk	10	dedupe_before_any_plot_route	coverage denominator until deduped	yes	yes	yes	likely, but not validated	Candidate D/N-looking rows exist, but they overlap heavily with already harvested sources.	Dedupe against FReD/current rows before promotion.	steps/corpus_results/figure1/alternate_route_recheck/figure1-rejected-alternate-route-recheck.tsv	0.3
