entry_index	local_path	label	status_text	original_n_count	replication_n_count	original_d_count	replication_d_count	conservative_parseable	passes_larger_n_if_parseable	D_original_if_parseable	N_original_if_parseable	D_replication_if_parseable	N_replication_if_parseable	decision	snippet
1246	data/raw/replication_projects/lead_harvest/figure1_research_followup_20260504/forrt_reversals/12_html_database_https_forrt_org_reversals.bin	Transposed word effect. Responses to transposed word sequences (e.g. “you that read wrong”) are more error-prone and judged as ungrammatical compared with a con	Status: replicated 	2	20	2	20	False	False					not_parseable_by_conservative_single_row_rule	Transposed word effect. Responses to transposed word sequences (e.g. “you that read wrong”) are more error-prone and judged as ungrammatical compared with a control sequence (e.g. “you that read worry”). Statistics Status: replicated Original paper: ‘ You that read wrong again! A transposed-word effect in grammaticality judgments ’, Mirault et al. 2018; two experiments, laboratory: n = 57, online: n = 94. [citation=47(GS, November 2022)]​. Critiques: Huang and Staub 2022 [Experiment 1: n = 49, Experiment 2: n = 51, citations=0(GS, November 2022)]. Liu et al. 2020 [Experiment 1: n = 63, Experim
1252	data/raw/replication_projects/lead_harvest/figure1_research_followup_20260504/forrt_reversals/12_html_database_https_forrt_org_reversals.bin	Personality > intelligence predicting life outcomes . Personality is generally more predictive than IQ on a variety of important life outcomes, such as educatio	Status: not replicated 	1	1	0	0	False	False		23023.0		26600.0	not_parseable_by_conservative_single_row_rule	Personality > intelligence predicting life outcomes . Personality is generally more predictive than IQ on a variety of important life outcomes, such as educational attainment and wage. Statistics Status: not replicated Original paper: ‘ What grades and achievement tests measure ’, Borghans et al. 2016; correlational study, n=23,023 over four large-scale survey datasets. [citations=265(GS, January 2023)]​. Critiques: Zisman and Ganzach 2022 [n=26,600 over six large-scale datasets, citations=5(GS, January 2023)].​ Original effect size: Personality more predictive of education, R 2 = 0.143, grade
1258	data/raw/replication_projects/lead_harvest/figure1_research_followup_20260504/forrt_reversals/12_html_database_https_forrt_org_reversals.bin	Error salience (epistemic contextualism effects). Judgments about “knowledge” are sensitive to the salience of error possibilities. This is explained by the fac	Status: mixed. 	0	0	0	18	False	False					not_parseable_by_conservative_single_row_rule	Error salience (epistemic contextualism effects). Judgments about “knowledge” are sensitive to the salience of error possibilities. This is explained by the fact that salience shifts the evidential standard required to truthfully say someone “knows” something when those possibilities are made salient.​ Statistics Status: mixed. Original paper: ‘ Knowledge Ascriptions and the Psychological Consequences of thinking about Error ’, Nagel 2010; theoretical paper, n=NA. [citations=133(GS, May 2023)]​. Critiques: Feltz & Zarpentine 2010 [n1=152, citations=128(GS, May 2023)]. Hansen & Chemla 2013 [n1=
1265	data/raw/replication_projects/lead_harvest/figure1_research_followup_20260504/forrt_reversals/12_html_database_https_forrt_org_reversals.bin	Gettier intuition effect . Participants attributed knowledge in Gettier-type cases (where an individual is justified in believing something to be true but their	Status: mixed. 	0	1	1	0	False	False	1.75			4724.0	not_parseable_by_conservative_single_row_rule	Gettier intuition effect . Participants attributed knowledge in Gettier-type cases (where an individual is justified in believing something to be true but their belief was only correct due to luck) at rates similar to cases of justified true belief. Statistics Status: mixed. Original paper: ‘ The folk conception of knowledge ’ Starmans and Friedman 2012; between-subject experiments, n1a=144, n1b=133, n1c=46, n2=51, n3=43. [citations=183(GS, March 2023)]. Critiques: Turri et al. 2015 [n1=135, n2=141, n3=576, n4= 813, citations = 97 (GS, March 2023)]. Hall et al. 2018 (pre-print) [n=4724, Citati
1271	data/raw/replication_projects/lead_harvest/figure1_research_followup_20260504/forrt_reversals/12_html_database_https_forrt_org_reversals.bin	Left-cradling bias (Child cradling lateralization). Humans preferentially hold their child on the left body side. This is hypothesised to be modulated by handed	Status: replicated 	1	1	1	1	True	True	1.06	765.0	0.34	6799.0	candidate_not_promoted_duplicate_risk_and_narrative_alignment_needed	Left-cradling bias (Child cradling lateralization). Humans preferentially hold their child on the left body side. This is hypothesised to be modulated by handedness as the dominant hand is preferably free for mundane tasks. Statistics Status: replicated Original paper: ‘ Handedness as a major determinant of functional cradling bias ’, van de Meer and Husby 2007; laboratory study in which left- and right-handers were asked to cradle a baby doll, side of holding was recorded in the studies, n=765. [citations = 67(GS, June 2022)]​. Critiques: Packheiser et al. 2019 [meta-analysis, n=6799, citatio
1277	data/raw/replication_projects/lead_harvest/figure1_research_followup_20260504/forrt_reversals/12_html_database_https_forrt_org_reversals.bin	Handedness differences - schizophrenia . Non-right-handedness is more prevalent in individuals with schizophrenia compared to the healthy population.	Status: replicated 	1	1	1	1	True	True	0.59	225.0	0.26	5467.0	candidate_not_promoted_duplicate_risk_and_narrative_alignment_needed	Handedness differences - schizophrenia . Non-right-handedness is more prevalent in individuals with schizophrenia compared to the healthy population. Statistics Status: replicated Original paper: ‘ Imbalance of hemispheric functions in the major psychoses: A study of handedness in the People’s Republic of China ’, Shan-Ming et al. 1985; study of hand preference in individuals with schizophrenia, depression and healthy controls, n=225 schizophrenics and 432 controls. [citations=84(GS, June 2022)]​. Critiques: Sommer et al. 2001 [meta-analysis, n=5467, citations=536(GS, June 2022)]. Original eff
1283	data/raw/replication_projects/lead_harvest/figure1_research_followup_20260504/forrt_reversals/12_html_database_https_forrt_org_reversals.bin	Handedness differences - depression. Being left-handed is associated with a higher likelihood of being depressed.	Status: mixed 	1	3	1	0	False	False	0.57	70.0			not_parseable_by_conservative_single_row_rule	Handedness differences - depression. Being left-handed is associated with a higher likelihood of being depressed. Statistics Status: mixed Original paper: ‘ Cerebral laterality and depression: Differences in perceptual asymmetry among diagnostic subtypes ’, Bruder et al. 1989; analysis of different patterns of brain lateralization between depressed individuals and controls, n = 70. [citations=202 (GS, January 2023)]. Critiques: Denny 2009 [n= 27,482, citations = 49 (Tandfonline, June 2022)]. Elias et al. 2001 [n=541, citations = 37 (ScienceDirect, June 2022)]. Packheiser et al. 2021 [meta-anal
1289	data/raw/replication_projects/lead_harvest/figure1_research_followup_20260504/forrt_reversals/12_html_database_https_forrt_org_reversals.bin	Handedness differences - stuttering. The rate of stuttering was much higher in left-handers than in right-handers.	Status: not replicated 	1	1	0	0	False	False		253.0		83.0	not_parseable_by_conservative_single_row_rule	Handedness differences - stuttering. The rate of stuttering was much higher in left-handers than in right-handers. Statistics Status: not replicated Original paper: ‘ Left-handedness: Association with immune disease, migraine, and developmental learning disorder, Geschwind and Behan 1982; survey, n= 253. [citations=1637(GS, October, 2022)]​. Critiques: Mohammadi and Papadatou-Pastou 2020 [n = 83 children who stutter, 90 children who do not stutter, citations = 4, (GS, November 2022)]. Original effect size: not reported. Replication effect size: Mohammadi and Papadatou-Pastou: Cramer’s V = 0.12
1295	data/raw/replication_projects/lead_harvest/figure1_research_followup_20260504/forrt_reversals/12_html_database_https_forrt_org_reversals.bin	Handedness differences - dyslexia. The rate of learning disabilities was much higher in left-handers than in right-handers. ​	Status: reversed 	1	1	0	0	False	False		253.0		20539.0	not_parseable_by_conservative_single_row_rule	Handedness differences - dyslexia. The rate of learning disabilities was much higher in left-handers than in right-handers. ​ Statistics Status: reversed Original paper: ‘ Left-handedness: Association with immune disease, migraine, and developmental learning disorder , Geschwind and Behan 1982; survey, n = 253. [citations=1637(GS, October 2022)]​. Critiques: van Feen et al. 2020 [n=20539, citations=12 (GS, November 2022)]. ​ Original effect size: not reported. Replication effect size: van Feen et al.: b =.116.
1301	data/raw/replication_projects/lead_harvest/figure1_research_followup_20260504/forrt_reversals/12_html_database_https_forrt_org_reversals.bin	Handedness differences - intelligence. Left-handedness is associated with lower scores in fluid intelligence.	Status: replicated 	1	3	0	5	False	False		67.0			not_parseable_by_conservative_single_row_rule	Handedness differences - intelligence. Left-handedness is associated with lower scores in fluid intelligence. Statistics Status: replicated Original paper: ’ Handedness and Intelligence ’, Hicks and Beveridge, 1978; correlational survey, n = 67. [citations = 29 (Science Direct, June 2022)]. Critiques: Ntolka and Papadatou-Pastou 2017 [systematic review of 36 studies, n = 65,519, citations = 20 (Science Direct, June 2022)]. Papadatou-Pastoua & Tomprou 2015 [meta-analysis, n = 16,076, citations = 39 (Science Direct, June 2022)]. Somers et al. 2015 [meta-analysis, k =30, n = 359,890, citations = 
1307	data/raw/replication_projects/lead_harvest/figure1_research_followup_20260504/forrt_reversals/12_html_database_https_forrt_org_reversals.bin	Handedness differences - cognitive ability. Difference in spatial ability between left and right handers. Left handers have a supposed deficit in spatial abilit	Status: mixed 	1	3	1	0	False	False	1.42	25.0			not_parseable_by_conservative_single_row_rule	Handedness differences - cognitive ability. Difference in spatial ability between left and right handers. Left handers have a supposed deficit in spatial ability. Statistics Status: mixed Original paper: ‘Possible Basis for the Evolution of Lateral Specialization of the Human Brain ’, Levy 1969; comparison between spatial IQ (WAIS) in left and right handers in graduate students, n=25. [citations=857, GS, January 2023)]. Critiques: Briggs et al. 1976 [n = 34, citations = 114 (GS, January 2023)]. Inglis and Lawson 1984 [n=1880, citations=37 (GS, January 2023)]. Somers et al. 2015 [meta-analysis,
1313	data/raw/replication_projects/lead_harvest/figure1_research_followup_20260504/forrt_reversals/12_html_database_https_forrt_org_reversals.bin	Handedness differences - sexual orientation. Intrauterine testosterone levels may determine both handedness and sexuality, with homosexuals having an increased 	Status: mixed 	0	8	0	0	False	False					not_parseable_by_conservative_single_row_rule	Handedness differences - sexual orientation. Intrauterine testosterone levels may determine both handedness and sexuality, with homosexuals having an increased rate of left-handedness. Statistics Status: mixed Original paper: ‘ Cerebral Lateralization Biological Mechanisms, Associations, and Pathology: II. A Hypothesis and a Program for Research ’, Greschwind and Galaburda 1985; theory paper meaning no sample size present. [citations = 780 (GS, October 2022)]. Critiques: Becker et al. 1992 [n = 1,612, citations = 43 (GS, October 2022)]. Lalumière et al. 2001 [n = 23,410 (meta-analysis), citati
1319	data/raw/replication_projects/lead_harvest/figure1_research_followup_20260504/forrt_reversals/12_html_database_https_forrt_org_reversals.bin	Handedness differences - twins. Handedness differences between twins and singletons. Twins have been suggested to show increased rates of left handedness compar	Status: mixed 	1	3	0	0	False	False		85.0			not_parseable_by_conservative_single_row_rule	Handedness differences - twins. Handedness differences between twins and singletons. Twins have been suggested to show increased rates of left handedness compared to singletons.​ Statistics Status: mixed Original paper: ‘ Handedness in Twins: a Meta-analysis ’, Sicotte et al. 1999; meta-analysis on rates of atypical handedness, n = 85.371. [citations = 137 (GS, January, 2023)]. Critiques: Zheng et al. 2020 [n=631, citations=8 (GS, January 2023)]. Medland et al. 2003 [n = 9176, citations=50 (GS, January 2023)]. De Kovel et al. 2019 [UK Biobank study with n ~500,000, citations=107 (GS, April 202
1325	data/raw/replication_projects/lead_harvest/figure1_research_followup_20260504/forrt_reversals/12_html_database_https_forrt_org_reversals.bin	Handedness differences - sex. Handedness differences between men and women. Men have been suggested to show increased rates of left-handedness compared to women	Status: mixed 	1	4	0	0	False	False		1106.0			not_parseable_by_conservative_single_row_rule	Handedness differences - sex. Handedness differences between men and women. Men have been suggested to show increased rates of left-handedness compared to women. Statistics Status: mixed Original paper: ‘ Measuring handedness with questionnaires ’, Bryden 1977; questionnaire study to assess handedness using factor analysis, n=1106. [citations=963 (GS, January 2023)]. Critiques: Cornell and& McManus 1992 [n = 266, citations = 11 (GS, January 2023)]. Green and Young 2001 [n=284, citations = 93 (GS, January 2023)]. Holtzen 1994 [n = 260, citations = 45 (GS, January 2023)]. Papadatou-Pastou et al.
1331	data/raw/replication_projects/lead_harvest/figure1_research_followup_20260504/forrt_reversals/12_html_database_https_forrt_org_reversals.bin	Overlooking of subtractive change. People systematically default to searching for additive transformations, and consequently overlook subtractive transformation	Status: replicated 	1	1	0	0	False	False		2261.0		477.0	not_parseable_by_conservative_single_row_rule	Overlooking of subtractive change. People systematically default to searching for additive transformations, and consequently overlook subtractive transformations. A tendency to generate and/or select additive ideas over subtractive ones. Statistics Status: replicated Original paper:‘ People systematically overlook subtractive changes ’, Adams et al. 2021; between subject design, N = 2261 across 8 studies. [citation = 75 (GS, October 2022)]. Critiques: Fillon et al. 2022 [n=477, citations = 0 (GS, October 2022)]. Original effect size: ꭕ ² between 9.71 and 13.63. Replication effect size: Fillon 
1337	data/raw/replication_projects/lead_harvest/figure1_research_followup_20260504/forrt_reversals/12_html_database_https_forrt_org_reversals.bin	Heterogeneity reduces perceived quantity . Sets of multiple colourful or different objects (e.g., stars, squares, triangles) seem less with respect to their qua	Status: not replicated 	4	6	2	2	False	False					not_parseable_by_conservative_single_row_rule	Heterogeneity reduces perceived quantity . Sets of multiple colourful or different objects (e.g., stars, squares, triangles) seem less with respect to their quantity than the same sets that consist of only one type of object (e.g., only red triangles). Statistics Status: not replicated Original paper: ‘ The presence of variety reduces perceived quantity ’, Redden and Hoch, 2009; within-subjects design, Study 1: n = 80, Study 2: n = 57, Study 3: n = 105, Study 4: n = 64. [citations=90(GS, October 2022)]​. Critiques: Röseler et al. , in press [Study 1: n = 104, Study 2: n = 199, Study 3: n = 144
1343	data/raw/replication_projects/lead_harvest/figure1_research_followup_20260504/forrt_reversals/12_html_database_https_forrt_org_reversals.bin	Eye movements and false memories. Lateral eye movements increase false memory rates.	Status: not replicated 	1	1	1	1	True	True	-0.77	82.0	0.063	206.0	candidate_not_promoted_duplicate_risk_and_narrative_alignment_needed	Eye movements and false memories. Lateral eye movements increase false memory rates. Statistics Status: not replicated Original paper: ‘ Lateral eye movements increase false memory rates ’, Houben et al. 2018; experiment, n=82. [citation=36 (GS, November 2022)]. Critique: van Schie and Leer 2019 [n=206, citations=24(GS, November 2022)]. Original effect size: d =-0.77 [-1.34, -0.36]​. Replication effect size: van Schie and Leer: d =0.063 [-0.210, 0.336].
1349	data/raw/replication_projects/lead_harvest/figure1_research_followup_20260504/forrt_reversals/12_html_database_https_forrt_org_reversals.bin	Gaze-liking effect . People are more likely to rate objects as more likeable when they have seen a person repeatedly gaze toward, as opposed to away from the ob	Status: not replicated 	2	4	1	13	False	False	0.94				not_parseable_by_conservative_single_row_rule	Gaze-liking effect . People are more likely to rate objects as more likeable when they have seen a person repeatedly gaze toward, as opposed to away from the object. Statistics Status: not replicated Original paper: ‘ Gaze cuing and affective judgments of objects: I like what you look at ’, Bayliss et al. 2006; experiment, Study 1: n=24, Study 2: n=24. [citation=317(GS, November 2022)]​. Critiques: King et al. 2011 n=24, citations=[ 40(GS, November 2022)]. Tipples and Pecchinenda 2019 [n=98, citations=18(GS, November 2022)]. Ulloa et al. 2015 [Study 1: n = 36; Study 2: n = 35, citations = 24(G
1355	data/raw/replication_projects/lead_harvest/figure1_research_followup_20260504/forrt_reversals/12_html_database_https_forrt_org_reversals.bin	Phonological working memory impairment in dyslexic adults . Dyslexic individuals show lower scores on phonological working memory, using a nonword repetition ta	Status: replicated 	0	3	1	1	False	False	0.97		1.54		not_parseable_by_conservative_single_row_rule	Phonological working memory impairment in dyslexic adults . Dyslexic individuals show lower scores on phonological working memory, using a nonword repetition task. ​ Statistics Status: replicated Original paper: ‘ Pseudoword repetition ability in learning-disabled children ’, Taylor et al. 1989; experiment, neurotypical: n 1 = 20, dyslexic: n 2 = 24. [citations=142(GS, March 2023)]​. Critiques: Elsherif et al. 2021 [AWS: n = 30, NT: n = 84, AWD: n = 50, citations=10(GS, March 2023)]. Original effect size: d = 0.97 [ d calculated from reported t statistic and converted using this conversion ]. 
1361	data/raw/replication_projects/lead_harvest/figure1_research_followup_20260504/forrt_reversals/12_html_database_https_forrt_org_reversals.bin	Phonological monitoring impairment in dyslexic adults , dyslexic show lower scores on phonological monitoring than neurotypical adults.	Status: mixed 	0	0	0	0	False	False					not_parseable_by_conservative_single_row_rule	Phonological monitoring impairment in dyslexic adults , dyslexic show lower scores on phonological monitoring than neurotypical adults. Statistics Status: mixed Original paper: ‘ Consolidation of vocabulary is associated with sleep in typically developing children, but not in children with dyslexia ’, Smith et al. 2018; experiment, n1 =23 dyslexic children, n2 = 29 neurotypical children. [citations=39(GS, March 2023)]. Critiques: Rathcke and Lin 2021 [n1 =13 dyslexic adults, n2 = 11 neurotypical adults, citations=1(GS, March 2023)]. Original effect size: η p 2 = 0.29 [ η p 2 calculated from re
1367	data/raw/replication_projects/lead_harvest/figure1_research_followup_20260504/forrt_reversals/12_html_database_https_forrt_org_reversals.bin	Phonological awareness impairment in dyslexic adults . Dyslexic show lower scores on phonological awareness than neurotypical adults.	Status: replicated 	2	3	0	0	False	False					not_parseable_by_conservative_single_row_rule	Phonological awareness impairment in dyslexic adults . Dyslexic show lower scores on phonological awareness than neurotypical adults. Statistics Status: replicated Original paper: ‘Persistence of Dyslexics’ Phonological Awareness Deficits’, Bruck 1992; experiment, dyslexic adults: n = 39; neurotypical adults: n = 20. [citations = 734 (GS, March 2023)]. Critiques: Elsherif et al. 2021 [AWS: n = 30, NT: n = 84, AWD: n = 50, citations=10(GS, March 2023)]. Original effect size: η 2 = 0.33 [ calculated using this conversion from F to partial eta squared ]. Replication effect size: Elsherif et al.: 
1373	data/raw/replication_projects/lead_harvest/figure1_research_followup_20260504/forrt_reversals/12_html_database_https_forrt_org_reversals.bin	Phonemic fluency impairment in dyslexic adults . Dyslexic adults show lower scores on phonemic fluency tasks than neurotypical adults. Phonemic fluency tasks ar	Status: replicated 	2	52	1	6	False	False	-0.32				not_parseable_by_conservative_single_row_rule	Phonemic fluency impairment in dyslexic adults . Dyslexic adults show lower scores on phonemic fluency tasks than neurotypical adults. Phonemic fluency tasks are a type of verbal fluency task, where people are asked to generate as many words as possible according to a specific criterion relating to phonemes, for instance words starting with the letter ‘M’. Statistics Status: replicated Original paper: ‘ Organizational deficits in dyslexia: Possible frontal lobe dysfunction ’, Levin 1990; experiment, children with dyslexia: n = 20, dyslexic children: n = 20. [citation = 97(GS, November 2022)]. 
1380	data/raw/replication_projects/lead_harvest/figure1_research_followup_20260504/forrt_reversals/12_html_database_https_forrt_org_reversals.bin	Semantic fluency impairment in dyslexic adults . Dyslexic adults show lower scores on semantic fluency than neurotypical adults. Semantic fluency tasks are a ty	Status: mixed 	2	31	1	7	False	False	0.37				not_parseable_by_conservative_single_row_rule	Semantic fluency impairment in dyslexic adults . Dyslexic adults show lower scores on semantic fluency than neurotypical adults. Semantic fluency tasks are a type of verbal fluency task, where people are asked to generate as many words as possible according to a specific criterion, for instance items that are part of the same category, such as foods. Statistics Status: mixed Original paper: ‘ Organizational deficits in dyslexia: Possible frontal lobe dysfunction ’, Levin 1990; experiment, children with dyslexia: n = 20, dyslexic children: n = 20. [citation = 97(GS, November 2022)]. Critiques: 
1386	data/raw/replication_projects/lead_harvest/figure1_research_followup_20260504/forrt_reversals/12_html_database_https_forrt_org_reversals.bin	Lexical precision lexical competition. The direction and magnitude of inhibitory priming in word targets with dense neighbourhoods is moderated by spelling.	Status: mixed 	2	2	2	2	False	False					not_parseable_by_conservative_single_row_rule	Lexical precision lexical competition. The direction and magnitude of inhibitory priming in word targets with dense neighbourhoods is moderated by spelling. Statistics Status: mixed Original paper: ‘ Lexical Precision in Skilled Readers: Individual Differences in Masked Neighbor Priming ’, Andrews and Hersch 2010; experiment, experiment 1: n= 97, Experiment 2: n = 123. [citation=207(GS, November 2022)]​. Critiques: Elsherif et al. 2022a n=84, citations=[ 8(GS, November 2022)]. Elsherif et al. 2022b n=84, citations=[28(GS, November 2022)]. Original effect size: experiment 1: η p 2 = 0.06/ d= 0.
1392	data/raw/replication_projects/lead_harvest/figure1_research_followup_20260504/forrt_reversals/12_html_database_https_forrt_org_reversals.bin	Placebo Effect. Refers to the phenomenon in which a treatment or intervention that has no specific therapeutic effect (such as a sugar pill or saline injection)	Status: replicated 	0	3	0	0	False	False					not_parseable_by_conservative_single_row_rule	Placebo Effect. Refers to the phenomenon in which a treatment or intervention that has no specific therapeutic effect (such as a sugar pill or saline injection) can still produce a therapeutic response in some individuals. The concept of the placebo effect can be traced back to the 18th century, when physicians and researchers began to notice that patients often reported improvements in their symptoms after receiving treatments that did not have any known physiological effects. Statistics Status: replicated Original paper: ‘ The powerful placebo ’, Beecher 1955; analysis of 15 studies on patie
