entry_index	local_path	label	status_text	original_n_count	replication_n_count	original_d_count	replication_d_count	conservative_parseable	passes_larger_n_if_parseable	D_original_if_parseable	N_original_if_parseable	D_replication_if_parseable	N_replication_if_parseable	decision	snippet
2035	data/raw/replication_projects/lead_harvest/figure1_research_followup_20260504/forrt_reversals/12_html_database_https_forrt_org_reversals.bin	One mind per hemisphere (split-brain syndrome). Surgical severing of the corpus callosum leads to the split-brain phenomenon, which is characterised by 1) a res	Status: mixed. 	1	1	0	0	False	False		1.0		2.0	not_parseable_by_conservative_single_row_rule	One mind per hemisphere (split-brain syndrome). Surgical severing of the corpus callosum leads to the split-brain phenomenon, which is characterised by 1) a response × visual field interaction, 2) strong hemispheric specialisation 3) confabulations after left-hand actions 4) split attention, and 5) the inability to compare stimuli across the midline. Together, these reported effects have been interpreted as evidence for split consciousness. Surgical procedure does not result in the development of two independent minds or consciousnesses within one brain. Instead, the findings suggest that the 
2041	data/raw/replication_projects/lead_harvest/figure1_research_followup_20260504/forrt_reversals/12_html_database_https_forrt_org_reversals.bin	Hydrocephaly. The effect of massive volume loss improving cognition. Hydrocephalus, also known as “water on the brain,” is a condition in which there is an abno	Status: NA 	0	1	0	1	False	False			-1.7	1.0	not_parseable_by_conservative_single_row_rule	Hydrocephaly. The effect of massive volume loss improving cognition. Hydrocephalus, also known as “water on the brain,” is a condition in which there is an abnormal accumulation of cerebrospinal fluid (CSF) in the ventricular system of the brain. This can cause the ventricles to become enlarged, putting pressure on the brain and causing a wide range of symptoms, depending on the severity of the condition and the age of the individual. There are two types of Hydrocephalus: congenital and acquired. Congenital Hydrocephalus is present at birth and is caused by a genetic or developmental abnormali
2047	data/raw/replication_projects/lead_harvest/figure1_research_followup_20260504/forrt_reversals/12_html_database_https_forrt_org_reversals.bin	Readiness potentials . Readiness potentials are neural signals that are observed in the brain prior to voluntary movements. They are typically measured using el	Status: replicated 	0	3	0	0	False	False					not_parseable_by_conservative_single_row_rule	Readiness potentials . Readiness potentials are neural signals that are observed in the brain prior to voluntary movements. They are typically measured using electroencephalography (EEG) and are thought to reflect the neural activity associated with preparing for a movement, occurring several hundred milliseconds before the movement occurred, suggesting that the brain prepares for the movement before the person is consciously aware of the decision to move. RP have been observed in various regions of the brain, including the primary motor cortex, supplementary motor area, and premotor cortex. S
2053	data/raw/replication_projects/lead_harvest/figure1_research_followup_20260504/forrt_reversals/12_html_database_https_forrt_org_reversals.bin	Left-brain vs. Right-brain Hypothesis . Individuals may be left-brain dominant or right-brain dominant based on personality and cognitive style. Specifically, t	Status: not replicated 	1	1	0	0	False	False		20.0		1011.0	not_parseable_by_conservative_single_row_rule	Left-brain vs. Right-brain Hypothesis . Individuals may be left-brain dominant or right-brain dominant based on personality and cognitive style. Specifically, the hypothesis proposes that the two hemispheres of the brain have different functions and abilities, with the left hemisphere being associated with logical, analytical, and verbal skills, and the right hemisphere being associated with creative, intuitive, and spatial skills. This idea has been popularised in popular culture, but it is not supported by scientific evidence. Statistics Status: not replicated Original paper: No original pap
2059	data/raw/replication_projects/lead_harvest/figure1_research_followup_20260504/forrt_reversals/12_html_database_https_forrt_org_reversals.bin	Oxytocin on trust . Intranasal administration of oxytocin increases trust in strangers in a laboratory setting.	Status: not replicated 	1	1	0	0	False	False		128.0		677.0	not_parseable_by_conservative_single_row_rule	Oxytocin on trust . Intranasal administration of oxytocin increases trust in strangers in a laboratory setting. Statistics Status: not replicated Original paper: ‘ Oxytocin increases trust in humans ’, Kosfeld et al. 2005; experiment, n = 128_. _[citations = 4800 (GS, April 2022)]. Critiques: Declerck et al. 2020 [n = 677, citations =57 (GS, April 2022)]. Lane et al. 2015 [n1 = 95, n2= 61, citations =63 (GS, April 2022)]. Original effect size: Not reported but could be calculated: “In fact, our data show that oxytocin increases investors’ trust considerably. Out of the 29 subjects, 13 (45%) in
2065	data/raw/replication_projects/lead_harvest/figure1_research_followup_20260504/forrt_reversals/12_html_database_https_forrt_org_reversals.bin	Structural brain-behaviour correlations - the association between behavioural activation and white matter integrity . Individual differences in the sensitivity 	Status: not replicated 	1	2	0	0	False	False		51.0			not_parseable_by_conservative_single_row_rule	Structural brain-behaviour correlations - the association between behavioural activation and white matter integrity . Individual differences in the sensitivity to signals of reward as indexed by BAS-Total and in the tendency to seek out potentially rewarding experiences as measured by BAS-Fun are positively correlated with diffusion measures of several white matter pathways. Statistics Status: not replicated Original paper: ‘ White matter integrity and behavioral activation in healthy subjects ’, Xu et al. 2012; correlational design, n = 51. [citations = 29 (GS, May 2022)]​. Critiques: corrige
2071	data/raw/replication_projects/lead_harvest/figure1_research_followup_20260504/forrt_reversals/12_html_database_https_forrt_org_reversals.bin	Structural brain behaviour correlations - the association between social network size and grey matter volume . Individual differences in the number of Facebook 	Status: mixed 	1	2	0	0	False	False		125.0			not_parseable_by_conservative_single_row_rule	Structural brain behaviour correlations - the association between social network size and grey matter volume . Individual differences in the number of Facebook friends (FBN) are positively correlated with grey matter volume in several brain areas: left middle temporal gyrus (MTG), right superior temporal sulcus (STS), rich entorhinal cortex (EC), left and right amygdala. Statistics Status: mixed Original paper: ‘ Online social network size is reflected in human brain structure ’, Kanai et al. 2012; correlational design, n = 125. [citations= 411 (GS, May 2022)]. Critiques: Boekel et al. 2015 [n
2077	data/raw/replication_projects/lead_harvest/figure1_research_followup_20260504/forrt_reversals/12_html_database_https_forrt_org_reversals.bin	Structural brain-behaviour correlations - the association between distractibility and grey matter volume . Variability in self-reported distractibility is posit	Status: not replicated 	1	1	0	0	False	False		155.0		36.0	not_parseable_by_conservative_single_row_rule	Structural brain-behaviour correlations - the association between distractibility and grey matter volume . Variability in self-reported distractibility is positively correlated with grey matter volume in the left superior parietal lobule (SPL) and negatively correlated with grey matter volume in medial pre-frontal cortex (mPFC). Statistics Status: not replicated Original paper: ‘ Distractibility in Daily Life Is Reflected in the Structure and Function of Human Parietal Cortex ’, Kanai et al. 2011; correlational and experimental design, n = 155. [citations= 110 (GS, May, 2022)]. Critiques: Boek
2083	data/raw/replication_projects/lead_harvest/figure1_research_followup_20260504/forrt_reversals/12_html_database_https_forrt_org_reversals.bin	Structural brain-behaviour correlations - the association between attention and cortical thickness . Individual differences in executive control are negatively 	Status: not replicated. 	1	1	0	0	False	False		132.0		35.0	not_parseable_by_conservative_single_row_rule	Structural brain-behaviour correlations - the association between attention and cortical thickness . Individual differences in executive control are negatively correlated with cortical thickness in left anterior cingulate cortex (ACC), left superior temporal gyrus (STG), and right middle temporal gyrus (MTG), whereas variation in alerting scores is negatively correlated with cortical thickness in the left superior parietal lobule (SPL). Statistics Status: not replicated. Original paper: ‘ Associations between Regional Associations between regional cortical thickness and attentional networks as
2089	data/raw/replication_projects/lead_harvest/figure1_research_followup_20260504/forrt_reversals/12_html_database_https_forrt_org_reversals.bin	Structural brain-behaviour correlations - the association between control over speed/accuracy of perceptual decisions and white matter tracts strength . Individ	Status: mixed 	1	3	0	0	False	False		9.0			not_parseable_by_conservative_single_row_rule	Structural brain-behaviour correlations - the association between control over speed/accuracy of perceptual decisions and white matter tracts strength . Individual differences in control over speed and accuracy of perceptual decisions are positively correlated with the strength of white matter tracts between the right presupplementary motor area (pre-SMA) and the right striatum. Statistics Status: mixed Original paper: ‘ Cortico-striatal connections predict control over speed and accuracy in perceptual decision making ’, Forstmann et al. 2010; correlational and experimental design, n = 9. [cit
2095	data/raw/replication_projects/lead_harvest/figure1_research_followup_20260504/forrt_reversals/12_html_database_https_forrt_org_reversals.bin	Structural brain-behaviour associations - the association between executive function and grey matter volume . Grey matter volume in the rostral dorsal premotor 	Status: not replicated 	1	1	0	0	False	False		135.0		87.0	not_parseable_by_conservative_single_row_rule	Structural brain-behaviour associations - the association between executive function and grey matter volume . Grey matter volume in the rostral dorsal premotor cortex is associated with individual differences in executive function as measured by the trail making test. Statistics Status: not replicated Original paper: ‘Searching for behavior relating to grey matter volume in a-priori defined right dorsal premotor regions: Lessons learned’, Genon et al. 2017; correlational design, n = 135. [citations=17 (GS, August 2022)]​. Critiques: Genon et al. 2017 [n = 87, citations=17 (GS, August 2022)]. O
2101	data/raw/replication_projects/lead_harvest/figure1_research_followup_20260504/forrt_reversals/12_html_database_https_forrt_org_reversals.bin	Fear conditioning - Amygdala . Animal research suggests that fear conditioning activates the amygdala ( LeDoux, 1993 ), which has been replicated in some (but n	Status: mixed 	1	8	0	0	False	False		18.0			not_parseable_by_conservative_single_row_rule	Fear conditioning - Amygdala . Animal research suggests that fear conditioning activates the amygdala ( LeDoux, 1993 ), which has been replicated in some (but not all) human fMRI fear conditioning studies. Statistics Status: mixed Original paper: ‘ Human Amygdala Activation during Conditioned Fear Acquisition and Extinction: a Mixed-Trial fMRI Study ’, LaBar et al. 1998; differential fear conditioning paradigm, N=18. [citations=1826(GS, March 2023)]​. Note that amygdala activation habituated over time, as it would be expected from research in animals; this methodological consideration has been
2107	data/raw/replication_projects/lead_harvest/figure1_research_followup_20260504/forrt_reversals/12_html_database_https_forrt_org_reversals.bin	Fear conditioning - vmPFC . Animal research suggests that fear extinction activates the vmPFC ( Morgan et al., 1993 ); based on these findings from animal resea	Status: mixed 	1	1	0	0	False	False		18.0		154.0	not_parseable_by_conservative_single_row_rule	Fear conditioning - vmPFC . Animal research suggests that fear extinction activates the vmPFC ( Morgan et al., 1993 ); based on these findings from animal research, some (but not all) human fMRI fear conditioning/extinction studies found that the vmPFC becomes activated during fear extinction recall. Statistics Status: mixed Original paper: ‘ Extinction Learning in Humans: Role of the Amygdala and vmPFC ’, Phelps et al. 2004; differential fear conditioning and extinction paradigm, N=18. [citations=2144(GS, March 2023)]​. Critiques: Diekhof et al. 2011 [meta-analysis, total n=154, citations=323
2113	data/raw/replication_projects/lead_harvest/figure1_research_followup_20260504/forrt_reversals/12_html_database_https_forrt_org_reversals.bin	Fear conditioning - Theta oscillations . Animal research suggests that fear conditioning evokes prefrontal theta activity, which can be measured with EEG in hum	Status: mixed Status: replicated 	1	5	0	0	False	False		42.0			not_parseable_by_conservative_single_row_rule	Fear conditioning - Theta oscillations . Animal research suggests that fear conditioning evokes prefrontal theta activity, which can be measured with EEG in humans. Statistics Status: mixed Status: replicated Original paper: ‘ Prefrontal Oscillations during Recall of Conditioned and Extinguished Fear in Humans ’, Mueller et al. 2014; two-day differential fear conditioning study, n=42. [citations=87(GS, January 2023)]​. Critiques: Bierwirth et al. 2021 [n=60, citations=11 (GS, January 2023)]. Chen et al. 2021 [n=13, citations=16(GS, January 2023)]. Mueller and Pizzagalli 2016 [n=16, citations=2
2120	data/raw/replication_projects/lead_harvest/figure1_research_followup_20260504/forrt_reversals/12_html_database_https_forrt_org_reversals.bin	Fear conditioning - Late Positive Potential . Fear conditioning leads to elevated amplitudes during the time period of the Late Positive Potential (LPP), i.e., 	Status: replicated. 	1	8	0	4	False	False		50.0			not_parseable_by_conservative_single_row_rule	Fear conditioning - Late Positive Potential . Fear conditioning leads to elevated amplitudes during the time period of the Late Positive Potential (LPP), i.e., a positive-going event-related brain potential (ERP) component​ that can be recorded using electroencephalography (EEG). Statistics Status: replicated. Original paper: ‘ Spatio-temporal dynamics of brain mechanisms in aversive classical conditioning: high-density event-related potential and brain electrical tomography analyses ’, Pizzagalli et al., 2003; differential fear conditioning paradigm, N=50. [citations=133(GS, 03-2023)]​. Criti
2126	data/raw/replication_projects/lead_harvest/figure1_research_followup_20260504/forrt_reversals/12_html_database_https_forrt_org_reversals.bin	Fear conditioning - Bradicardia / heart rate modulation . Fear conditioning leads to heart rate slowing (fear-conditioned bradycardia).	Status: replicated 	1	10	0	1	False	False		20.0	1.17		not_parseable_by_conservative_single_row_rule	Fear conditioning - Bradicardia / heart rate modulation . Fear conditioning leads to heart rate slowing (fear-conditioned bradycardia). Statistics Status: replicated Original paper: ‘ Conditioned heart rate response in human beings during experimental anxiety ’, Notterman et al. 1952; fear conditioning paradigm with heart rate recording, n= 20. [citations=122(GS, April 2023)]; see also Notterman et al., 1952b . Critiques: Castegnetti et al. 2016 [n=99, citations=31(Wiley, January 2023)]. Deane & Zeaman 1958 [n=10, citations=51(GS, January 2023)]. Gruss et al. 2016 [n=63, citations=86(Elsevier,
2132	data/raw/replication_projects/lead_harvest/figure1_research_followup_20260504/forrt_reversals/12_html_database_https_forrt_org_reversals.bin	Bouba/kiki effect (sound symbolism). When presented with sounds (e.g., the words “bouba” and “kiki”) and visual objects (e.g., a curvy shape and a spiky shape),	Status: replicated 	0	2	0	0	False	False					not_parseable_by_conservative_single_row_rule	Bouba/kiki effect (sound symbolism). When presented with sounds (e.g., the words “bouba” and “kiki”) and visual objects (e.g., a curvy shape and a spiky shape), humans make non-arbitrary mappings between sounds and objects (e.g., the curvy shape is consistently called “bouba”). Statistics Status: replicated Original paper: ‘Synaesthesia—A window into perception, thought and language’ Ramchandran and Hubbard 2001; two-alternative forced choice task (claim made about ‘95% of participants,’ but actual study not described), n=NA. [citations=2218 (GS, February 2023)​]. Critiques: Ćwiek et al. 2022 
2138	data/raw/replication_projects/lead_harvest/figure1_research_followup_20260504/forrt_reversals/12_html_database_https_forrt_org_reversals.bin	Human freezing behaviour (postural sway). A physiological response that occurs in response to a perceived threat. Overall, freezing-like behaviour has been repl	Status: replicated 	1	3	0	0	False	False		50.0			not_parseable_by_conservative_single_row_rule	Human freezing behaviour (postural sway). A physiological response that occurs in response to a perceived threat. Overall, freezing-like behaviour has been replicated in multiple studies across different species and contexts, and is considered a robust and reliable measure of fear and anxiety. Statistics Status: replicated Original paper: ‘ Facing Freeze: Social Threat Induces Bodily Freeze in Humans ’, Roelofs 2010; emotional face viewing task, n = 50. [citations=310(PUBMED, January 2023)]​. Critiques: Gladwin et al. 2016 [n= 30, citations=100 (PUBMED, January 2023)]. Hashemi et al. 2019 [n=7
2144	data/raw/replication_projects/lead_harvest/figure1_research_followup_20260504/forrt_reversals/12_html_database_https_forrt_org_reversals.bin	Glucose amplification of cortisol stress reactivity . After fasting, the administration of glucose prior to psychosocial stress or a nicotine challenge led to a	Status: mixed 	2	6	0	0	False	False					not_parseable_by_conservative_single_row_rule	Glucose amplification of cortisol stress reactivity . After fasting, the administration of glucose prior to psychosocial stress or a nicotine challenge led to an increased cortisol stress response (in comparison to water administration). ​Blood glucose levels were positively associated with the cortisol stress response triggered by the Trier Social Stress Test (TSST). Statistics Status: mixed Original paper: ‘ Effects of Fasting and Glucose Load on Free Cortisol Responses to Stress and Nicotine ’, Kirschbaum et al. 1997; laboratory experiment, administration of glucose (100 g) prior to the Tri
2150	data/raw/replication_projects/lead_harvest/figure1_research_followup_20260504/forrt_reversals/12_html_database_https_forrt_org_reversals.bin	Resting-state functional connectivity patterns can accurately classify individuals diagnosed with depression . Multivariate pattern analyses can identify patter	Status: mixed 	0	0	0	0	False	False					not_parseable_by_conservative_single_row_rule	Resting-state functional connectivity patterns can accurately classify individuals diagnosed with depression . Multivariate pattern analyses can identify patterns of resting-state functional connectivity that successfully differentiate individuals with depression from healthy controls. This finding demonstrates the potential utility of resting-state functional connectivity as a biomarker of depression. Statistics Status: mixed Original paper: ‘Disease state prediction from resting state functional connectivity’, Craddock et al. 2009; quasi-experimental design, n controls = 20, n clinical = 20.
2156	data/raw/replication_projects/lead_harvest/figure1_research_followup_20260504/forrt_reversals/12_html_database_https_forrt_org_reversals.bin	Low self-esteem on poor mental health/psychological outcomes . Poor self-esteem results in a decrease in self-appreciation, producing self-defeating attitudes, 	Status: not replicated 	0	1	0	1	False	False			0.37	10.0	not_parseable_by_conservative_single_row_rule	Low self-esteem on poor mental health/psychological outcomes . Poor self-esteem results in a decrease in self-appreciation, producing self-defeating attitudes, poor mental health, social problems or risk behaviours. Statistics Status: not replicated Original paper: ‘Pygmalion in the classroom’ Rosenthal, and Jacobsen 1968; Teachers were told that certain children would perform better based on a test that was actually non-existent, N = NA. [Citations=13722 (GS, March 2023)]. Critiques: Baumeister et al.2003 [review paper, n=total number of studies included in their review seems unclear - starte
2162	data/raw/replication_projects/lead_harvest/figure1_research_followup_20260504/forrt_reversals/12_html_database_https_forrt_org_reversals.bin	Rorschach Test (Rorschach inkblot test). A diagnostic tool for psychiatric conditions in which subjects’ perceptions of inkblots are recorded and analysed using	Status: NA 	0	0	0	0	False	False					not_parseable_by_conservative_single_row_rule	Rorschach Test (Rorschach inkblot test). A diagnostic tool for psychiatric conditions in which subjects’ perceptions of inkblots are recorded and analysed using psychological interpretation, complex algorithms, or both. Statistics Status: NA Original paper: ’ Psychodiagnostik ’ (Psychodiagnostics), Rorschach 1921; book, n=NA [Citations=536 (GS, April 2023)]. Critiques: Garb 1998 [book, n=NA, citations=1059 (GS, April 2023)]. Lilienfeld et al. 2006 [n=NA, citations=36 (GS, April 2023)]. Mihura et al. 2013 [systematically reviewed the validity over 53 meta-analyses examining variables against ex
2168	data/raw/replication_projects/lead_harvest/figure1_research_followup_20260504/forrt_reversals/12_html_database_https_forrt_org_reversals.bin	Lunar effect (Transylvania effect). Full moons lead to strange occurrences in human behaviour. ​	Status: mixed 	0	3	0	0	False	False					not_parseable_by_conservative_single_row_rule	Lunar effect (Transylvania effect). Full moons lead to strange occurrences in human behaviour. ​ Statistics Status: mixed Original paper: ‘ The Lunar effect ’, Lieber 1978; correlational study, N ≈ 26,000. [Citations= 118 (GS, January 2023)]. Critiques: Gutiérrez-Garcia and Tusell 1997 [n=897 deaths by suicide citations= 64 (GS, January 2023)]. Kung, and Mrazek 2005 [n=1,826 nights (186 nights fit the definition of the full-moon effect), citations= 15 (GS, January 2023)]. Kamat et al. 2014 [n=559, citations= 17 (GS, January 2023)]. Rotton and Kelly 1985 Meta-analysis [N≈781,000 across 37 studi
2174	data/raw/replication_projects/lead_harvest/figure1_research_followup_20260504/forrt_reversals/12_html_database_https_forrt_org_reversals.bin	Lack of a Theory of Mind is universal in autism . All autistic people fail to understand that other people have a mind or that they themselves have a mind.	Status: not replicated 	2	0	1	1	False	False	-1.714		-0.039		not_parseable_by_conservative_single_row_rule	Lack of a Theory of Mind is universal in autism . All autistic people fail to understand that other people have a mind or that they themselves have a mind. Statistics Status: not replicated Original paper: ‘ Mechanical, behavioural and Intentional understanding of picture stories in autistic children ’, Baron-Cohen et al. 1986; quasi-experimental design, n = 21 autistic children, 5 Down’s syndrome children, 27 neurotypical preschoolers, total n = 53. [citation=1163 (GS, April 2022)]​. Critiques: Gernsbacher and Yergeau 2019 [Review, n=NA, citations=65 (GS, April 2022)]. Original effect size: d
2180	data/raw/replication_projects/lead_harvest/figure1_research_followup_20260504/forrt_reversals/12_html_database_https_forrt_org_reversals.bin	Precognition . Undergraduates improve memory test performance by studying after the test.	Status: not replicated 	9	4	11	3	False	False					not_parseable_by_conservative_single_row_rule	Precognition . Undergraduates improve memory test performance by studying after the test. Statistics Status: not replicated Original paper: ‘ Feeling the future: Experimental evidence for anomalous retroactive influences on cognition and affect ’, Bem 2012, 9 experiments with: Study 1: n=100; Study 2: n= 150; Study 3: n = 100; Study 4: n = 100; Study 5: n = 100; Study 6: n = 150; Study 7: n = 200; Study 8: n = 100; Study 9: n = 50. [citation = 1216 (GS, March 2022)]. Critiques: Gelman and Loken 2013 [newspaper article, n=NA, citations=0(GS, April 2023)]. Ritchie et al. 2012 [3 replications: Re
