entry_index	local_path	label	status_text	original_n_count	replication_n_count	original_d_count	replication_d_count	conservative_parseable	passes_larger_n_if_parseable	D_original_if_parseable	N_original_if_parseable	D_replication_if_parseable	N_replication_if_parseable	decision	snippet
40	data/raw/replication_projects/lead_harvest/figure1_research_followup_20260504/forrt_reversals/12_html_database_https_forrt_org_reversals.bin	Elderly priming . that hearing about old age makes people walk slower.	Status: reversed 	2	2	0	2	False	False					not_parseable_by_conservative_single_row_rule	Elderly priming . that hearing about old age makes people walk slower. Statistics Status: reversed Original paper: ‘ Automaticity of social behaviour ’, Bargh 1996; 2 experiments with Study 2a: n = 30, Study 2b: n = 30. [citations = 5938(GS, October 2021)]​. Critiques: Doyen 2012 [n=120, citations=757(GS, October 2021)]. Lakens 2017 [meta analysis: citations = 21(GS, October 2021)]. Pashler et al. 2011 [n=66, citations=21(GS, October 2021)]. Original effect size: not reported. ​ Replication effect size: Doyen: walking speed: η 2 =.01/ d = 0.10 [calculated, using this conversion ]. Lakens: r = 
46	data/raw/replication_projects/lead_harvest/figure1_research_followup_20260504/forrt_reversals/12_html_database_https_forrt_org_reversals.bin	Hostility priming (unscrambled sentences) . Exposing participants to more hostility-related stimuli caused them subsequently to interpret ambiguous behaviours a	Status: not replicated 	2	3	0	23	False	False					not_parseable_by_conservative_single_row_rule	Hostility priming (unscrambled sentences) . Exposing participants to more hostility-related stimuli caused them subsequently to interpret ambiguous behaviours as more hostile. Statistics Status: not replicated Original paper: ‘ The role of category accessibility in the interpretation of information about persons: Some determinants and implications’ , Srull and Wyer, Jr. 1979; 2 experiments with Study 1: n = 96; Study 2: n = 96. [citations = 2409 (GS, November 2021)]. Critique: McCarthy et al. 2018 [n = 7,373 for Study 1, citations = 40(GS, November 2021)]. McCarthy et al. 2021 (see Figure) [n 
52	data/raw/replication_projects/lead_harvest/figure1_research_followup_20260504/forrt_reversals/12_html_database_https_forrt_org_reversals.bin	Intelligence priming (contemplation) (professor priming). Participants primed with a category associated with intelligence (e.g. “professor”) performed 13% bett	Status: not replicated 	4	2	0	0	False	False					not_parseable_by_conservative_single_row_rule	Intelligence priming (contemplation) (professor priming). Participants primed with a category associated with intelligence (e.g. “professor”) performed 13% better on a trivia test than participants primed with a category associated with a lack of intelligence (“soccer hooligans”). Statistics Status: not replicated Original paper: ‘ The relation between perception and behavior, or how to win a game of trivial pursuit ’, Dijksterhuis and van Knippenberg 1998; 4 experiments with Study 1: n = 60; Study 2: n = 58; Study 3: n = 95; Study 4: n = 43. [citations = 1124 (GS November 2021)]. Critiques: O
58	data/raw/replication_projects/lead_harvest/figure1_research_followup_20260504/forrt_reversals/12_html_database_https_forrt_org_reversals.bin	Moral priming (cleanliness) . Participants exposed to physical cleanliness were shown to reduce the severity of their moral judgments. Direct, well-powered repl	Status: not replicated 	2	2	2	2	False	False					not_parseable_by_conservative_single_row_rule	Moral priming (cleanliness) . Participants exposed to physical cleanliness were shown to reduce the severity of their moral judgments. Direct, well-powered replications did not find evidence for the phenomenon. Statistics Status: not replicated Original paper: With a Clean Conscience: Cleanliness Reduces the Severity of Moral Judgments , Schnall, Benton, and Harvey, 2008; 2 experiments with Study 1: n = 40, Study 2: n = 44. [citations=645 (GS November 2021)]. Critiques: Johnson et al. 2014, [Study 1: n = 208, Study 2: n = 126. citations=128(GS November 2021)]. Original effect size: Study 1: d 
64	data/raw/replication_projects/lead_harvest/figure1_research_followup_20260504/forrt_reversals/12_html_database_https_forrt_org_reversals.bin	Moral priming (contemplation) . Participants exposed to a moral-reminder prime would demonstrate reduced cheating.	Status: not replicated 	6	1	2	40	False	False				5786.0	not_parseable_by_conservative_single_row_rule	Moral priming (contemplation) . Participants exposed to a moral-reminder prime would demonstrate reduced cheating. Statistics Status: not replicated Original paper: ‘ The Dishonesty of Honest People: A Theory of Self-Concept Maintenance ’, Mazar et al. 2008; 6 experiments with Study 1: n = 229; Study 2: n = 207; Study 3: n = 450; Study 4: n = 44; Study 5: n = 108; Study 6: n = 326. [citations= 3072 (GS November 2021)]. Critiques: Verschuere et al. 2018 [n = 5786 replication of Experiment 1, citations = 65(GS November 2021)]. Original effect size: not reported; commandants-cheat versus books-ch
70	data/raw/replication_projects/lead_harvest/figure1_research_followup_20260504/forrt_reversals/12_html_database_https_forrt_org_reversals.bin	Distance priming . Participants primed with distance compared to closeness produced greater enjoyment of media depicting embarrassment (Study 1), less emotional	Status: not replicated 	0	1	1	1	False	False	0.31		0.009	92.0	not_parseable_by_conservative_single_row_rule	Distance priming . Participants primed with distance compared to closeness produced greater enjoyment of media depicting embarrassment (Study 1), less emotional distress from violent media (Study 2), lower estimates of the number of calories in unhealthy food (Study 3), and weaker reports of emotional attachments to family members and hometowns (Study 4). Statistics Status: not replicated Original paper: ‘ Keeping One’s Distance: The Influence of Spatial Distance Cues on Affect and Evaluation ’, Williams and Bargh 2008; 4 studies with n’s = 73, 42, 59 and 84. [citation=581(GS, October 2021)]​.
76	data/raw/replication_projects/lead_harvest/figure1_research_followup_20260504/forrt_reversals/12_html_database_https_forrt_org_reversals.bin	Flag priming . Participants primed by a flag are more likely to be more in conservative positions than those in the control condition.	Status: mixed 	2	1	1	37	False	False	0.5			6082.0	not_parseable_by_conservative_single_row_rule	Flag priming . Participants primed by a flag are more likely to be more in conservative positions than those in the control condition. Statistics Status: mixed Original paper: ‘ A Single Exposure to the American Flag Shifts Support Toward Republicanism up to 8 Months Later’, Carter et al. 2011; experimental design, 2 studies with n = 191 completed three sessions and 71 completed the fourth session, Experiment 2: n = 70. [citations = 186 (GS, October 2021)]. Critique: Klein et al. 2014 [n=6,082, citations = 957 (GS, October 2021)]. Original effect size: d = 0.50. Replication effect size: All ef
82	data/raw/replication_projects/lead_harvest/figure1_research_followup_20260504/forrt_reversals/12_html_database_https_forrt_org_reversals.bin	Fluency priming . Objects that are fluent (e.g., conceptually fluent, visually fluent) are perceived more concretely than objects that are disfluent (disfluent 	Status: not replicated 	1	1	1	1	True	True	0.26	70.0	0.04	1146.0	candidate_not_promoted_duplicate_risk_and_narrative_alignment_needed	Fluency priming . Objects that are fluent (e.g., conceptually fluent, visually fluent) are perceived more concretely than objects that are disfluent (disfluent objects are perceived more abstractly). Statistics Status: not replicated Original paper: ‘ Effects of Fluency on Psychological Distance and Mental Construal (or Why New York Is a Large City, but New York Is a Civilized Jungle) ’, Alter and Oppenheimer 2008; experimental design, 3 studies, 2 of which are split into Part A and Part B with n’s = 1A: 40 and 1B: 196; 2A: 32 and 2B: 230; Experiment 3: n = 70. [citations = 304 (GS, October 20
88	data/raw/replication_projects/lead_harvest/figure1_research_followup_20260504/forrt_reversals/12_html_database_https_forrt_org_reversals.bin	Money priming . Images or phrases related to money cause increased faith in capitalism, and the belief that victims deserve their fate.	Status: not replicated 	0	1	4	5	False	False				136.0	not_parseable_by_conservative_single_row_rule	Money priming . Images or phrases related to money cause increased faith in capitalism, and the belief that victims deserve their fate. Statistics Status: not replicated Original paper: ‘ Mere exposure to money increases endorsement of free-market systems and social inequality ’, Caruso 2013; experimental design, n between 30 and 168 [(citations~161 (GS, November 2021)]. Critiques: Rohrer 2015 [n=136, citations = 82 (GS, November 2021)]. Meta-analysis: Lodder 2019 [ k =246, citations = 64 (GS, November 2021)]. Original effect size: system justification _d _= 0.8, just world _d _= 0.44, dominan
94	data/raw/replication_projects/lead_harvest/figure1_research_followup_20260504/forrt_reversals/12_html_database_https_forrt_org_reversals.bin	Commitment priming (recall) . Participants exposed to a high-commitment prime would exhibit greater forgiveness.	Status: not replicated 	3	1	1	1	False	False	-0.65		-0.22	2284.0	not_parseable_by_conservative_single_row_rule	Commitment priming (recall) . Participants exposed to a high-commitment prime would exhibit greater forgiveness. Statistics Status: not replicated Original paper: ‘ Dealing with betrayal in close relationships: Does commitment promote forgiveness? ’, Finkel et al. 2002; 3 experiments with Study 1: n = 89; Study 2: n = 155; Study 3: n = 78. [citations = ~ 1108(GS, November 2021)]. Critiques: Cheung et al. 2016 [n = 2284, citations = 110(GS, November 2021)]. Original effect size: d = -0.65. Replication effect size: Cheung et al.: d = -0.22.
100	data/raw/replication_projects/lead_harvest/figure1_research_followup_20260504/forrt_reversals/12_html_database_https_forrt_org_reversals.bin	Mortality Salience (Death Priming/Terror Management Theory). Reminders of death lead to subconscious changes in attitudes and behaviour, for example in the form	Status: not replicated 	1	4	1	6	False	False	0.82	58.0			not_parseable_by_conservative_single_row_rule	Mortality Salience (Death Priming/Terror Management Theory). Reminders of death lead to subconscious changes in attitudes and behaviour, for example in the form of increased in-group bias and behaviour that serves to defend an individual’s cultural worldview. Statistics Status: not replicated Original paper: ‘Role of Consciousness and Accessibility of Death-Related Thoughts in Mortality Salience Effects’ , Greenberg et al. 1994; Experiment 1, n=58. [citations=1294 (GS, June 2022)]. A second original paper was ‘ I am not an animal: Mortality salience, disgust, and the denial of human creatureli
106	data/raw/replication_projects/lead_harvest/figure1_research_followup_20260504/forrt_reversals/12_html_database_https_forrt_org_reversals.bin	Spatial priming for emotional closeness . Plotting points closer together led to participants reporting they were closer to their own family members than those 	Status: not replicated 	4	2	4	2	False	False					not_parseable_by_conservative_single_row_rule	Spatial priming for emotional closeness . Plotting points closer together led to participants reporting they were closer to their own family members than those who plotted points farther apart. Statistics Status: not replicated Original paper: ‘ Keeping One’s Distance: The effect of spatial distance cues on affect and emotion ’, Lawrence and Bargh 2008, 4 experiments with Study 1: n = 73; Study 2: n = 42; Study 3: n = 59; Study 4: n = 84. [citation= 583 (GS, January 2022)]. Critiques: Pashler et al. 2012 [n = 92, citations = 188 (GS, January 2022)]. Open Science Collaboration 2015 [n=125, cita
112	data/raw/replication_projects/lead_harvest/figure1_research_followup_20260504/forrt_reversals/12_html_database_https_forrt_org_reversals.bin	Implicit God prime increases self-reported risky behaviour . Implicitly priming God using the scrambled-sentence paradigm increases self-reported risk taking.	Status: not replicated 	2	2	2	2	False	False					not_parseable_by_conservative_single_row_rule	Implicit God prime increases self-reported risky behaviour . Implicitly priming God using the scrambled-sentence paradigm increases self-reported risk taking. Statistics Status: not replicated Original paper: ‘ Anticipating divine protection? Reminders of god can increase nonmoral risk taking ’, Kupor et al. 2015; experimental design, Experiment 1a: n=61 and Experiment 1b: n=202. [citations=76 (GS, November 2022)]. Critiques: Gervais et al. 2020 [Experiment 1a: n=556, Experiment 1b: n=548, citations=9 (GS, November 2022)]. Original effect size: Experiment 1a: d =0.574 [0.05, 1.09]; Experiment 
118	data/raw/replication_projects/lead_harvest/figure1_research_followup_20260504/forrt_reversals/12_html_database_https_forrt_org_reversals.bin	Implicit God prime increases actual risky behaviour . Implicitly priming God using the scrambled-sentence paradigm increases willingness to engage in risky beha	Status: not replicated 	1	2	0	1	False	False		101.0	-0.11		not_parseable_by_conservative_single_row_rule	Implicit God prime increases actual risky behaviour . Implicitly priming God using the scrambled-sentence paradigm increases willingness to engage in risky behaviour for financial reward. Statistics Status: not replicated Original paper: ‘ Anticipating divine protection? Reminders of god can increase nonmoral risk taking ’, Kupor et al. 2015; Experiment 3: n=101. [citations=76 (GS, November 2022)]. Critiques:[ Gruneau Brulin et al. 2018 Experiment 1b: n = 160, Experiment 2b: n=264, citations=19 (GS, November 2022)]. Original effect size: Experiment 3: b =0.61. Replication effect size: Gruneau 
124	data/raw/replication_projects/lead_harvest/figure1_research_followup_20260504/forrt_reversals/12_html_database_https_forrt_org_reversals.bin	Heat priming . Exposure to words related to hot temperatures increases aggressive thoughts and hostile perceptions. This effect suggests that people mentally as	Status: not replicated 	2	2	4	5	False	False					not_parseable_by_conservative_single_row_rule	Heat priming . Exposure to words related to hot temperatures increases aggressive thoughts and hostile perceptions. This effect suggests that people mentally associate heat-related constructs with aggression-related constructs. Statistics Status: not replicated Original paper: ‘ Hot under the collar in a lukewarm environment: Words associated with hot temperature increase aggressive thoughts and hostile perceptions ’, DeWall & Bushman 2009; 2 experiments in which participants were first exposed to words related to either heat, cold, or neutral concepts and then completed a word stem completion
130	data/raw/replication_projects/lead_harvest/figure1_research_followup_20260504/forrt_reversals/12_html_database_https_forrt_org_reversals.bin	​​Honesty priming (goal-priming, social priming). An increased level of honesty to embarrassing behaviours after exposure to honesty-related words.	Status: not replicated 	1	5	1	7	False	False	1.21	64.0			not_parseable_by_conservative_single_row_rule	​​Honesty priming (goal-priming, social priming). An increased level of honesty to embarrassing behaviours after exposure to honesty-related words. Statistics Status: not replicated Original paper: ‘ Using implicit goal priming to improve the quality of self-report data ’, Rasinski et al. 2005; between-subjects, n = 64. [citations = 111 (GS, October 2022)]. Critiques: Pashler et al. 2013 [Direct replication, Experiment 1 n=149 and Experiment 2 n=152, and conceptual replication, Experiment 3 n=151 and Experiment 4 n=153, citations = 66 (GS, October 2022)]. Dalal and Hakel 2016 [Experiment 1 n =
136	data/raw/replication_projects/lead_harvest/figure1_research_followup_20260504/forrt_reversals/12_html_database_https_forrt_org_reversals.bin	Achievement priming (goal priming, high-performance goal priming). Exposing individuals to words that are success oriented (e.g., win, strive) will increase the	Status: mixed. 	5	3	5	11	False	False					not_parseable_by_conservative_single_row_rule	Achievement priming (goal priming, high-performance goal priming). Exposing individuals to words that are success oriented (e.g., win, strive) will increase their performance on a task compared to those exposed to neutral words (e.g., carpet, shampoo).​ Statistics Status: mixed. Original paper: ‘The Automated Will: Nonconscious Activation and Pursuit of Behavioral Goals’ , Bargh et al. 2001; between-subjects, Experiment 1: n=78, Experiment 2: n=60, Experiment 3: n=288, Experiment 4: n=76, Experiment 5: n=65. [citation = 2,987 (GS, October 2022)]. Critiques: Shantz and Latham 2009 [Pilot Study:
142	data/raw/replication_projects/lead_harvest/figure1_research_followup_20260504/forrt_reversals/12_html_database_https_forrt_org_reversals.bin	Weapons priming effect (weapons effect). Stimuli or cues associated with aggression, such as weapons, can elicit aggressive responses.	Status: mixed (the effect is smaller than originally believed) 	1	4	1	8	False	False	0.76	100.0			not_parseable_by_conservative_single_row_rule	Weapons priming effect (weapons effect). Stimuli or cues associated with aggression, such as weapons, can elicit aggressive responses. Statistics Status: mixed (the effect is smaller than originally believed) Original paper: ‘ Weapons as aggression-eliciting stimuli ’, Berkowitz and LePage 1967; between-subjects design, n = 100 (male university students). [citations = 1161 (GS, October 2022)]. Critiques: Turner and Simons 1974 [ n = 60, citations = 11 (GS, October 2022)]. Frodi 1975 [_n = _100, citations = 50 (GS, October 2022)]. Carlson et al. 1990 [meta-analysis; n = 628 (fail-safe), k = 56 
148	data/raw/replication_projects/lead_harvest/figure1_research_followup_20260504/forrt_reversals/12_html_database_https_forrt_org_reversals.bin	Goal priming effect (goal contagion, goal inspiration, behavioural inspiration). The observation of other’ behaviour (e.g., your observe someone jogging in the 	Status: not replicated 	1	2	0	0	False	False		83.0			not_parseable_by_conservative_single_row_rule	Goal priming effect (goal contagion, goal inspiration, behavioural inspiration). The observation of other’ behaviour (e.g., your observe someone jogging in the park) may lead to the inference of the goal in the observer (“This person wants to keep fit.”) and to the adoption of the same goal (“Maybe I should do some sports too.”). Statistics Status: not replicated Original paper: ‘ Goal Contagion: Perceiving Is for Pursuing ’, Aarts, Gollwitzer and Hassin 2004; Study 1, 2 (need for money: high vs low) x 2 (goal: money vs control) between-subjects ANOVA with dependent variable of earning money g
154	data/raw/replication_projects/lead_harvest/figure1_research_followup_20260504/forrt_reversals/12_html_database_https_forrt_org_reversals.bin	Verbal framing (temporal tense) . Participants who read what a person was doing (relative to those who read what person did) showed enhanced accessibility of in	Status: mixed 	3	2	4	38	False	False					not_parseable_by_conservative_single_row_rule	Verbal framing (temporal tense) . Participants who read what a person was doing (relative to those who read what person did) showed enhanced accessibility of intention-related concepts and attributed more intentionality to the person. Statistics Status: mixed Original paper: ‘ Learning about what others were doing: Verb aspect and attributions of mundane and criminal intent for past actions ’, Hart and Albarracin (2011): 3 experiments with Study 1: n = 5458; Study 2: n = 37; Study 3: n = 48. [citations = 37, (GS, January 2022)]. Critiques: Eerland et al. (2016) [meta analysis (total n= 685 for
160	data/raw/replication_projects/lead_harvest/figure1_research_followup_20260504/forrt_reversals/12_html_database_https_forrt_org_reversals.bin	Reference framing . Risk preferences change depending on whether a choice is presented in terms of gains or losses, even when the prospects of the options are h	Status: replicated 	2	1	0	0	False	False				4098.0	not_parseable_by_conservative_single_row_rule	Reference framing . Risk preferences change depending on whether a choice is presented in terms of gains or losses, even when the prospects of the options are held constant.​ Statistics Status: replicated Original paper: ‘ Prospect Theory: An analysis of decisions under risk ’ Kahneman and Tversky 1979; between-subject manipulation of choice problems, Problem 12 n = 68, Problem 13 n = 68. [citations=76,664(GS, March 2023)]​. Critiques: Ruggeri et al. 2020 [multinational replication study n=4,098, citations=143(GS, March 2023)].​ Original effect size: log OR = -2.485 (reported in Ruggeri et al.
166	data/raw/replication_projects/lead_harvest/figure1_research_followup_20260504/forrt_reversals/12_html_database_https_forrt_org_reversals.bin	Prosocial spending . Spending money on other people leads to greater happiness than spending money on oneself.	Status: replicated 	1	3	0	7	False	False		632.0			not_parseable_by_conservative_single_row_rule	Prosocial spending . Spending money on other people leads to greater happiness than spending money on oneself. Statistics Status: replicated Original paper: ‘ Spending Money on Others Promotes Happiness ’, Dunn et al. , 2008; cross-sectional survey, n=632. [citations = 2008 (GS, March 2022)]. Critiques: Akinn et al., 2020 [3 Experiments, Experiment 1: n=712, Experiment 2: n =1,950, Experiment 3: n =5,199, citations = 51 (GS, March 2022)]. Original effect size: _b _= 0.11. Replication effect size: Experiment 1: positive affect: d = .36, positive emotion: d = .32; Experiment 2: positive affect: 
172	data/raw/replication_projects/lead_harvest/figure1_research_followup_20260504/forrt_reversals/12_html_database_https_forrt_org_reversals.bin	Gustatory disgust on moral judgement . Gustatory disgust triggers a heightened sense of moral wrongness.	Status: not replicated 	1	3	2	24	False	False		57.0			not_parseable_by_conservative_single_row_rule	Gustatory disgust on moral judgement . Gustatory disgust triggers a heightened sense of moral wrongness. Statistics Status: not replicated Original paper: ‘ A Bad Taste in the Mouth: Gustatory Disgust Influences Moral Judgment ’, Eskine et al. 2011; experiment, n = 57.[citation = 564 (GS, January 2022)]. Critiques: Ghelfi et al. 2020 [meta-analysis, total n = 1137, citations = 18 (GS, January 2022)]. Johnson et al. 2016 [Study 1: n = 478, Study 2: n = 934, citations=52 (GS January 2022)]. Original effect size:_ _Cohen’s _d _= 1.12 (comparison to control group); Cohen’s _d _= 1.28 (comparison t
178	data/raw/replication_projects/lead_harvest/figure1_research_followup_20260504/forrt_reversals/12_html_database_https_forrt_org_reversals.bin	Macbeth effect . Moral aspersions induce literal physical hygiene.	Status: mixed 	4	1	0	0	False	False				1746.0	not_parseable_by_conservative_single_row_rule	Macbeth effect . Moral aspersions induce literal physical hygiene. Statistics Status: mixed Original paper: ‘ Washing away your sins: threatened morality and physical cleansing ’, Zhong and Liljenquist 2006; 4 experiments with Study 1: n=60, Study 2: n=27, Study 3: n=32, Study 4: n=45. [citation = 1407 (GS, January 2022)]. Critiques: Siev et al. 2018 [meta-analysis: n=1,746, citations = 17(GS, January 2022)]. Original effect size: Study 1: g = 0.38; Study 2: g = 0.75; Study 3: g = 0.38; Study 4: g = 0.33. Replication effect size: Siev et al.: g = 0.17 [0.04 - 0.31]. All effect sizes are locate
184	data/raw/replication_projects/lead_harvest/figure1_research_followup_20260504/forrt_reversals/12_html_database_https_forrt_org_reversals.bin	Signing at the beginning rather than end makes ethics salient . Signing a statement of honest intent before providing information rather than after can reduce d	Status: not replicated/ retracted 	3	0	0	0	False	False					not_parseable_by_conservative_single_row_rule	Signing at the beginning rather than end makes ethics salient . Signing a statement of honest intent before providing information rather than after can reduce dishonesty. Statistics Status: not replicated/ retracted Original paper: ‘ Signing at the Beginning Makes Ethics Salient and Decreases Dishonest Self-reports in Comparison to Signing at the End ’, Shu et al., 2012; lab and field experiments, Study 1: n = 101; Study 2: n = 60; Study 3: n = 13.488. [citations=465 (GS, February 2022)]​. Critiques: Paper retracted due to evidence of fraud by Uri, Joe and Leif, 2021 [n=NA, citations=2 (GS, Ma
