entry_index	local_path	label	status_text	original_n_count	replication_n_count	original_d_count	replication_d_count	conservative_parseable	passes_larger_n_if_parseable	D_original_if_parseable	N_original_if_parseable	D_replication_if_parseable	N_replication_if_parseable	decision	snippet
639	data/raw/replication_projects/lead_harvest/figure1_research_followup_20260504/forrt_reversals/12_html_database_https_forrt_org_reversals.bin	Women’s education increases domestic violence . Women with more education report higher levels of psychological violence at home​.	Status: not replicated 	1	1	0	0	False	False		1462.0		1093.0	not_parseable_by_conservative_single_row_rule	Women’s education increases domestic violence . Women with more education report higher levels of psychological violence at home​. Statistics Status: not replicated Original paper: ‘ For Better or for Worse?: Education and the Prevalence of Domestic Violence in Turkey ’, Erten and Keskin 2018; natural experiment (RDD/IV), N = 1462. [citations = 153 (GS, February 2023)]. Critiques: Akyol et al. 2020 [natural experiment (RDD/IV), N = 1093, citations = 4 (GS, February 2023)]. Original effect size: With a regression continuity design, the authors determine that 1 more year of education leads to a 
645	data/raw/replication_projects/lead_harvest/figure1_research_followup_20260504/forrt_reversals/12_html_database_https_forrt_org_reversals.bin	Easterlin paradox (national income associated with happiness). When comparing across countries, higher levels of income are associated with higher levels of sub	Status: mixed 	1	2	0	0	False	False		25.0			not_parseable_by_conservative_single_row_rule	Easterlin paradox (national income associated with happiness). When comparing across countries, higher levels of income are associated with higher levels of subjective well-being, yet this association does not show up across time. Statistics Status: mixed Original paper: ’Does Economic Growth Improve the Human Lot? Some Empirical Evidence’ , Easterlin 1974 observational study, n=25 time series observations for the United States from 1946-1970. [citations=8686(GS, February 2023)]​. Critiques: Easterlin 2005 [focused on descriptive statistics, citations=470(GS, February 2023)]. Hagerty and Veenh
651	data/raw/replication_projects/lead_harvest/figure1_research_followup_20260504/forrt_reversals/12_html_database_https_forrt_org_reversals.bin	Humour style clusters . A number of works have attempted to determine whether individuals can be categorised into different types of humour user. The first was 	Status: mixed 	1	6	0	0	False	False		318.0			not_parseable_by_conservative_single_row_rule	Humour style clusters . A number of works have attempted to determine whether individuals can be categorised into different types of humour user. The first was by Galloway (2010) and suggested four types of humour user through use of cluster analysis: (1) above average on all of the styles, or (2) below average on all of the styles, or (3) above average on the positive styles (Affiliative and Self-enhancing), and below average on the negative styles (Aggressive and Self-defeating), or (4) above average on the negative styles and below average on the positive styles. Statistics Status: mixed Or
657	data/raw/replication_projects/lead_harvest/figure1_research_followup_20260504/forrt_reversals/12_html_database_https_forrt_org_reversals.bin	Social referencing effect . Crosby et al. (2008) found that hearing an offensive remark caused subjects to look longer at a potentially offended person, but onl	Status: mixed 	1	2	0	0	False	False		25.0			not_parseable_by_conservative_single_row_rule	Social referencing effect . Crosby et al. (2008) found that hearing an offensive remark caused subjects to look longer at a potentially offended person, but only if that person could hear the remark. On the basis of this result, they argued that people use social referencing to assess the offensiveness. Statistics Status: mixed Original paper: ‘ Where do we look during potentially offensive behavior? ’, Crosby et al. 2008; experimental design, n=25. [Citations = 95 (GS, Jan 2023)]. Critiques: Jonas and Skorinko 2015 [n=58, Citations = 0 (GS, Jan 2023)]. Rabagliati et al. 2020 [n = 283, Citatio
663	data/raw/replication_projects/lead_harvest/figure1_research_followup_20260504/forrt_reversals/12_html_database_https_forrt_org_reversals.bin	Other-race effect (cross-race effect, own-race bias). Humans are better at distinguishing between faces of two individuals of their own race than two faces of a	Status: replicated 	1	1	0	0	False	False		40.0		24937.0	not_parseable_by_conservative_single_row_rule	Other-race effect (cross-race effect, own-race bias). Humans are better at distinguishing between faces of two individuals of their own race than two faces of another race. Statistics Status: replicated Original paper: ‘Recognition for faces of own and other race’ , Malpass and Kravitz 1969; forced-choice recognition task, n=40. [Citations=1036 (GS, Feb 2023)]. Critiques: Lee and Penrod 2022 [various recognition tasks n=24937, Citations=1 (GS, Feb 2023)]. Original effect size: η 2 p =0.291 to 0.350 (insufficient information for CI). Replication effect size: Lee and Penrod: Hedge’s g =0.54.
669	data/raw/replication_projects/lead_harvest/figure1_research_followup_20260504/forrt_reversals/12_html_database_https_forrt_org_reversals.bin	Unethical amnesia . Memories of unethical behaviour are less clear and vivid than memories of good deeds.​​	Status: not replicated. 	1	0	4	3	False	False		2109.0			not_parseable_by_conservative_single_row_rule	Unethical amnesia . Memories of unethical behaviour are less clear and vivid than memories of good deeds.​​ Statistics Status: not replicated. Original paper: ‘ Memories of unethical actions become obfuscated over time ’, Kouchaki and Gino 2016; nine studies, between-subjects (Study 1a, 1b, 3, 4, 5, 6, 7a, 7b) and correlational design (Study 2), total n = 2,109. [citations=177(GS, May 2023)]​. Critiques: Stanley et al. 2018 replication of Kouchaki and Gino 2016 study 5 [n1=228, n2=232, n3=228, citations=22(GS, May 2023)]. Original effect size: Study 1a - η p 2 = 0.06; Study 1b - in the “self” 
675	data/raw/replication_projects/lead_harvest/figure1_research_followup_20260504/forrt_reversals/12_html_database_https_forrt_org_reversals.bin	Feeling dirty after networking . People feel uncomfortable networking because networking triggers a state of “moral impurity,” which translates into feelings of	Status: not replicated 	4	1	1	2	False	False	0.98			1069.0	not_parseable_by_conservative_single_row_rule	Feeling dirty after networking . People feel uncomfortable networking because networking triggers a state of “moral impurity,” which translates into feelings of “dirtiness” and a heightened desire for “cleansing”. Statistics Status: not replicated Original paper: ‘ The contaminating effects of building instrumental ties: How networking can make us feel dirty ’, Casciaro et al. 2014; 4 studies, 1 survey and 3 laboratory experiments, experiment 1: n=306, experiment 2: n=149, survey 3: n=165, experiment 4: n=149. [citations=271(GS, June 2023)]​. Critiques: Ziani 2022 [n=1069, citations=0(GS, June
681	data/raw/replication_projects/lead_harvest/figure1_research_followup_20260504/forrt_reversals/12_html_database_https_forrt_org_reversals.bin	Public exposure influences shame and guilt differently . Public exposure (implicit and explicit) of transgression increases experienced shame more than guilt.	Status: not replicated 	4	1	0	0	False	False				1727.0	not_parseable_by_conservative_single_row_rule	Public exposure influences shame and guilt differently . Public exposure (implicit and explicit) of transgression increases experienced shame more than guilt. Statistics Status: not replicated Original paper: ‘ The role of public exposure in moral and nonmoral shame and guilt ’, Smith et al. 2002; 4 studies, between-subject design (Study 1 and 4), within-subject design (Study 2), content analysis (Study 3), Study 1: n=168, Study 2: n=56, Study 3: n=510 passages, Study 4: n=60. [citations=690(GS, June 2023)]​. Critiques: Zhang et al. 2022 [n=1727, citations=0(GS, June 2023)]. Original effect si
687	data/raw/replication_projects/lead_harvest/figure1_research_followup_20260504/forrt_reversals/12_html_database_https_forrt_org_reversals.bin	Power pose. Taking on a power pose lowers cortisol and risk tolerance, while it raises testosterone and feelings of power.	Status: not replicated 	1	4	3	7	False	False		42.0			not_parseable_by_conservative_single_row_rule	Power pose. Taking on a power pose lowers cortisol and risk tolerance, while it raises testosterone and feelings of power. Statistics Status: not replicated Original paper: ‘ Power Posing: Brief Nonverbal Displays Affect Neuroendocrine Levels and Risk Tolerance ’, Carney et al. 2010; between-subjects design, n=42 mixed sexes.[citations = 1450 (GS, April, 2022)]. Critiques: Garrison et al. 2016 [n=305, citations = 70 (GS, April 2022)]. Metzler and Grezes 2019 [n = 82 men, citations = 3 (GS, April 2022)]. Ranehill 2015 [total n=200, citations = 291 (GS, April 2022)]. Ronay 2017 [n=108, citations
693	data/raw/replication_projects/lead_harvest/figure1_research_followup_20260504/forrt_reversals/12_html_database_https_forrt_org_reversals.bin	Facial Feedback. Smiling causes a good mood, while pouting produces a bad mood.	Status: not replicated 	0	2	2	154	False	False					not_parseable_by_conservative_single_row_rule	Facial Feedback. Smiling causes a good mood, while pouting produces a bad mood. Statistics Status: not replicated Original paper: ‘ Inhibiting and Facilitating Conditions of the Human Smile: A Nonobtrusive Test of the Facial Feedback Hypothesis ’, Strack et al. 1988; 2 experimental studies, n1= 92, n2=83. [citation= 2577(GS, February, 2022)]. Critiques: Coles et al. 2019 [meta-analysis k = 98, n=3878, citation= 115 (GS, February 2022)]. Wagenmakers et al. 2016 [meta-analysis n=1894, citation=349 (GS, February 2022)]. Schimmack 2017 [replicability analysis k =19, citation=0 (GS, March 2023)]. O
699	data/raw/replication_projects/lead_harvest/figure1_research_followup_20260504/forrt_reversals/12_html_database_https_forrt_org_reversals.bin	Positive affirmation on mood . Positive self-statements boost mood for people with high self-esteem and reduce mood for people with low self-esteem.	Status: not replicated 	3	1	5	0	False	False				462.0	not_parseable_by_conservative_single_row_rule	Positive affirmation on mood . Positive self-statements boost mood for people with high self-esteem and reduce mood for people with low self-esteem. Statistics Status: not replicated Original paper: ‘ Positive Self-Statements: Power for Some, Peril for Others ’, Wood et al. 2009; 3 experiments with Study 1: n = 249, Study 2: n = 68, Study 3: n=116. [citation=294(GS, February 2022)]​. Critiques: Flynn and Bordieri 2020 [experiment: n = 462, citations=4(GS, February 2022)]. Original effect size: Study 1: not reported [ g = 0.53]; Study 2: not reported [ g = 1.00 calculated]; Study 3: not reporte
705	data/raw/replication_projects/lead_harvest/figure1_research_followup_20260504/forrt_reversals/12_html_database_https_forrt_org_reversals.bin	Mindfulness for mental health . Mindfulness, the practice of paying attention to the present moment in a non-judgemental way, is thought to have a beneficial ef	Status: mixed 	1	9	1	9	False	False	0.3	51.0			not_parseable_by_conservative_single_row_rule	Mindfulness for mental health . Mindfulness, the practice of paying attention to the present moment in a non-judgemental way, is thought to have a beneficial effect on mental health outcomes, including but not limited to helping individuals reduce stress and anxiety and manage emotional states more effectively Statistics Status: mixed Original paper: ‘ An Outpatient Program in Behavioral Medicine for Chronic Pain Patients Based on the Practice of Mindfulness Meditation ’, Kabat-Zinn, 1982; longitudinal study, n=51. [citations = 5726 (PubMed, January 2023)]. Critiques: Hoffmann & Witt 2010 [met
711	data/raw/replication_projects/lead_harvest/figure1_research_followup_20260504/forrt_reversals/12_html_database_https_forrt_org_reversals.bin	Verbal overshadowing effect . In a series of six experiments, verbalising the appearance of previously seen visual stimuli impaired subsequent recognition perfo	Status: replicated 	3	2	0	0	False	False					not_parseable_by_conservative_single_row_rule	Verbal overshadowing effect . In a series of six experiments, verbalising the appearance of previously seen visual stimuli impaired subsequent recognition performance. Statistics Status: replicated Original paper: ‘Verbal overshadowing of visual memories: Some things are better left unsaid’ , Schooler and Engstler-Schooler 1990; experiment, n = 117 (study 4), n = 88 (study 1), n = 104 (study 2).[citations=1218 (GS, November 2022)]​. Critiques: Experiment 1 and 4: Alogna 2014 [n=1105 (experiment 1), n = 663(experiment 2), citations=192 (GS, November 2022)]. Мeta-analysis. Original effect size: 
717	data/raw/replication_projects/lead_harvest/figure1_research_followup_20260504/forrt_reversals/12_html_database_https_forrt_org_reversals.bin	Age of acquisition effects - influence on free recall (pure block) . Early-acquired items are recalled more accurately than late-acquired items when early-acqui	Status: replicated 	1	3	0	0	False	False		42.0			not_parseable_by_conservative_single_row_rule	Age of acquisition effects - influence on free recall (pure block) . Early-acquired items are recalled more accurately than late-acquired items when early-acquired items are presented in a separate block and late-acquired items are presented in a separate block. Statistics Status: replicated Original paper: ‘Word imagery but not age of acquisition affects episodic memory ’, Coltheart and Winograd 1986; experiment, Experiment 1a: n = 42. [citations=44(GS, November 2022)]​. Critiques: Almond and Morrison 2014 [n =80, citations = 8(GS, November 2022)]. Dewhurst et al. 1998 [n=128, citations=117(G
723	data/raw/replication_projects/lead_harvest/figure1_research_followup_20260504/forrt_reversals/12_html_database_https_forrt_org_reversals.bin	Age of acquisition effects - influence on free recall (mixed block) . Early-acquired items are recalled more accurately than late-acquired items when early-acqu	Status: mixed 	1	1	0	0	False	False		80.0		44.0	not_parseable_by_conservative_single_row_rule	Age of acquisition effects - influence on free recall (mixed block) . Early-acquired items are recalled more accurately than late-acquired items when early-acquired items are mixed with late-acquired items in a block. Statistics Status: mixed Original paper: ‘ Separate Effects of Word Frequency and Age of Acquisition in Recognition and Recall ’, Dewhurst et al. 1998; experiment, n=80. [citations=117(GS, November 2022)]. Critiques: Macmillan et al. 2022 [n = 44, citations = 9 (GS, November 2022)]. Original effect size: η p ² = 0.15 [n p 2 calculated from reported F statistic and converted using
729	data/raw/replication_projects/lead_harvest/figure1_research_followup_20260504/forrt_reversals/12_html_database_https_forrt_org_reversals.bin	Age of acquisition effects - influence on recognition (mixed block) . Early-acquired items are recalled more accurately than late-acquired items.	Status: reversed 	1	3	0	6	False	False		102.0			not_parseable_by_conservative_single_row_rule	Age of acquisition effects - influence on recognition (mixed block) . Early-acquired items are recalled more accurately than late-acquired items. Statistics Status: reversed Original paper: ‘Word imagery but not age of acquisition affects episodic memory ’, Coltheart and Winograd 1986; experiment, Experiment 2: n = 102. [citations=44(GS, November 2022)]​. Critiques: Dewhurst et al. 1998 [Experiment 1: n=30, Experiment 2: n = 30; citations=117(GS, November 2022)]. Macmillan et al. 2022 [n = 44, citations = 9 (GS, November 2022)]. Original effect size: η p ² = .03 [η p 2 calculated from reported
735	data/raw/replication_projects/lead_harvest/figure1_research_followup_20260504/forrt_reversals/12_html_database_https_forrt_org_reversals.bin	Age of acquisition influences the pre-conceptual stages of lexical retrieval (progressive demasking) . Early-acquired items are identified more accurately than 	Status: not replicated 	2	4	0	0	False	False					not_parseable_by_conservative_single_row_rule	Age of acquisition influences the pre-conceptual stages of lexical retrieval (progressive demasking) . Early-acquired items are identified more accurately than late-acquired items, using a progressive demasking task. A progressive demasking task is a type of perceptual identification task where participants are presented with a series of words that are gradually revealed over time and their ability to identify words at each stage of the task is measured. Words learned at an earlier age are thought to be easier to demask than those learned later in life, perhaps because the individual has gaine
741	data/raw/replication_projects/lead_harvest/figure1_research_followup_20260504/forrt_reversals/12_html_database_https_forrt_org_reversals.bin	Age of acquisition influence on the pre-conceptual stages of lexical retrieval (object decision) . The age at which one acquires the concept of an object does n	Status: not replicated 	1	7	0	2	False	False		20.0			not_parseable_by_conservative_single_row_rule	Age of acquisition influence on the pre-conceptual stages of lexical retrieval (object decision) . The age at which one acquires the concept of an object does not contribute to the speed and accuracy of recognising whether an object is a real object or not a real world object that has chimeric features. Statistics Status: not replicated Original paper: ‘Age of acquisition, not word frequency, affects object naming, not object recognition ’, Morrison et al. 1992; experiment, n = 20. [citations=495(GS, December 2022)]​. Critiques: Catling and Johnston 2009 [Experiment 2: n = 20; citations = 54 (
747	data/raw/replication_projects/lead_harvest/figure1_research_followup_20260504/forrt_reversals/12_html_database_https_forrt_org_reversals.bin	Age of acquisition influence on the pre-conceptual stages of lexical retrieval (anagram solution) . Age of acquisition is thought to affect lexical retrieval th	Status: mixed 	1	2	0	0	False	False		879.0			not_parseable_by_conservative_single_row_rule	Age of acquisition influence on the pre-conceptual stages of lexical retrieval (anagram solution) . Age of acquisition is thought to affect lexical retrieval through its impact on anagram (word jumbles) solutions, such that words acquired at an earlier age tend to be solved more quickly and accurately in anagram tasks than those learned later in life. This may be because words learned earlier in life are more deeply encoded and may therefore be more easily accessed. Statistics Status: mixed Original paper: ‘Age-of-acquisition, imagery, familiarity and meaningfulness norms for 543 words’ , Stra
753	data/raw/replication_projects/lead_harvest/figure1_research_followup_20260504/forrt_reversals/12_html_database_https_forrt_org_reversals.bin	Age of acquisition influence on the pre-conceptual stages of lexical retrieval (visual duration threshold) . Early-acquired items are identified more accurately	Status: replicated 	0	1	0	0	False	False				31.0	not_parseable_by_conservative_single_row_rule	Age of acquisition influence on the pre-conceptual stages of lexical retrieval (visual duration threshold) . Early-acquired items are identified more accurately than late-acquired items, using visual duration threshold task. Statistics Status: replicated Original paper: ‘Age of acquisition affects object recognition: Evidence from visual duration thresholds’ , Dent et al. 2008; experiments, experiment 1=16, experiment 2 = 16; experiment 3 = 16. [citations= 26(GS, December 2022)]. Critiques: Chen et al. 2009 [n = 31, citations = 28(GS, December 2022)].​ Original effect size: Experiment 1: η p ²
759	data/raw/replication_projects/lead_harvest/figure1_research_followup_20260504/forrt_reversals/12_html_database_https_forrt_org_reversals.bin	Age of acquisition influence on the pre-conceptual stages of lexical retrieval (category verification) . The age at which one acquires an object does not contri	Status: reversed 	1	8	0	3	False	False		27.0			not_parseable_by_conservative_single_row_rule	Age of acquisition influence on the pre-conceptual stages of lexical retrieval (category verification) . The age at which one acquires an object does not contribute to the speed and accuracy of category verification during a semantic categorisation task (where objects have to be decided whether they represent one group or another, e.g. tools vs. furniture). Statistics Status: reversed Original paper: ‘ Age-of-acquisition effects in picture naming: Are they structural and/or semantic in nature? , Chalard and Bonin 2006; experiment, n = 27. [citations=36(GS, December 2022)]​. Critiques: Catling 
765	data/raw/replication_projects/lead_harvest/figure1_research_followup_20260504/forrt_reversals/12_html_database_https_forrt_org_reversals.bin	Age of acquisition influence on the pre-conceptual stages of lexical retrieval (category falsification) . The age at which one acquires the name of an object ob	Status: mixed 	1	4	0	2	False	False		20.0			not_parseable_by_conservative_single_row_rule	Age of acquisition influence on the pre-conceptual stages of lexical retrieval (category falsification) . The age at which one acquires the name of an object object does not contribute to the speed and accuracy of category falsification (i.e. deciding that a different word and the picture of the acquired concept do not match; e.g. the picture of the acquired concept of a rabbit, paired with the non-matching word “mouse”). Statistics Status: mixed Original paper: ‘ Age of acquisition and typicality effects in three object processing tasks ’, Holmes and Ellis 2006; experiment, n = 20. [citations
771	data/raw/replication_projects/lead_harvest/figure1_research_followup_20260504/forrt_reversals/12_html_database_https_forrt_org_reversals.bin	Age of acquisition influence on face recognition . Early-acquired faces are recognised more quickly and accurately than late-acquired faces.	Status: replicated 	1	1	0	0	False	False		9.0		180.0	not_parseable_by_conservative_single_row_rule	Age of acquisition influence on face recognition . Early-acquired faces are recognised more quickly and accurately than late-acquired faces. Statistics Status: replicated Original paper: ‘Age of acquisition in face categorisation: Is there an instance-based account?’ , Lewis 1999; correlational study, n = 9. [citations = 106(GS, December 2022)]​. Critiques: Lima et al. 2022 [n = 180, citations = 2 (GS, December 2022)]. Original effect size: r = -0.50. Replication effect size: Lima et al.: r = -0.16.
777	data/raw/replication_projects/lead_harvest/figure1_research_followup_20260504/forrt_reversals/12_html_database_https_forrt_org_reversals.bin	Age of acquisition influence on face familiarity decision . Early-acquired faces are recognised as familiar faces more quickly than late-acquired faces when the	Status: replicated 	1	1	0	0	False	False		32.0		36.0	not_parseable_by_conservative_single_row_rule	Age of acquisition influence on face familiarity decision . Early-acquired faces are recognised as familiar faces more quickly than late-acquired faces when the task is to discriminate between familiar and unfamiliar faces. Statistics Status: replicated Original paper: ‘Mechanisms of identity and gender decisions to faces: Who rocked in 1986?’ , Richards and Ellis 2008; experimental design, Experiment 1: n = 32. [citations = 13(GS, December 2022)]​. Critiques: Richards and Ellis 2009 [n = 36, citations = 9 (GS, December 2022)]. Original effect size: η p 2 = 0.36 [ η p 2 calculated from reporte
784	data/raw/replication_projects/lead_harvest/figure1_research_followup_20260504/forrt_reversals/12_html_database_https_forrt_org_reversals.bin	Age of acquisition influence on face gender decision . The age at which a celebrity face is acquired does not affect the speed to recognise a celebrity’s face, 	Status: replicated 	1	1	0	0	False	False		32.0		36.0	not_parseable_by_conservative_single_row_rule	Age of acquisition influence on face gender decision . The age at which a celebrity face is acquired does not affect the speed to recognise a celebrity’s face, using a gender decision task (is this face male or female?). Statistics Status: replicated Original paper: ‘Mechanisms of identity and gender decisions to faces: Who rocked in 1986?’ , Richards and Ellis 2008; experimental design, Experiment 2: n = 32. [citations = 13(GS, December 2022)]​. Critiques: Richards and Ellis 2009 [n = 36, citations = 9 (GS, December 2022)]. Original effect size: η p 2 = 0.12 [ η p 2 calculated from reported F
