AEARCTR-0002153,ICT-mediated agricultural knowledge transfer in Uganda: What works?,http://www.socialscienceregistry.org/trials/2153,completed,2017-06-13,"June 27, 2017",Uganda (),"[""agriculture"", ""agricultural extension"", ""gender"", ""ICT""]","knowledge related to what is in the videos, behavioural change of things that are featured in the video, such as spacing, soil nutrient management, maize yields, consumption expenditure and poverty. All of these will be measured at the individual level (male/female), women's empowerment in agriculture index.",this is going to be an experiment at the individual farmer level,3600 farmers,3627 households,3627 households,"Abstract: Agricultural advisory services generally rely on interpersonal knowledge transfers by agricultural extension agents who visit farmers to provide information. This approach is not always effective and has proved hard to scale sustainably, particularly in highly dispersed smallholder farming systems. Information and communication technologies (ICTs) have been advanced as a promising way to overcome many of the problems associated with conventional agricultural extension. We evaluate the effectiveness of an ICT‐mediated approach to deliver agricultural information in a field experiment conducted among small‐scale maize farmers in eastern Uganda. Three complementary technologies designed to address both informational and behavioral constraints to technical change are considered. First, we investigate the effectiveness of audiovisual messages (video) as a means of delivering information on input use and improved maize management practices to farmers. Second, we quantify the additional impact of complementing video with an interactive voice response (IVR) service. Third, we estimate the incremental effect of time‐sensitive short message services (SMS) messages designed to remind farmers about applying key practices at specific points during the season. We find that households that were shown a short video on how to become better maize farmers were performing significantly better on a knowledge test, more likely to apply recommended practices, and more likely to use fertilizer than households that did not view the video. These same households also reported maize yields about 10.5% higher than those that did not view the video. We find little evidence of an incremental effect of the IVR service or SMS reminders.
Citation: Van Campenhout, B., Spielman, D.J. and Lecoutere, E. (2020), Information and Communication Technologies to Provide Agricultural Advice to Smallholder Farmers: Experimental Evidence from Uganda. Amer. J. Agr. Econ.. doi:10.1002/ajae.12089
URL: https://onlinelibrary.wiley.com/doi/full/10.1002/ajae.12089
Abstract: To gain a better understanding of intrahousehold bargaining processes, surveys increasingly collect data from co-heads individually, especially on decision-making, asset ownership and labour contributions. However, answers provided by co-heads to the same set of questions often differ substantially. Recent research suggests that while some of this disagreement is due to random measurement error and cognitive bias, part also reflects non-overlapping information sets. We document differences in answers between male and female co-heads in monogamous smallholder maize-farming households in Uganda. We first confirm that not all disagreement can be explained by measurement error or bias. Using a field experiment, we then test if disagreement is due to information asymmetry between male and female co-heads. We also test an alternative explanation where discord is attributed to co-heads’ tendency to respond in line with prevailing gender norms and social customs. While the interventions did seem to reduce discord in survey response about decision-making, we do not find that information asymmetry nor reporting in line with gender norms and customs are the primary drivers of disagreement.
Citation: Bjorn Van Campenhout, Els Lecoutere & David J. Spielman (2022) Hiding or Pleasing: Spousal Disagreement Among Ugandan Maize Farmers, The Journal of Development Studies, DOI: 10.1080/00220388.2022.2113065
URL: https://www.tandfonline.com/doi/full/10.1080/00220388.2022.2113065
Abstract: Agricultural advisory services are generally biased towards men, with information targeted mainly to male members within the household, and in formats that often reinforce male dominance in agricultural decision-making. Such biases affect women’s ability to make informed decisions and limit their intra-household bargaining power. Because women’s empowerment in agriculture has many well-established benefits, designing inclusive agricultural extension and advisory services is important. In this study, we challenge the assumption that information is fully shared between co-heads of a household. We also test if portraying women as equally able farmers challenges gender norms and stereotypes in agriculture. We do this through a field experiment in eastern Uganda in which videos that provide information on recommended maize-farming practices are shown to monogamous maize-farming households. In the experiment, we manipulate who within the household is exposed to the information contained in the video. Furthermore, we vary the gender of the person delivering the information in the video. We find that targeting the female co-head alone with information increases her knowledge about recommended practices, her role in agricultural decision-making, her subsequent adoption of recommended practices and inputs, and yields on fields she manages, while the male co-head’s knowledge about the practices and his unilateral decision-making is reduced. When both co-heads are targeted, joint adoption of recommended practices and inputs increases, while the male co-head’s unilateral decision-making is reduced. We find some support that featuring female role models in the videos challenges men’s beliefs and stereotypes about women’s roles in agriculture, and encourages adoption of recommended practices by women. We conclude that if the aim is to empower women, most gains can be made by re-designing advisory services to target information exclusively to the female co-head within the household. Challenging gender stereotypes may create room for increasing women’s involvement in agriculture.
Citation: Lecoutere, E., Spielman, D.J. and Van Campenhout, B., 2023. Empowering women through targeting information or role models: Evidence from an experiment in agricultural extension in Uganda. World Development, 167, p.106240.
URL: https://www.sciencedirect.com/science/article/pii/S0305750X2300058X
",https://github.com/bjvca/maizeUG/blob/master/endline/data/endline.csv,https://github.com/bjvca/maizeUG/tree/master/endline/analysis,aea_pap_paper_package_governance_candidate,stage_native_metric_first,"Registry supplies PAP/paper/package links and N fields, but final effect estimates must be extracted from the linked paper or replication package."
AEARCTR-0002218,Messaging and Low-income Solar Adoption,http://www.socialscienceregistry.org/trials/2218,completed,2017-05-15,Private,United States of America (Connecticut),"[""environment_and_energy"", ""pro-social"", ""price"", ""information""]","The key outcome variables are solar adoptions, and moderating factors that influence adoptions.",30 municipalities,30 municipalities,29 municipalities,,"Abstract: This study examines how messaging approaches in a prosocial intervention can influence not only the effectiveness of the intervention but also, contagion afterward. Our investigation focuses on leveraging two motivations for solar adoption: self-interest and prosocial. Using data from a natural field experiment in 29 municipalities containing 684,000 people, we find that self-interest messaging is twice as effective in inducing solar adoption both during and after the intervention. Adoptions under self-interest messaging have 10% higher net present value, but prosocial messaging increases the likelihood that adopters recommend solar to their friends and neighbors. Income moderates the effectiveness of self-interest messaging, performing much better in high-income communities than low- and moderate-income communities. There was no significant difference across income groups for prosocial messaging. These results provide guidance to policy makers aiming to encourage prosocial behavior across all income groups.
Citation: B. Bollinger, K.T. Gillingham, M. Ovaere, Field experimental evidence shows that self-interest attracts more sunlight, Proc. Natl. Acad. Sci. U.S.A. 117 (34) 20503-20510
URL: https://doi.org/10.1073/pnas.2004428117
",https://github.com/MartenOvaere/Self_Interest_Attracts_More_Sunlight,https://github.com/MartenOvaere/Self_Interest_Attracts_More_Sunlight,aea_pap_paper_package_governance_candidate,stage_native_metric_first,"Registry supplies PAP/paper/package links and N fields, but final effect estimates must be extracted from the linked paper or replication package."
AEARCTR-0002324,Learning accountability: Can formal education help hold politicians to account?,http://www.socialscienceregistry.org/trials/2324,completed,2017-07-13,"July 13, 2017; August 04, 2017",Senegal (),"[""education"", ""electoral"", ""governance""]","Voter beliefs about incumbent and challenger performance in office, political knowledge, comprehension of politician performance information, vote choice, costly indications of candidate support.",450 villages.,Around 4050 respondents (seek 9 per village).,443 villages,"3,999 voters","Abstract: Political accountability may be constrained by the reach and relevance of information campaigns in developing democracies and—upon receiving information—voters' ability and will to hold politicians accountable. To illuminate voter-level constraints and information relevance absent dissemination constraints, we conducted a field experiment around Senegal's 2017 parliamentary elections to examine the core theoretical steps linking receiving different types of incumbent performance information to electoral and nonelectoral accountability. Voters immediately processed information as Bayesians, found temporally benchmarked local performance outcomes particularly informative, and updated their beliefs for at least a month. Learning that incumbents generally performed better than expected, voters durably requested greater politician contact after elections while incumbent vote choice increased among likely voters and voters prioritizing local projects when appraising incumbents. In contrast, information about incumbent duties did not systematically influence beliefs or accountability. These findings suggest voters were able and mostly willing to use relevant information to hold politicians to account.
Citation: Bhandari, Abhit, Horacio Larreguy, and John Marshall. ""Able and Mostly Willing: An Empirical Anatomy of Information's Effect on Voter-Driven Accountability in Senegal."" Forthcoming, American Journal of Political Science. https://doi.org/10.1111/ajps.12591
URL: https://onlinelibrary.wiley.com/doi/abs/10.1111/ajps.12591
",https://dataverse.harvard.edu/dataset.xhtml?persistentId=doi:10.7910/DVN/QAJQXP,https://dataverse.harvard.edu/dataset.xhtml?persistentId=doi:10.7910/DVN/QAJQXP,aea_pap_paper_package_governance_candidate,stage_native_metric_first,"Registry supplies PAP/paper/package links and N fields, but final effect estimates must be extracted from the linked paper or replication package."
AEARCTR-0002358,What Motivates Political Activists? Evidence From a Field Experiment,http://www.socialscienceregistry.org/trials/2358,completed,2017-07-28,"July 28, 2017",,"[""electoral""]",self-reported and behavioral canvassing effort.,,roughly 8000,2828 activists,2828 activists,"Abstract: How does a citizen’s decision to participate in political activism depend on the participation of others? We conduct a nationwide natural field experiment in collaboration with a major European party during a recent national election. In a party survey, we randomly provide canvassers with true information about the canvassing intentions of their peers. When learning that more peers participate in canvassing than previously believed, canvassers significantly reduce both their canvassing intentions and behaviour. An additional survey among party supporters underscores the importance of free-riding motives and reveals that there is strong heterogeneity in motives underlying supporters’ behavioural responses.
Democracies
Citation: Hager, A., Hensel, L., Hermle, J., & Roth, C. (2023). Political Activists as Free-Riders: Evidence from a Natural Field Experiment. The Economic Journal, 133(653), 2068–2084.
URL: https://doi.org/10.2139/ssrn.3671244
Abstract: Does party competition affect political activism? This paper studies the decision of party supporters to join political campaigns. We present a framework that incorporates supporters’ instrumental and expressive motives and illustrates that party competition can either increase or decrease party activism. To distinguish between these competing pre- dictions, we implemented a field experiment with a European party during a national election. In a seemingly unrelated party survey, we randomly assigned 1,417 party supporters to true information that the canvassing activity of the main competitor party was exceptionally high. Using unobtrusive, real-time data on party supporters’ canvassing behavior, we find that respondents exposed to the high-competition treatment are 30% less likely to go canvassing. To investigate the causal mechanism, we leverage additional survey evidence collected two months after the campaign. Consistent with affective accounts ofpolitical activism, we show that increased competition lowered party supporters’ political self-efficacy, which plausibly led them to remain inactive.
Citation: Hager, A., Hermle, J., Hensel, L., & Roth, C. (2021). Does Party Competition Affect Political Activism? Journal of Politics, 83(4), 1681–1694.
URL: https://doi.org/10.1086/712140
","https://doi.org/10.5281/zenodo.7663389
https://doi.org/10.7910/DVN/2KLNFX","https://doi.org/10.5281/zenodo.7663389
https://doi.org/10.7910/DVN/2KLNFX",aea_pap_paper_package_governance_candidate,stage_native_metric_first,"Registry supplies PAP/paper/package links and N fields, but final effect estimates must be extracted from the linked paper or replication package."
AEARCTR-0002435,"Nudges in ""Equilibrium""",http://www.socialscienceregistry.org/trials/2435,completed,2017-12-21,Private,United States of America (),"[""health"", ""nudge"", ""reminder"", ""incentive""]","Whether or not participants engaged in each of the two behaviors, at the individual-day level",,3780,3818,3818,"Abstract: Impact evaluations of behavioral interventions typically focus on target outcomes. Might interventions induce negative spillovers on other behaviors? I run a large field experiment in which individuals receive combinations of messages and incentives promoting two healthy behaviors, meditation and meal logging. I find that the interventions reduce completion rates of the opposite behavior by 19-29%. I find that interventions with larger target effects do not necessarily generate larger negative spillovers, and demonstrate implications for cost-effectiveness analysis. I investigate the mechanisms behind the observed spillovers.
Citation: “Does Promoting One Healthy Behavior Detract from Others? Evidence from a Field Experiment” Forthcoming, American Economic Journal: Applied Economics.
URL: https://www.aeaweb.org/articles?id=10.1257/app.20210788&&from=f
",http://doi.org/10.3886/E181963V1,http://doi.org/10.3886/E181963V1,aea_pap_paper_package_governance_candidate,stage_native_metric_first,"Registry supplies PAP/paper/package links and N fields, but final effect estimates must be extracted from the linked paper or replication package."
AEARCTR-0002493,On the mechanics of the political resource curse: information and local elite behaviour in Mozambique,http://www.socialscienceregistry.org/trials/2493,completed,2017-10-05,Private,Mozambique (Cabo Delgado),"[""governance"", ""Natural Resources"", ""Curse"", ""Natural Gas"", ""Information"", ""Deliberation"", ""Rent Seeking"", ""Mozambique.""]","Aspirations, Demand for political accountability, Information, Social capital, Trust, Attitudes towards Public Goods, Attitudes towards Rent-Seeking, Attitudes towards Corruption, Engagement with Local Leaders.",200 polling stations,2000 individuals + 200 village leaders,206 communities,"2,065 heads of household
206 local leaders","Abstract: Natural resources can have a negative impact on the economy through corruption and civil conflict. This paper tests whether information can counteract this political resource curse. We implement a large-scale field experiment following the dissemination of information about a substantial natural gas discovery in Mozambique. We measure outcomes related to the behavior of citizens and local leaders through georeferenced conflict data, behavioral activities, lab-in-the-field experiments, and surveys. We find that information targeting citizens and their involvement in public deliberations increases local mobilization and decreases violence. By contrast, when information reaches only local leaders, it increases elite capture and rent-seeking.
Citation: Armand, Alex, Alexander Coutts, Pedro C. Vicente, and Inês Vilela. 2020. ""Does Information Break the Political Resource Curse? Experimental Evidence from Mozambique."" American Economic Review, 110 (11): 3431-53.
URL: https://doi.org/10.1257/aer.20190842
",https://doi.org/10.1257/aer.20190842,https://doi.org/10.1257/aer.20190842,aea_pap_paper_package_governance_candidate,stage_native_metric_first,"Registry supplies PAP/paper/package links and N fields, but final effect estimates must be extracted from the linked paper or replication package."
AEARCTR-0002755,Access to safe drinking water Experimental evidence from new water sources in Bangladesh,http://www.socialscienceregistry.org/trials/2755,completed,2018-03-08,"March 08, 2018","Bangladesh (Bogra, Gaibandha )","[""health"", ""Water safety"", ""Local Public Goods"", ""Community-Driven Development""]","Our first research question is: ""What is the average effect of the program on household water quality?"", with corresponding main outcomes of interest:
(1a) arsenic contamination in drinking water;
(1b) fecal contamination in drinking water.

Our second research question is: ""How does the program change behavior with respect to obtaining and storing water for drinking and cooking?"", with corresponding main outcomes of interest:
(2a) arsenic contamination of water source(s) used by households;
(2b) fecal contamination of water source(s) used by households;
(2c) distance walked to collect water;
(2d) household water storage practices.

Our third research question is: ""What is the causal effect of the behavioral channels on household water quality?"", with corresponding main outcomes of interest as for the first research question.","We carried out the CDD program in 171 communities, 129 selected to receive the intervention and 42 assigned to the control group.","Outcomes using household survey data: 7,145 households (target).
Treatment Unit outcomes: 171.",171,"Baseline sample size is 6,529 households.  Full endline sample is 7,948 households.","Abstract: Health, and in turn income and welfare, depend on access to safe drinking water. Although the majority of rural households worldwide obtain drinking water from community water sources, there is limited evidence about how effectively these sources provide safe drinking water. This study combines a randomized experiment with water quality testing to evaluate the impact of a program that provides community deep tubewells in rural Bangladesh. The program reduces exposure to arsenic, a major natural pollutant, but not fecal contamination. Households may use fewer sources with fecal contamination, but any such effects are offset by recontamination through transport and possibly storage. The results suggest that while community deep-tubewell construction programs may reduce exposure to arsenic in Bangladesh, reducing exposure to fecal contamination may require interventions that go beyond community sources.
Citation: Cocciolo, S., Ghisolfi, S., Habib, M. A., Rashid, S. M. A., & Tompsett, A. (2021). Do Community Water Sources Provide Safe Drinking Water? Evidence from a Randomized Experiment in Rural Bangladesh. The World Bank Economic Review, 35(4), 969-998.
URL: https://doi.org/10.1093/wber/lhab006
",https://doi.org/10.7910/DVN/JM63QP,https://doi.org/10.7910/DVN/JM63QP,aea_pap_paper_package_governance_candidate,stage_native_metric_first,"Registry supplies PAP/paper/package links and N fields, but final effect estimates must be extracted from the linked paper or replication package."
AEARCTR-0002793,Accelerating Science-based Growth Through Co-innovation,http://www.socialscienceregistry.org/trials/2793,completed,2018-03-20,Private,Denmark (Syddanmark),"[""education"", ""governance"", ""Innovation Policy"", ""Economic Growth""]",Intention to engage in university-industry collaboration projects,"Invitation to registration and survey will be sent to 150 individuals (employees in start-up, SMEs or large companies in the region).",80 individuals,36,36,"Abstract: The engagement with industry actors is a key element in the transition towards an entrepreneurial university model. The purpose of this paper is to explore the university-industry collaboration (UIC) drivers from the industry side. It analyses how, and to what extent, policy interventions could increase the engagement of industry actors in UICs.
An experimental research design involving a feasibility and pilot study (January to June 2018) with 36 firms. In a non-urban region context, with a satellite university campus. The pilot explores a randomized control trial (RCT) design, with a training intervention to a randomized group of participants in the pilot.
Firms involved in universities’ students (academic forms of UICs) might not necessarily consider the university as a research partner, even in a geographic proximity setting. In addition, there is a potential “dark-side” to proximity, when industry participants build their perceptions using second-hand experiences or indirect information. A training intervention facilitates to overcome pre-existing biases but does not trigger a substantial change in the UIC’s behaviour of the firms in the short-term.
The pilot study provides valuable insights for researchers interested in a larger randomized control trial. It also provides insights for university managers that want to understand the motivations of industry participants in UICs.
The experimental approach of the research generates evidence on the feasibility to intervene in the activation of UICs from an industry perspective, a central aspect in transition towards an entrepreneurial university model.
Citation: Giones, F. (2019), “University-Industry Collaborations: An Industry Perspective”, Management Decision, available at:https://doi.org/10.1108/MD-11-2018-1182.
URL: https://doi.org/10.1108/MD-11-2018-1182
",https://www.researchgate.net/profile/Ferran_Giones/publication/332259155_Data_from_the_Pilot_Study_-_baseline_and_follow-up_-_Project_IGL_Co-Innovation_2018/data/5caa3f9992851c64bd57aa78/IGL-Co-innovation-Anon-Data.xlsx,,aea_pap_paper_package_governance_candidate,stage_native_metric_first,"Registry supplies PAP/paper/package links and N fields, but final effect estimates must be extracted from the linked paper or replication package."
AEARCTR-0002942,High-Frequency Program Monitoring and Bureaucratic Performance: Experimental Evidence from India,http://www.socialscienceregistry.org/trials/2942,completed,2018-04-27,"June 01, 2018",India (Telangana),"[""agriculture"", ""governance""]",Percent of beneficiaries who receive their checks within the target distribution period without any irregularities (e.g. having to pay a bribe); Percent of beneficiaries who report being satisfied with program implementation; Value of program to beneficiaries,564 mandals,"564 mandals, which contain approximately 28 million individuals that fall within either treatment or control. We will collect data from approximately 50,000 farmers from within these mandals.",498 mandal agricultural officers (MAOs); 122 in treatment,"22,167 farmers contacted over phone; 5,645,937 farmers with administrative data (bank records)","Abstract: Improving “last-mile” public service delivery is a recurring challenge in developing countries. Could the widespread adoption of mobile phones provide a scalable, cost-effective means for improvement? We use a large-scale experiment to evaluate the impact of phone based monitoring on a program that transferred nearly a billion dollars to 5.7 million Indian farmers. In randomly selected jurisdictions, officials were informed that program implementation would be measured via calls with beneficiaries. This led to a 7.8 percent
reduction in the number of farmers who did not receive their transfers. The program was highly cost-effective, costing 3.6 cents for each additional dollar delivered.
Citation: Muralidharan, Karthik, Paul Niehaus, Sandip Sukhtankar, and Jeffrey Weaver. ""Improving last-mile service delivery using phone-based monitoring."" American Economic Journal: Applied Economics 13, no. 2 (2021): 52-82.
URL: https://doi.org/10.1257/app.20190783
",https://www.openicpsr.org/openicpsr/project/117431/version/V1/view,https://www.openicpsr.org/openicpsr/project/117431/version/V1/view,aea_pap_paper_package_governance_candidate,stage_native_metric_first,"Registry supplies PAP/paper/package links and N fields, but final effect estimates must be extracted from the linked paper or replication package."
