priority,todo_id,source_family,task,url,local_file,why_user_needed
1,manual_extract_aea_governance_queue,AEA RCT Registry,Work through the compact AEA governance candidate queue and extract one PAP-matched focal estimate/SE/N from each linked paper or replication package.,https://dataverse.harvard.edu/dataset.xhtml?persistentId=doi:10.7910/DVN/OHBI3I,data/derived/effect_inflation_dataset/plot3_aea_registry_governance_candidates.csv,"46 link-ready governance/political candidates were found; effect rows are in linked papers/packages, not in the registry CSV."
2,manual_extract_exact_zenodo_models,Zenodo packages,Use the downloaded Zenodo packages to replace native/raw reconstructions with exact published covariate-adjusted model rows where needed.,https://doi.org/10.5281/zenodo.10086096 ; https://zenodo.org/records/3942437 ; https://zenodo.org/records/17792605,data/raw/corpus_candidates/political_science_unlock/zenodo/,"Zenodo metadata and the small Mousa/Good Politicians packages are now locally downloaded; remaining work is selector/model extraction, not URL access."
3,manual_extract_metaketa_iii_iv,EGAP Metaketa III/IV,Extract component/native rows only if a separate native panel is desired; pooled Metaketa III/IV rows are already in strict Plot 3.,https://osf.io/knje7/ ; https://osf.io/2juyz/ ; https://osf.io/jdgf4,data/derived/effect_inflation_dataset/plot3_political_science_package_manifest.csv,The headline pooled dots are already included; this TODO is only for optional component-study/native panels and double-count-safe child rows.
4,manual_download_tess_roper_data,TESS,"For TESS rows, fetch Roper/OSF data where the OSF API shows empty roots and reconstruct event counts or outcome SDs for D conversion.",https://tessexperiments.org/study/graham1155 ; https://tessexperiments.org/study/johnson1389 ; https://tessexperiments.org/study/jackson002,data/derived/effect_inflation_dataset/plot3_political_science_native_metric_seed_rows.csv,"The TESS pages expose N and some native results, but not arm event counts/outcome SDs required for defensible D conversion."
5,manual_confirm_metaketa_ii_pooled,EGAP Metaketa II,Confirm final pooled-paper/package status and extract native tax compliance/formalization ATE/SE/N rows.,https://egap.org/our-work/the-metaketa-initiative/roundtwo-taxation/,data/derived/effect_inflation_dataset/plot3_political_science_unlock_status.csv,"The PAP architecture is clear, but the final pooled package was not machine-verified to the same standard as Metaketa I/III/IV."
6,manual_openicpsr_terms,OpenICPSR / Metaketa II,Open OpenICPSR pages that may require click-through terms and extract the matched registry/PAP plus primary tax-compliance coefficient/SE/N.,https://www.openicpsr.org/openicpsr/project/147561/version/V1/view,,"The landing page is visible, but package download/selector matching is still a manual rescue step."
10,blocked_probe_metaketa_ii_local_elites_state_capacity,OpenICPSR/Metaketa II,"Download OpenICPSR package, identify the matched registry/PAP, and extract primary coefficient/SE/N.",https://www.openicpsr.org/openicpsr/project/147561/version/V1/view,data/derived/effect_inflation_dataset/plot3_political_science_unlock_status.csv,http_403_text/html; charset=UTF-8
