AEARCTR-0003111,Information and Public Service Provision: Experimental Evidence from School WASH Services in Bangladesh,http://www.socialscienceregistry.org/trials/3111,completed,2018-07-11,"September 25, 2019","Bangladesh (Bhola, Lakshmipur)","[""education"", ""governance"", ""Community monitoring"", ""Public service provision"", ""Participation"", ""Information""]","a) Indicators of WASH provision, developed from national guidelines and international recommendations (e.g. UNICEF, 2012) such as the presence of water and soap for hand washing.

b) School attendance (overall and disaggregated by gender).

c) Exam results (overall and disaggregated by gender).

d) Latrine use (overall and disaggregated by gender in case of latrine facilities separated by gender).",60 schools,"60 schools.

We obtain attendance data for a maximum of 5 classes per school, and latrine use data for a maximum of 4 latrines per school. We obtain WASH provision indicators for all water and sanitation facilities in the school, whose numbers are unknown to us in advance. Whenever possible, we will exploit this increased sample size in the analysis, although we will conduct inference accounting for assignment to treatment at the school level.",60 schools,See paper for details as units of observation vary.,"Abstract: Can transparency interventions improve WASH service provision? We use a randomized experiment to evaluate the impacts of a transparency intervention, a deliberative multi-stakeholder workshop initiated with a community scorecard exercise, in schools in rural Bangladesh. To measure impacts, we combine survey data, direct observations, and administrative data. The intervention leads to moderate but consistent improvements in knowledge of WASH standards and practices, and institutions for WASH service management, but does not improve school WASH service provision or change WASH facility use patterns. Drawing on rich descriptive data, we suggest several reasons why the intervention we evaluate did not improve WASH service outcomes and propose ways to improve the design of future interventions.
Citation: Allakulov, U., Cocciolo, S., Das, B., Habib, M. A., Rambjer, L., & Tompsett, A. (2023). Transparency, governance, and water and sanitation: Experimental evidence from schools in rural Bangladesh. Journal of Development Economics, 163, 103082.
URL: https://doi.org/10.1016/j.jdeveco.2023.103082
",https://doi.org/10.7910/DVN/U9I4Z2,https://doi.org/10.7910/DVN/U9I4Z2,aea_pap_paper_package_governance_candidate,stage_native_metric_first,"Registry supplies PAP/paper/package links and N fields, but final effect estimates must be extracted from the linked paper or replication package."
AEARCTR-0003357,Engendering Policing: Evaluating Reforms to Increase Women’s Access to Security and Justice,http://www.socialscienceregistry.org/trials/3357,completed,2018-10-11,"March 05, 2020; June 29, 2020",India (Madhya Pradesh),"[""crime_violence_and_conflict"", ""gender""]","(1) citizen perceptions, including satisfaction with and trust in the police; (2) women contacting the police; (3) crimes registered – where increased reporting is indicative of more effective policing; (4) action taken on these crimes; (5) police officer perceptions and reported actions.",180,Approximately 2000 police officers; approximately 5400 women.,"180 police stations: 120 treated, 60 control",At Endline: 180 police stations; 3251 users; 1961 police officers; 3376 citizens,"Abstract: Gender-targeted police reforms are frequently proposed to tackle the global problem of rising yet underreported
gender-based violence (GBV)—but with mixed and often disappointing results. We explore this
issue in India, a country with alarming rates of GBV and limited police capacity, by studying the impact of
Women’s Help Desks (WHDs): dedicated spaces for women in local police stations, staffed by trained
officers. Drawing on the largest randomized controlled trial of a police reform to date (180 police
stations serving 23.4 million people), we find that officers in stations with WHDs are more likely to
register cases of GBV, particularly where female officers run the desks. This suggests that even in
resource-constrained and patriarchal environments, police responsiveness can be improved by focusing
and mainstreaming attention to women’s cases and by greater gender representation within the police.
Citation: Sukhtankar, Sandip, Gabrielle Kruks-Wisner, and Akshay Mangla. ""Policing in patriarchy: An experimental evaluation of reforms to improve police responsiveness to women in India."" Science 377, no. 6602 (2022): 191-198.
URL: https://doi.org/10.1126/science.abm7387
",https://dataverse.harvard.edu/dataset.xhtml?persistentId=doi:10.7910/DVN/R75XVZ,https://dataverse.harvard.edu/dataset.xhtml?persistentId=doi:10.7910/DVN/R75XVZ,aea_pap_paper_package_governance_candidate,stage_native_metric_first,"Registry supplies PAP/paper/package links and N fields, but final effect estimates must be extracted from the linked paper or replication package."
AEARCTR-0003509,"Voting or abstaining in ""managed"" elections? An RCT in Bangladesh",http://www.socialscienceregistry.org/trials/3509,completed,2018-12-14,Private,Bangladesh (),"[""electoral"", ""Authoritarian/managed elections"", ""voting behavior"", ""field experiment"", ""Bangladesh""]","Individual voting participation coded based on the observation of an ink mark on the finger.
Official polling station-level data on turnout and the incumbent vote share.
Survey information about the voting participation of other voters within the respondents' family.
",300 villages,"around 11,000 households/individuals","302 villages, of which 154 are government villages and 148 opposition villages","11,843 individuals","Abstract: To study the effects of non-partisan information and get-out-the-vote (GOTV) campaigns on the partisan composition of the voting population in competitive authoritarian elections, we conducted a large-scale field experiment prior to the 2018 Bangladeshi general election. Our two treatments highlight that high turnout increases the winning party’s legitimacy and that election outcomes matter for policy outcomes. Both treatments increase turnout (measured by ink marks) in government strongholds but decrease turnout in opposition strongholds. We explain the withdrawal of treated opposition supporters and conclude that non-partisan information and GOTV campaigns can further tilt the uneven playing field in competitive authoritarian elections
Citation: Ahmed F., Hodler R., Islam A., 2024. Partisan effects of information campaigns in competitive authoritarian elections: Evidence from Bangladesh. Economic Journal, forthcoming
URL: https://doi.org/10.1093/ej/uead115
",https://doi.org/10.5281/zenodo.10059860,https://doi.org/10.5281/zenodo.10059860,aea_pap_paper_package_governance_candidate,stage_native_metric_first,"Registry supplies PAP/paper/package links and N fields, but final effect estimates must be extracted from the linked paper or replication package."
AEARCTR-0003553,Nimble evaluations of an online entrepreneurship and STEM training program in schools,http://www.socialscienceregistry.org/trials/3553,completed,2018-11-20,Private,Ecuador (),"[""education"", ""firms_and_productivity"", ""Entrepreneurship"", ""STEM"", ""training""]","Active take-up: Hours per student actively spent on the platform
Career attitudes: interest in entrepreneurial and scientific careers
Learning: Students’ performance on subject-specific tests
Steps towards career: Action based outcomes.
","We plan to work with 110 schools. These will be randomized into 70 treatment schools and 40 control schools. Across these 110 schools we will carry out a 2x2 randomization into whether training is in person or not, and whether benchmarking is provided or not.
Within the 70 treatment schools, there will be approximately 350 classes. We will randomize the ordering of topics in these classes.
The adaptive interventions are not clustered, but randomized at the individual level.","We anticipate 110 schools, and will work with levels 10 and 11 in these schools, for 220 grades. There are approximately 5 classes per school, so approximately 550 classes in total, and approximately 180 students per school, for aproximately 20,000 students in total.","We worked in total with 108 schools, containing 560 classes, and 15443 students.
[Note sample sizes and registry entry refer to benchmarking treatment, which is published]","12,232 students reached the endline survey in July 2020","Abstract: Many school systems across the globe turned to online education during the COVID-19 pandemic. This context differs significantly from the prepandemic situation in which massive open online courses attracted large numbers of voluntary learners who struggled with completion. Students who are provided online courses by their high schools also have their behavior determined by actions of their teachers and school system. We conducted experiments to improve participation in online learning before, during, and right after the COVID-19 outbreak, with 1,151 schools covering more than 45,000 students in their final years of high school in Ecuador. These experiments tested light-touch interventions at scale, motivated by behavioral science, and were carried out at three levels: that of the system, teacher, and student. We find the largest impacts come from intervening at the system level. A cheap, online learning management system for centralized monitoring increased participation by 0.21 SD and subject knowledge by 0.13 SD relative to decentralized management. Centralized management is particularly effective for underperforming schools. Teacher-level nudges in the form of benchmarking emails, encouragement messages, and administrative reminders did not improve student participation. There was no significant impact of encouragement messages to students, or in having them plan and team-up with peers. Small financial incentives in the form of lottery prizes for finishing lessons did increase study time, but was less cost-effective, and had no significant impact on knowledge. The results show the difficulty in incentivizing online learning at scale, and a key role for central monitoring.
Citation: Igor Asanov, Anastasiya-Mariya Asanov, Thomas Astebro, Guido Buenstorf, Bruno Crepon, Francisco Pablo Flores T, David McKenzie, Mona Mensmann and Mathis Schulte (2023) ""System-, teacher-, and student-level interventions for improving participation in online learning at scale in high schools"", PNAS 120(3): e2216686120, July 17
URL: https://www.pnas.org/doi/10.1073/pnas.2216686120
",https://osf.io/kmgvu/,https://osf.io/kmgvu/,aea_pap_paper_package_governance_candidate,stage_native_metric_first,"Registry supplies PAP/paper/package links and N fields, but final effect estimates must be extracted from the linked paper or replication package."
AEARCTR-0003994,A Pair-Matched Randomized Evaluation of Faith-Based Couples Counseling in Uganda,http://www.socialscienceregistry.org/trials/3994,completed,2019-03-11,"March 11, 2019; June 08, 2019; November 15, 2019",Uganda (Western Region),"[""crime_violence_and_conflict"", ""gender"", ""intimate partner violence"", ""violence against women"", ""counseling"", ""couples counseling""]","Our main analyses focus on four outcomes that combine many theoretically-related measures:

1. Intimate Partner Violence. A binary indicator that is 1 if the female partner has experienced any of ten types of physical or sexual violence over the five months preceding the midline survey, and 0 otherwise. We expect that the ITT effect is negative and so will conduct a one-sided (lower-tailed) test.

2. Control and Decision-Making. An index of several groups of items, each of which is coded to vary between 0 and 1. The groups include decision-making about household finances and purchasing decisions, financial control, and social control. When at 0, this implies the female partner experiences all forms of financial and social control, and both partners perceive her to be excluded from all decision-making. When it is at 1, this implies the female partner does not report experiencing any forms of financial or social control, and is involved in all aspects of decision-making. We expect that the ITT effect is positive, and will conduct an upper-tailed test of the null hypothesis.

3. Sexual Consent and Autonomy. An index of items, mostly answered by the female partner but one answered by the male partner, about whether the male partner takes a non-coercive strategy when his partner refuses sex, and how the female partner feels about her control over decisions about and initiation of sex. The responses are coded to vary between 0 and 1. When the index is at 0, this implies that the female partner reports sexual coercion across all of the domains, and that the male partner reports coercive behavior. When it is at 1, this implies the absence of coercion.

4. Communication and Conflict Management Techniques. An index of items addressing a broad range of domains of communication, answered by both female and male partners. The domains include communication about sex, about daily events and companionship, and techniques for de-escalation when arguing about difficult topics. When the index is at 0, this implies that the partners agree that they have had no supportive or open communication or techniques for peaceful or de-escalating communication across many domains. When it is at 1, this implies the partners agree that they communicate with supportive or open communication or techniques for peaceful or de-escalating communication across all the domains.
",1680 couples in 140 congregations,"3,360 individuals",1680 couples,3360 individuals,"Abstract: Violence committed by men against women in intimate relationships is a pervasive problem around the world. Patriarchal norms that place men as the head of household are often to blame. Previous research suggests that trusted authorities can shift perceptions of norms and create behavior change. In many settings, a compelling authority on behavior in relationships is religious leaders, who are influential sources of information about proper conduct in relationships and gatekeepers of marriage, but may also uphold traditional gender roles. One way leaders exert their influence is through premarital or couples counseling courses. In this study, we test whether, if given an opportunity to offer a more progressive religious interpretation of gender roles during these courses, religious leaders could motivate men to share power and thereby reduce violence. Building on existing faith networks of Christian religious leaders in western Uganda, we conducted a large pair-matched, randomized controlled trial among 1,680 heterosexual couples in which participants were randomized to attend a 12-session group counseling course or wait-listed. We find that the program shifted power from men to women and reduced intimate partner violence by five percentage points, comparable with more intensive secular programs. These improvements were largest among couples counseled by religious leaders who held the most progressive views at baseline and who critically engaged with the material. Our findings suggest that religious leaders can be effective agents of change for reducing violence.
Citation: Boyer, C., Levy Paluck, E., Annan, J., Nevatia, T., Cooper, J., Namubiru, J., Heise, L., & Lehrer, R. (2022). Religious leaders can motivate men to cede power and reduce intimate partner violence: Experimental evidence from Uganda. Proceedings of the National Academy of Sciences, 119(31), e2200262119. https://doi.org/10.1073/pnas.2200262119

URL: https://doi.org/10.1073/pnas.2200262119
",https://doi.org/10.7910/DVN/9TEAIV,https://doi.org/10.7910/DVN/9TEAIV,aea_pap_paper_package_governance_candidate,stage_native_metric_first,"Registry supplies PAP/paper/package links and N fields, but final effect estimates must be extracted from the linked paper or replication package."
AEARCTR-0004714,Spillovers of Payments for Ecosystem Services: Follow-up of a RCT in Uganda,http://www.socialscienceregistry.org/trials/4714,completed,2019-10-02,Private,Uganda (Western Region),"[""environment_and_energy"", ""Payments for Ecosystem Services"", ""PES"", ""Uganda"", ""forest conservation"", ""deforestation"", ""spillovers"", ""crowding-out""]","1) social preferences
2) environmental preferences
3) forest sharing behavior
4) social norms related to forest sharing behavior
5) human-wildlife conflicts
6) attitude towards chimpanzee conservation
7) hypothetical enrollment in a PES program

The primary outcomes are planned to be analyzed in separate publications. Paper 1: Outcomes 1, 3, 4; Paper 2: Outcome 2; Paper 3: Outcome 5,6;  Paper 4: Outcome 7","original RCT: 136 villages, follow-up: 121 villages","1210 land owners in total: 726 forest owners (at the start of the intervention), 484 neighbors of forest owners",119,753 households,"Abstract: Payments for ecosystem services (PES) are increasingly being implemented worldwide as conservation instruments that provide conditional economic incentives to landowners for a prespecified duration. However, in the psychological and economic literature, critics have raised concerns that PES can undermine the recipient’s intrinsic motivation to engage in pro-environmental behavior. Such “crowding out” may reduce the effectiveness of PES and may even worsen conservation outcomes once programs are terminated. In this study, we harnessed a randomized controlled trial that provided PES to land users in Western Uganda and evaluated whether these incentives had a persistent effect on pro-environmental behavior and its underlying behavioral drivers 6 y after the last payments were made. We elicited pro-environmental behavior with an incentivized, experimental measure that consisted of a choice for respondents between more and less environmentally friendly tree seedlings. In addition to this main outcome, survey-based measures for underlying behavioral drivers captured self-efficacy beliefs, intrinsic motivation, and perceived forest benefits. Overall, we found no indications that PES led to the crowding out of pro-environmental behavior. That is, respondents from the treatment villages were as likely as respondents from the control villages to choose environmentally friendly tree seedlings. We also found no systematic differences between these two groups in their underlying behavioral drivers, and nor did we find evidence for crowding effects when focusing on self-reported tree planting behavior as an alternative outcome measure.
Citation: Vorlaufer, Tobias, Stefanie Engel, Joost de Laat, and Björn Vollan. 2023. ‘Payments for Ecosystem Services Did Not Crowd out Pro-Environmental Behavior: Long-Term Experimental Evidence from Uganda’. Proceedings of the National Academy of Sciences 120 (18): e2215465120. https://doi.org/10.1073/pnas.2215465120.

URL: https://doi.org/10.1073/pnas.2215465120
Abstract: Conservation policies and programs may trigger unintended, potentially irreversible, changes that were initially not anticipated. Concerns have been raised that the introduction of payments for environmental services (PES) fosters the privatization of natural ecosystems to the detriment of marginalized groups. We assess the long-term impacts of PES on sharing of access to natural resources, associated norms, and social preferences. The studied PES program was implemented as a randomized control trial in western Uganda. Using survey and experimental data collected six years after the last payments were made, we find that the PES program did not lead to a lasting shift in resource sharing practices but did induce stronger social norms for resource sharing. Moreover, landowners in former PES villages exhibit more egalitarian social preferences than landowners in control villages. These results highlight that despite introducing unequal conservation benefits to communities, long-lasting negative spillovers of PES could be avoided.
Citation: Vorlaufer, Tobias, Joost de Laat, and Stefanie Engel. 2023. ‘Do Payments for Environmental Services Affect Forest Access and Social Preferences in the Long Run? Experimental Evidence from Uganda’. Journal of the Association of Environmental and Resource Economists 10 (2): 389–412. https://doi.org/10.1086/721440.

URL: https://doi.org/10.1086/721440
",http://doi.org/10.17605/OSF.IO/Q4YEM,http://doi.org/10.17605/OSF.IO/Q4YEM,aea_pap_paper_package_governance_candidate,stage_native_metric_first,"Registry supplies PAP/paper/package links and N fields, but final effect estimates must be extracted from the linked paper or replication package."
AEARCTR-0004717,"Exploring the continuum between public and private goods: Bidding for soil fertility information in Malawi
",http://www.socialscienceregistry.org/trials/4717,completed,2019-09-17,Private,Malawi (),"[""agriculture"", ""environment_and_energy""]",Individual and collective contributions (in Malawian Kwacha) towards purchase of a soil fertility test from a maize plot and accompanying management recommendations,30 villages in the public goods game,600 individuals (20 per village),30 villages.,600 farmers.,"Abstract: We examine the relationship between soil heterogeneity and investment in learning among farmers in Malawi using an experimental approach. Soil heterogeneity may both impede social learning and encourage experimentation. In our experiment, farmers contribute towards the purchase of a single soil test in the village in a threshold public goods game. This soil test provides farmers with valuable and actionable information. By randomly varying the plot selected for soil testing we establish the role of soil heterogeneity. We find that farmers contribute more when they perceive soils to be more similar to their own plot, but also free ride on others whose soils they perceive as similar. This free riding increases in larger groups of farmers with similar soils. Despite this, all villages consistently contribute enough to purchase the soil test.
Citation: Berazneva, Julia, Annemie Maertens, Wezi Mhango, and Hope Michelson. 2023. “Paying for Agricultural Information in Malawi: The Role of Soil Heterogeneity.” Journal of Development Economics 165 (October): 103144.
URL: https://doi.org/10.1016/j.jdeveco.2023.103144
",https://doi.org/10.7910/DVN/ALKOCV,https://doi.org/10.7910/DVN/ALKOCV,aea_pap_paper_package_governance_candidate,stage_native_metric_first,"Registry supplies PAP/paper/package links and N fields, but final effect estimates must be extracted from the linked paper or replication package."
AEARCTR-0004846,"Does self-reflection, professional skills, or cash lead to the highest socio-emotional and economic gains for women in Rwanda?",http://www.socialscienceregistry.org/trials/4846,completed,2019-10-14,Private,Rwanda (Nyagisozi and Cyahinda sectors of Nyaruguru district),"[""gender"", ""governance"", ""leadership"", ""psychology of poverty""]","Socio-emotional: self-advocacy, number of leadership positions currently held, connections within cooperatives, connections within the home and village, problem solving, effective communication.
Economic: estimated income, likelihood of working for money, marginal utility of expenditure.",451 women.,"We will have 451 individuals observed in each of three survey rounds, plus 308 women observed in the post workshop survey.",456 women,456 women,"Abstract: Despite growing evidence on the determinants of psychosocial wellbeing, we know comparatively little about the impacts of different types of interventions on psychosocial versus economic outcomes. We conduct a randomized control trial in Rwanda that benchmarks two programs against an unconditional cash transfer, implemented in conjunction with existing anti-poverty interventions. The first is psychologically-targeted and focuses on promoting personal agency: self-confidence, sense of value, and social status. The second program targets specific skills: goal setting, public speaking, and networking. The psychologically-targeted intervention leads to significant improvements across a range of psychosocial outcomes, but no economic gains relative to the cash transfer. By contrast, the skills-based program improves economic outcomes but not psychosocial wellbeing. Our results suggest that well-designed, low-cost programs can outperform cost-equivalent cash transfers in terms of impacts on psychosocial and economic outcomes.
Citation: Megan Lang, Edward Soule, and Catherine Tinsley. ""Psychology, Skills, or Cash?"" 2021.
URL: https://www.google.com/url?q=https%3A%2F%2Fwww.dropbox.com%2Fs%2F9hvrdc5dw1hksmf%2FResonate.pdf%3Fdl%3D0&sa=D&sntz=1&usg=AFQjCNG2KNoUQwF0a9xdpmFm7tTF8IWy0w
",https://dataverse.harvard.edu/dataset.xhtml?persistentId=doi:10.7910/DVN/7WCTBP,https://dataverse.harvard.edu/dataset.xhtml?persistentId=doi:10.7910/DVN/7WCTBP,aea_pap_paper_package_governance_candidate,stage_native_metric_first,"Registry supplies PAP/paper/package links and N fields, but final effect estimates must be extracted from the linked paper or replication package."
