plot_name,plot_inclusion_status,source_label,citation_key,corpus_what_it_is,backing_path,rows_available,rows_in_dump,inclusion_rule,remaining_caveat
Plot 4,included,Published-paper endpoint candidate corpus,internalPlot4AllSourceDump,Paper/unit-level published endpoint candidates with recoverable D and N.,data/derived/corpus_candidates/candidate_d_n_papers.csv,25881,25881,include every candidate paper/study unit with positive D and N from the current candidate paper-level file,"mixes published-original candidates, comparator-only rows, and other paper-level candidates; source_status carries that distinction"
Plot 4,included,Replication-pairs live corpus,internalPlot4AllSourceDump,Original and follow-up sides from the live replication-pair corpus.,data/derived/replication_pairs/replication_pairs_all_on_hand.csv,4860,4839,split each live endpoint pair into original-side and follow-up-side D/N points,"side-level points intentionally duplicate pair membership; this layer is descriptive, not an inferential paired analysis"
Plot 4,included,Preregistered-results tables,internalPlot4AllSourceDump,Normalized preregistered confirmatory result rows from Plot 3.,data/derived/paper_tables/table_40_preregistered_hypotheses_scheel_2021_psa_cr001_corpus.csv | data/derived/paper_tables/table_41_added_preregistered_rows_from_psa_cr001_dorison_et_al_2022.csv,3546,3546,include each normalized preregistered confirmatory D/N result from Plot 3,small curated layer; not an exhaustive registry of preregistered science
Plot 4,included_sidecar,Staged replication harvest artifacts,internalPlot4AllSourceDump,Non-promoted staged harvest rows that already expose positive D and N for a side.,data/derived/replication_pairs/harvest/staged,65,2,include non-promoted staged rows only when a positive D and N are already present for a side,"most staged files are roster-only, native-metric, or otherwise D-blocked and therefore remain out of this D/N figure"
Plot 4,not_included,Promoted harvest pair tables,internalPlot4AllSourceDump,Source-specific promoted harvest outputs already folded into the live replication-pair table.,data/derived/replication_pairs/harvest/promoted,34,0,not separately loaded,"promoted rows are already folded into the live replication-pairs corpus above, so direct inclusion would duplicate them"
