run_id	query_id	surface	rank	title	doi	year	journal	url	relation_score	relation_evidence_type	relation_quote	value_score	negative_flag	raw_record_path
2026-05-05_individual_replication_vast_search_batch001	01_metadata_replication_language_openalex_crossref_semanticscholar__same_0014__crossref	crossref	8	A Replication of the Procedures from Bem (2010, Study 8) and a Failure to Replicate the Same Results	10.2139/ssrn.1699970	2010	SSRN Electronic Journal	https://doi.org/10.2139/ssrn.1699970	5	title_exact_replication	A Replication of the Procedures from Bem (2010, Study 8) and a Failure to Replicate the Same Results	0	False	steps/searches/figure1/individualrepsearch_api_batch001/raw/crossref/01_metadata_replication_language_openalex_crossref_semanticscholar_same_0014_crossref.json
2026-05-05_individual_replication_vast_search_batch001	01_metadata_replication_language_openalex_crossref_semanticscholar__usin_0015__openalex	openalex	1	Out, Damned Spot: Can the “Macbeth Effect” Be Replicated?	10.1080/01973533.2013.856792	2014	Basic and Applied Social Psychology	https://openalex.org/W2032161788	3	methods_original_study_mapping	lly, to cleanse themselves. In an attempt to build upon these findings, we conducted a series of direct replications of Study 2 from Z&L's seminal report. We used Z&L's original materials and methods, investigated samples that were more representative of the general population, investigated samples from different countries and cultures, and substanti	0	False	steps/searches/figure1/individualrepsearch_api_batch001/raw/openalex/01_metadata_replication_language_openalex_crossref_semanticscholar_usin_0015_openalex.json
2026-05-05_individual_replication_vast_search_batch001	01_metadata_replication_language_openalex_crossref_semanticscholar__usin_0015__openalex	openalex	2	Sablot (Litsea Glutinosa), Lour Rob., in the Continuing Preservation and Conservation of the Cultural Heritage of Ilocos (Philippines): A Historic and Technical Approach	10.23969/sampurasun.v4i01.435	2018	Journal Sampurasun Interdisciplinary Studies for Cultural Heritage	https://openalex.org/W2989326476	3	methods_original_study_mapping	ast. However, the act of preservation and conservation may be done using the materials of today’s technology, or by the same materials present before. If today’s technology will be used, the method of preservation and conservation shall be with the use of cement with its sand and gravel combination for dilapidated brick walls, and similar items. If the	0	False	steps/searches/figure1/individualrepsearch_api_batch001/raw/openalex/01_metadata_replication_language_openalex_crossref_semanticscholar_usin_0015_openalex.json
2026-05-05_individual_replication_vast_search_batch001	01_metadata_replication_language_openalex_crossref_semanticscholar__usin_0015__crossref	crossref	1	5389531 Methods to replicate DNA in vitro using PRD1-catalyzed DNA replication systems	10.1016/0734-9750(95)94121-l	1995	Biotechnology Advances	https://doi.org/10.1016/0734-9750(95)94121-l	0	no_relation_evidence		0	False	steps/searches/figure1/individualrepsearch_api_batch001/raw/crossref/01_metadata_replication_language_openalex_crossref_semanticscholar_usin_0015_crossref.json
2026-05-05_individual_replication_vast_search_batch001	01_metadata_replication_language_openalex_crossref_semanticscholar__usin_0015__crossref	crossref	2	5389531 Methods to replicate DNA in vitro using PRD1-catalyzed DNA replication systems	10.1016/0734-9750(95)94208-n	1995	Biotechnology Advances	https://doi.org/10.1016/0734-9750(95)94208-n	0	no_relation_evidence		0	False	steps/searches/figure1/individualrepsearch_api_batch001/raw/crossref/01_metadata_replication_language_openalex_crossref_semanticscholar_usin_0015_crossref.json
2026-05-05_individual_replication_vast_search_batch001	01_metadata_replication_language_openalex_crossref_semanticscholar__usin_0015__crossref	crossref	3	Using the Triarchic model of psychopathy to replicate ``Greed is good? Student disciplinary choice and self-reported psychopathy''	10.20982/tqmp.14.1.r001	2018	The Quantitative Methods for Psychology	https://doi.org/10.20982/tqmp.14.1.r001	0	no_relation_evidence		0	False	steps/searches/figure1/individualrepsearch_api_batch001/raw/crossref/01_metadata_replication_language_openalex_crossref_semanticscholar_usin_0015_crossref.json
2026-05-05_individual_replication_vast_search_batch001	01_metadata_replication_language_openalex_crossref_semanticscholar__usin_0015__crossref	crossref	4	The RUSI Mask is an Authentic Replicate of the Original Death Mask of Napoléon	10.18483/ijsci.2696	2023	International Journal of Sciences	https://doi.org/10.18483/ijsci.2696	0	no_relation_evidence		0	False	steps/searches/figure1/individualrepsearch_api_batch001/raw/crossref/01_metadata_replication_language_openalex_crossref_semanticscholar_usin_0015_crossref.json
2026-05-05_individual_replication_vast_search_batch001	01_metadata_replication_language_openalex_crossref_semanticscholar__usin_0015__crossref	crossref	5	Panero et al. (2016): Failure to replicate methods caused the failure to replicate results.	10.1037/pspa0000072	2017	Journal of Personality and Social Psychology	https://doi.org/10.1037/pspa0000072	5	title_exact_replication	Panero et al. (2016): Failure to replicate methods caused the failure to replicate results.	0	False	steps/searches/figure1/individualrepsearch_api_batch001/raw/crossref/01_metadata_replication_language_openalex_crossref_semanticscholar_usin_0015_crossref.json
2026-05-05_individual_replication_vast_search_batch001	01_metadata_replication_language_openalex_crossref_semanticscholar__usin_0015__crossref	crossref	6	Quantifying spatiotemporal variability and noise in absolute microbiota abundances using replicate sampling	10.1038/s41592-019-0467-y	2019	Nature Methods	https://doi.org/10.1038/s41592-019-0467-y	0	no_relation_evidence		0	False	steps/searches/figure1/individualrepsearch_api_batch001/raw/crossref/01_metadata_replication_language_openalex_crossref_semanticscholar_usin_0015_crossref.json
2026-05-05_individual_replication_vast_search_batch001	01_metadata_replication_language_openalex_crossref_semanticscholar__usin_0015__crossref	crossref	7	Replicate, replicate	10.1108/ws.2003.07952fad.005	2003	Work Study	https://doi.org/10.1108/ws.2003.07952fad.005	0	no_relation_evidence		0	False	steps/searches/figure1/individualrepsearch_api_batch001/raw/crossref/01_metadata_replication_language_openalex_crossref_semanticscholar_usin_0015_crossref.json
2026-05-05_individual_replication_vast_search_batch001	01_metadata_replication_language_openalex_crossref_semanticscholar__usin_0015__crossref	crossref	8	The mystery of the Persian mummy: original or fake?	10.1016/s0168-583x(04)00649-4	2004	Nuclear Instruments and Methods in Physics Research Section B: Beam Interactions with Materials and Atoms	https://doi.org/10.1016/s0168-583x(04)00649-4	0	no_relation_evidence		0	False	steps/searches/figure1/individualrepsearch_api_batch001/raw/crossref/01_metadata_replication_language_openalex_crossref_semanticscholar_usin_0015_crossref.json
2026-05-05_individual_replication_vast_search_batch001	02_open_full_text_value_language_pmc_plos_europepmc_full_text__direct_re_0016__europepmc	europepmc	1	The Effects of Repeated Finger Flexion Movements on Self-Reported Affect and Reward System Activation Are Weak and Inconsistent.	10.1002/jclp.70017	2025		https://doi.org/10.1002/jclp.70017	4	abstract_direct_replication	sk. Results were highly inconsistent across two pre-registered studies-a direct and conceptual replication. In Study 1 (direct replication), undergraduates (n = 216) randomly assigned to the repeated flexion movement condition reported greater positive affect than those assigned to an active control condition. But there were no differences in approach-rewa	1	False	steps/searches/figure1/individualrepsearch_api_batch001/raw/europepmc/02_open_full_text_value_language_pmc_plos_europepmc_full_text_direct_re_0016_europepmc.json
2026-05-05_individual_replication_vast_search_batch001	02_open_full_text_value_language_pmc_plos_europepmc_full_text__direct_re_0016__europepmc	europepmc	2	The Medusa effect: a registered replication report of Will, Merritt, Jenkins and Kingstone (2021).	10.1098/rsos.231802	2024		https://doi.org/10.1098/rsos.231802	5	title_registered_replication_report	The Medusa effect: a registered replication report of Will, Merritt, Jenkins and Kingstone (2021).	1	True	steps/searches/figure1/individualrepsearch_api_batch001/raw/europepmc/02_open_full_text_value_language_pmc_plos_europepmc_full_text_direct_re_0016_europepmc.json
2026-05-05_individual_replication_vast_search_batch001	02_open_full_text_value_language_pmc_plos_europepmc_full_text__direct_re_0016__europepmc	europepmc	3	New evidence finds young people in Mainland China are now bicultural.	10.1111/bjop.12767	2025		https://doi.org/10.1111/bjop.12767	4	abstract_direct_replication	ts with images from two different cultures and measuring whether those images activate different thought styles. First, we replicated findings from 25 years ago that college students in Hong Kong are bicultural (Study 1). Next, we found that priming Mainland Chinese college students with Chinese culture increased external attributions (which are more	1	False	steps/searches/figure1/individualrepsearch_api_batch001/raw/europepmc/02_open_full_text_value_language_pmc_plos_europepmc_full_text_direct_re_0016_europepmc.json
2026-05-05_individual_replication_vast_search_batch001	02_open_full_text_value_language_pmc_plos_europepmc_full_text__direct_re_0016__europepmc	europepmc	4	The tainted altruism effect: a successful pre-registered replication.	10.1098/rsos.211152	2022		https://doi.org/10.1098/rsos.211152	5	title_exact_replication	The tainted altruism effect: a successful pre-registered replication.	0	False	steps/searches/figure1/individualrepsearch_api_batch001/raw/europepmc/02_open_full_text_value_language_pmc_plos_europepmc_full_text_direct_re_0016_europepmc.json
2026-05-05_individual_replication_vast_search_batch001	02_open_full_text_value_language_pmc_plos_europepmc_full_text__direct_re_0016__europepmc	europepmc	5	Replicative Study of the Impacts of Applied Behavior Analysis on Target Behaviors in Individuals With Autism Using Repeated Measures.	10.7759/cureus.56226	2024		https://doi.org/10.7759/cureus.56226	0	no_relation_evidence		1	False	steps/searches/figure1/individualrepsearch_api_batch001/raw/europepmc/02_open_full_text_value_language_pmc_plos_europepmc_full_text_direct_re_0016_europepmc.json
2026-05-05_individual_replication_vast_search_batch001	02_open_full_text_value_language_pmc_plos_europepmc_full_text__direct_re_0016__europepmc	europepmc	6	Using prediction markets to predict the outcomes in the Defense Advanced Research Projects Agency's next-generation social science programme.	10.1098/rsos.181308	2021		https://doi.org/10.1098/rsos.181308	0	no_relation_evidence		2	False	steps/searches/figure1/individualrepsearch_api_batch001/raw/europepmc/02_open_full_text_value_language_pmc_plos_europepmc_full_text_direct_re_0016_europepmc.json
2026-05-05_individual_replication_vast_search_batch001	02_open_full_text_value_language_pmc_plos_europepmc_full_text__direct_re_0016__europepmc	europepmc	7	Clinical EFT as an evidence-based practice for the treatment of psychological and physiological conditions: A systematic review.	10.3389/fpsyg.2022.951451	2022		https://doi.org/10.3389/fpsyg.2022.951451	-5	same_data_or_review_negative		0	True	steps/searches/figure1/individualrepsearch_api_batch001/raw/europepmc/02_open_full_text_value_language_pmc_plos_europepmc_full_text_direct_re_0016_europepmc.json
2026-05-05_individual_replication_vast_search_batch001	02_open_full_text_value_language_pmc_plos_europepmc_full_text__direct_re_0016__europepmc	europepmc	8	The first direct replication on using verbal credibility assessment for the detection of deceptive intentions.	10.1002/acp.3439	2018		https://doi.org/10.1002/acp.3439	5	title_exact_replication	The first direct replication on using verbal credibility assessment for the detection of deceptive intentions.	0	False	steps/searches/figure1/individualrepsearch_api_batch001/raw/europepmc/02_open_full_text_value_language_pmc_plos_europepmc_full_text_direct_re_0016_europepmc.json
2026-05-05_individual_replication_vast_search_batch001	02_open_full_text_value_language_pmc_plos_europepmc_full_text__effect_si_0017__europepmc	europepmc	1	Evaluating the applicability of replication success metrics in animal-to-human translation: A simulation study	10.1101/2025.11.07.25339757	2025		https://doi.org/10.1101/2025.11.07.25339757	-5	same_data_or_review_negative		1	True	steps/searches/figure1/individualrepsearch_api_batch001/raw/europepmc/02_open_full_text_value_language_pmc_plos_europepmc_full_text_effect_si_0017_europepmc.json
2026-05-05_individual_replication_vast_search_batch001	02_open_full_text_value_language_pmc_plos_europepmc_full_text__effect_si_0017__europepmc	europepmc	2	Who Likes Extraverts? Testing the Interplay Between Perceiver Needs and Target Appearance in Impression Formation.	10.5334/irsp.996	2026		https://doi.org/10.5334/irsp.996	0	no_relation_evidence		0	False	steps/searches/figure1/individualrepsearch_api_batch001/raw/europepmc/02_open_full_text_value_language_pmc_plos_europepmc_full_text_effect_si_0017_europepmc.json
2026-05-05_individual_replication_vast_search_batch001	02_open_full_text_value_language_pmc_plos_europepmc_full_text__effect_si_0017__europepmc	europepmc	3	When Do Interaction/Moderation Effects Stabilize in Linear Regression?	10.1177/25152459251407860	2026		https://doi.org/10.1177/25152459251407860	0	no_relation_evidence		2	False	steps/searches/figure1/individualrepsearch_api_batch001/raw/europepmc/02_open_full_text_value_language_pmc_plos_europepmc_full_text_effect_si_0017_europepmc.json
2026-05-05_individual_replication_vast_search_batch001	02_open_full_text_value_language_pmc_plos_europepmc_full_text__effect_si_0017__europepmc	europepmc	4	Under my umbrella: Rating scales obscure statistical power and effect size heterogeneity.	10.3758/s13428-025-02879-w	2025		https://doi.org/10.3758/s13428-025-02879-w	0	no_relation_evidence		3	False	steps/searches/figure1/individualrepsearch_api_batch001/raw/europepmc/02_open_full_text_value_language_pmc_plos_europepmc_full_text_effect_si_0017_europepmc.json
2026-05-05_individual_replication_vast_search_batch001	02_open_full_text_value_language_pmc_plos_europepmc_full_text__effect_si_0017__europepmc	europepmc	5	Statistical Power in Musculoskeletal Research: A Meta-Review of 266 Randomised Controlled Trials.	10.1186/s40798-025-00908-8	2025		https://doi.org/10.1186/s40798-025-00908-8	-5	same_data_or_review_negative		1	True	steps/searches/figure1/individualrepsearch_api_batch001/raw/europepmc/02_open_full_text_value_language_pmc_plos_europepmc_full_text_effect_si_0017_europepmc.json
2026-05-05_individual_replication_vast_search_batch001	02_open_full_text_value_language_pmc_plos_europepmc_full_text__effect_si_0017__europepmc	europepmc	6	Cognitive functions and skill level in Brazilian Jiu-Jitsu: an exploratory study using virtual reality.	10.3389/fspor.2025.1738534	2025		https://doi.org/10.3389/fspor.2025.1738534	0	no_relation_evidence		1	False	steps/searches/figure1/individualrepsearch_api_batch001/raw/europepmc/02_open_full_text_value_language_pmc_plos_europepmc_full_text_effect_si_0017_europepmc.json
2026-05-05_individual_replication_vast_search_batch001	02_open_full_text_value_language_pmc_plos_europepmc_full_text__effect_si_0017__europepmc	europepmc	7	On the replicability of physiological responses.	10.1242/jeb.250363	2026		https://doi.org/10.1242/jeb.250363	0	no_relation_evidence		1	False	steps/searches/figure1/individualrepsearch_api_batch001/raw/europepmc/02_open_full_text_value_language_pmc_plos_europepmc_full_text_effect_si_0017_europepmc.json
2026-05-05_individual_replication_vast_search_batch001	02_open_full_text_value_language_pmc_plos_europepmc_full_text__effect_si_0017__europepmc	europepmc	8	Estimating the Replicability of Sports and Exercise Science Research.	10.1007/s40279-025-02201-w	2025		https://doi.org/10.1007/s40279-025-02201-w	-5	same_data_or_review_negative		1	True	steps/searches/figure1/individualrepsearch_api_batch001/raw/europepmc/02_open_full_text_value_language_pmc_plos_europepmc_full_text_effect_si_0017_europepmc.json
2026-05-05_individual_replication_vast_search_batch001	02_open_full_text_value_language_pmc_plos_europepmc_full_text__means_and_0018__europepmc	europepmc	1	Under my umbrella: Rating scales obscure statistical power and effect size heterogeneity.	10.3758/s13428-025-02879-w	2025		https://doi.org/10.3758/s13428-025-02879-w	0	no_relation_evidence		3	False	steps/searches/figure1/individualrepsearch_api_batch001/raw/europepmc/02_open_full_text_value_language_pmc_plos_europepmc_full_text_means_and_0018_europepmc.json
2026-05-05_individual_replication_vast_search_batch001	02_open_full_text_value_language_pmc_plos_europepmc_full_text__means_and_0018__europepmc	europepmc	2	Possessing potential weapons (still) heightens anger perception: Replicating and extending a test of error management theory.	10.1371/journal.pone.0326446	2025		https://doi.org/10.1371/journal.pone.0326446	4	abstract_direct_replication	"be both higher in state anger and more anger-prone, relative to individuals holding control objects. Here, we conduct a direct replication of one such study examining these effects [13] and exploratorily test whether friends of an individual possessing a potentially lethal tool are also perceived as angrier-and hence more dangerous-in a ""reverse-halo"" effe"	1	False	steps/searches/figure1/individualrepsearch_api_batch001/raw/europepmc/02_open_full_text_value_language_pmc_plos_europepmc_full_text_means_and_0018_europepmc.json
2026-05-05_individual_replication_vast_search_batch001	02_open_full_text_value_language_pmc_plos_europepmc_full_text__means_and_0018__europepmc	europepmc	3	Large-scale multi-site study shows no association between musical training and early auditory neural sound encoding.	10.1038/s41467-025-62155-5	2025		https://doi.org/10.1038/s41467-025-62155-5	4	abstract_failed_replication	ti-site preregistered study (n > 260) to replicate and extend the findings underpinning this important relationship. We failed to replicate any of the major findings selected for replication that were published previously in smaller studies. Musical training was not associated with enhanced neural encoding strength of a speech stimulus (/da/) in babble, whe	0	False	steps/searches/figure1/individualrepsearch_api_batch001/raw/europepmc/02_open_full_text_value_language_pmc_plos_europepmc_full_text_means_and_0018_europepmc.json
2026-05-05_individual_replication_vast_search_batch001	02_open_full_text_value_language_pmc_plos_europepmc_full_text__means_and_0018__europepmc	europepmc	4	A replication of Triplett's 'social facilitation experiment'.	10.1038/s41598-025-25608-x	2025		https://doi.org/10.1038/s41598-025-25608-x	5	title_exact_replication	A replication of Triplett's 'social facilitation experiment'.	1	True	steps/searches/figure1/individualrepsearch_api_batch001/raw/europepmc/02_open_full_text_value_language_pmc_plos_europepmc_full_text_means_and_0018_europepmc.json
2026-05-05_individual_replication_vast_search_batch001	02_open_full_text_value_language_pmc_plos_europepmc_full_text__means_and_0018__europepmc	europepmc	5	Comparative analysis of maze complexity: implications for adult hippocampal neurogenesis.	10.3389/fnins.2026.1766823	2026		https://doi.org/10.3389/fnins.2026.1766823	0	no_relation_evidence		0	False	steps/searches/figure1/individualrepsearch_api_batch001/raw/europepmc/02_open_full_text_value_language_pmc_plos_europepmc_full_text_means_and_0018_europepmc.json
2026-05-05_individual_replication_vast_search_batch001	02_open_full_text_value_language_pmc_plos_europepmc_full_text__means_and_0018__europepmc	europepmc	6	Call up the (cognitive) reserves: how adult socialisation and education influences cognition in the UK Biobank.	10.3389/fpsyg.2025.1542282	2025		https://doi.org/10.3389/fpsyg.2025.1542282	0	no_relation_evidence		0	False	steps/searches/figure1/individualrepsearch_api_batch001/raw/europepmc/02_open_full_text_value_language_pmc_plos_europepmc_full_text_means_and_0018_europepmc.json
2026-05-05_individual_replication_vast_search_batch001	02_open_full_text_value_language_pmc_plos_europepmc_full_text__means_and_0018__europepmc	europepmc	7	Infection-sensing minigenome as a novel therapeutic approach against Ebola virus.	10.1016/j.omtn.2025.102722	2025		https://doi.org/10.1016/j.omtn.2025.102722	0	no_relation_evidence		0	False	steps/searches/figure1/individualrepsearch_api_batch001/raw/europepmc/02_open_full_text_value_language_pmc_plos_europepmc_full_text_means_and_0018_europepmc.json
2026-05-05_individual_replication_vast_search_batch001	02_open_full_text_value_language_pmc_plos_europepmc_full_text__means_and_0018__europepmc	europepmc	8	Comparing Likert and visual analogue scales in ecological momentary assessment.	10.3758/s13428-025-02706-2	2025		https://doi.org/10.3758/s13428-025-02706-2	0	no_relation_evidence		1	False	steps/searches/figure1/individualrepsearch_api_batch001/raw/europepmc/02_open_full_text_value_language_pmc_plos_europepmc_full_text_means_and_0018_europepmc.json
2026-05-05_individual_replication_vast_search_batch001	02_open_full_text_value_language_pmc_plos_europepmc_full_text__forest_pl_0019__europepmc	europepmc	1	Reproducibility of meta-analytic results in systematic reviews of interventions: meta-research study.	10.1136/bmjmed-2025-002024	2025		https://doi.org/10.1136/bmjmed-2025-002024	-5	same_data_or_review_negative		0	True	steps/searches/figure1/individualrepsearch_api_batch001/raw/europepmc/02_open_full_text_value_language_pmc_plos_europepmc_full_text_forest_pl_0019_europepmc.json
2026-05-05_individual_replication_vast_search_batch001	02_open_full_text_value_language_pmc_plos_europepmc_full_text__forest_pl_0019__europepmc	europepmc	2	Amyloid-beta-targeting monoclonal antibodies for people with mild cognitive impairment or mild dementia due to Alzheimer's disease.	10.1002/14651858.cd016297	2026		https://doi.org/10.1002/14651858.cd016297	-5	same_data_or_review_negative		3	True	steps/searches/figure1/individualrepsearch_api_batch001/raw/europepmc/02_open_full_text_value_language_pmc_plos_europepmc_full_text_forest_pl_0019_europepmc.json
2026-05-05_individual_replication_vast_search_batch001	02_open_full_text_value_language_pmc_plos_europepmc_full_text__forest_pl_0019__europepmc	europepmc	3	Effect of power training on physical functional performance of patients with Parkinson's disease: A systematic review and meta-analysis of randomized controlled trials.	10.1371/journal.pone.0314058	2025		https://doi.org/10.1371/journal.pone.0314058	-5	same_data_or_review_negative		1	True	steps/searches/figure1/individualrepsearch_api_batch001/raw/europepmc/02_open_full_text_value_language_pmc_plos_europepmc_full_text_forest_pl_0019_europepmc.json
2026-05-05_individual_replication_vast_search_batch001	02_open_full_text_value_language_pmc_plos_europepmc_full_text__forest_pl_0019__europepmc	europepmc	4	Assessing the Evidential Value of Mental Fatigue and Exercise Research.	10.1007/s40279-023-01926-w	2023		https://doi.org/10.1007/s40279-023-01926-w	-5	same_data_or_review_negative		1	True	steps/searches/figure1/individualrepsearch_api_batch001/raw/europepmc/02_open_full_text_value_language_pmc_plos_europepmc_full_text_forest_pl_0019_europepmc.json
2026-05-05_individual_replication_vast_search_batch001	02_open_full_text_value_language_pmc_plos_europepmc_full_text__forest_pl_0019__europepmc	europepmc	5	General strengthening exercise for chronic low back pain		2024		https://pmc.ncbi.nlm.nih.gov/articles/PMC10929355/	0	no_relation_evidence		0	False	steps/searches/figure1/individualrepsearch_api_batch001/raw/europepmc/02_open_full_text_value_language_pmc_plos_europepmc_full_text_forest_pl_0019_europepmc.json
2026-05-05_individual_replication_vast_search_batch001	02_open_full_text_value_language_pmc_plos_europepmc_full_text__forest_pl_0019__europepmc	europepmc	6	Perceived Statistical Knowledge Level and Self-Reported Statistical Practice Among Academic Psychologists.	10.3389/fpsyg.2018.00996	2018		https://doi.org/10.3389/fpsyg.2018.00996	0	no_relation_evidence		1	False	steps/searches/figure1/individualrepsearch_api_batch001/raw/europepmc/02_open_full_text_value_language_pmc_plos_europepmc_full_text_forest_pl_0019_europepmc.json
2026-05-05_individual_replication_vast_search_batch001	02_open_full_text_value_language_pmc_plos_europepmc_full_text__forest_pl_0019__europepmc	europepmc	7	Interventions for anxiety in mainstream school-aged children with autism spectrum disorder: A systematic review.	10.1002/cl2.1086	2020		https://doi.org/10.1002/cl2.1086	-5	same_data_or_review_negative		0	True	steps/searches/figure1/individualrepsearch_api_batch001/raw/europepmc/02_open_full_text_value_language_pmc_plos_europepmc_full_text_forest_pl_0019_europepmc.json
2026-05-05_individual_replication_vast_search_batch001	02_open_full_text_value_language_pmc_plos_europepmc_full_text__forest_pl_0019__europepmc	europepmc	8	Oral language interventions can improve language outcomes in children with neurodevelopmental disorders: A systematic review and meta-analysis.	10.1002/cl2.1368	2023		https://doi.org/10.1002/cl2.1368	-5	same_data_or_review_negative		2	True	steps/searches/figure1/individualrepsearch_api_batch001/raw/europepmc/02_open_full_text_value_language_pmc_plos_europepmc_full_text_forest_pl_0019_europepmc.json
