run_id	query_id	surface	rank	title	doi	year	journal	url	relation_score	relation_evidence_type	relation_quote	value_score	negative_flag	raw_record_path
2026-05-05_individual_replication_vast_search_batch002	02_open_full_text_value_language_pmc_plos_europepmc_full_text__sample_si_0027__plos	plos	2	From musk to body odor: Decoding olfaction through genetic variation	10.1371/journal.pgen.1009564	2022	PLOS Genetics	https://doi.org/10.1371/journal.pgen.1009564	4	abstract_direct_replication	ix of these odors in an ethnically diverse population (n = 364). In both populations, consistent with previous studies, we replicated three previously reported associations (β-ionone/OR5A1, androstenone/OR7D4, cis-3-hexen-1-ol/OR2J3 LD-band), but not for odors containing aldehydes, suggesting that olfactory phenotype/genotype studies are robust across	0	False	steps/searches/figure1/individualrepsearch_api_batch002/raw/plos/02_open_full_text_value_language_pmc_plos_europepmc_full_text_sample_si_0027_plos.json
2026-05-05_individual_replication_vast_search_batch002	02_open_full_text_value_language_pmc_plos_europepmc_full_text__sample_si_0027__plos	plos	3	The effect of H1N1 vaccination on serum miRNA expression in children: A tale of caution for microRNA microarray studies	10.1371/journal.pone.0221143	2019	PLOS ONE	https://doi.org/10.1371/journal.pone.0221143	4	abstract_failed_replication	ncing data. Real time PCR (RT-qPCR) confirmed downregulation of miR-142-3p in the discovery cohort. These findings were not replicated in the subsequent validation cohort (n = 22). Conclusion: This study is the first study to profile microRNA expression after vaccination. An important feature of this study is many of the differentially expressed microR	1	False	steps/searches/figure1/individualrepsearch_api_batch002/raw/plos/02_open_full_text_value_language_pmc_plos_europepmc_full_text_sample_si_0027_plos.json
2026-05-05_individual_replication_vast_search_batch002	02_open_full_text_value_language_pmc_plos_europepmc_full_text__sample_si_0027__plos	plos	4	Putative Transcriptomic Biomarkers in the Inflammatory Cytokine Pathway Differentiate Major Depressive Disorder Patients from Control Subjects and Bipolar Disorder Patients	10.1371/journal.pone.0091076	2014	PLoS ONE	https://doi.org/10.1371/journal.pone.0091076	4	abstract_independent_validation	aining primers for 87 inflammation-related genes. Initially, we use ANOVA to test for transcriptional differences in a ‘discovery cohort’ (total n = 90) and then we use t-tests to assess the reliability of any identified transcriptional differences in a ‘validation cohort’ (total n = 35). The two most robust and reliable biomarkers identified across both	1	False	steps/searches/figure1/individualrepsearch_api_batch002/raw/plos/02_open_full_text_value_language_pmc_plos_europepmc_full_text_sample_si_0027_plos.json
2026-05-05_individual_replication_vast_search_batch002	02_open_full_text_value_language_pmc_plos_europepmc_full_text__sample_si_0027__plos	plos	5	A Germline Variant on Chromosome 4q31.1 Associates with Susceptibility to Developing Colon Cancer Metastasis	10.1371/journal.pone.0146435	2016	PLOS ONE	https://doi.org/10.1371/journal.pone.0146435	4	abstract_independent_validation	atic colon cancer was further confirmed by a meta-analysis of rs60745952 in these datasets plus an additional Ashkenazi validation cohort (OR = 1.92; 95% CI: 1.28–2.87), and by a permutation test that demonstrated a significantly longer haplotype surrounding rs60745952 in the stage IV samples. rs60745952, located in an intergenic region on chromosome 4q31	1	True	steps/searches/figure1/individualrepsearch_api_batch002/raw/plos/02_open_full_text_value_language_pmc_plos_europepmc_full_text_sample_si_0027_plos.json
2026-05-05_individual_replication_vast_search_batch002	02_open_full_text_value_language_pmc_plos_europepmc_full_text__sample_si_0027__plos	plos	6	MTHFR Glu429Ala and ERCC5 His46His Polymorphisms Are Associated with Prognosis in Colorectal Cancer Patients: Analysis of Two Independent Cohorts from Newfoundland	10.1371/journal.pone.0061469	2013	PLoS ONE	https://doi.org/10.1371/journal.pone.0061469	4	abstract_independent_validation	ation cohorts comprised of 532 and 252 patients, respectively. Genotypes of 27 polymorphisms were first obtained in the discovery cohort and survival analyses were performed assuming the co-dominant genetic model. Polymorphisms associated with disease outcomes in the discovery cohort were then investigated in the validation cohort. Results: When adjusted	1	False	steps/searches/figure1/individualrepsearch_api_batch002/raw/plos/02_open_full_text_value_language_pmc_plos_europepmc_full_text_sample_si_0027_plos.json
2026-05-05_individual_replication_vast_search_batch002	02_open_full_text_value_language_pmc_plos_europepmc_full_text__sample_si_0027__plos	plos	7	Differential MicroRNA Expression Profile between Stimulated PBMCs from HIV-1 Infected Elite Controllers and Viremic Progressors	10.1371/journal.pone.0106360	2014	PLoS ONE	https://doi.org/10.1371/journal.pone.0106360	0	no_relation_evidence		1	False	steps/searches/figure1/individualrepsearch_api_batch002/raw/plos/02_open_full_text_value_language_pmc_plos_europepmc_full_text_sample_si_0027_plos.json
2026-05-05_individual_replication_vast_search_batch002	02_open_full_text_value_language_pmc_plos_europepmc_full_text__sample_si_0027__plos	plos	8	Joint modeling of genetically correlated diseases and functional annotations increases accuracy of polygenic risk prediction	10.1371/journal.pgen.1006836	2017	PLOS Genetics	https://doi.org/10.1371/journal.pgen.1006836	0	no_relation_evidence		1	False	steps/searches/figure1/individualrepsearch_api_batch002/raw/plos/02_open_full_text_value_language_pmc_plos_europepmc_full_text_sample_si_0027_plos.json
2026-05-05_individual_replication_vast_search_batch002	02_open_full_text_value_language_pmc_plos_europepmc_full_text__sample_si_0027__plos	plos	9	Decreased total iron binding capacity upon intensive care unit admission predicts red blood cell transfusion in critically ill patients	10.1371/journal.pone.0210067	2019	PLOS ONE	https://doi.org/10.1371/journal.pone.0210067	4	abstract_independent_validation	unction and an expected stay of ≥ 48 hours, without hemorrhage, were prospectively studied (derivation cohort, n = 121; validation cohort, n = 54). Serum levels of 12 biomarkers (hemoglobin, creatinine, albumin, interleukin-6 [IL-6], erythropoietin, Fe, total iron binding capacity [TIBC], transferrin, ferritin, transferrin saturation, folate, and vitamin	1	False	steps/searches/figure1/individualrepsearch_api_batch002/raw/plos/02_open_full_text_value_language_pmc_plos_europepmc_full_text_sample_si_0027_plos.json
2026-05-05_individual_replication_vast_search_batch002	02_open_full_text_value_language_pmc_plos_europepmc_full_text__sample_si_0027__plos	plos	10	TRAIL/TRAIL Receptor System and Susceptibility to Multiple Sclerosis	10.1371/journal.pone.0021766	2011	PLoS ONE	https://doi.org/10.1371/journal.pone.0021766	0	no_relation_evidence		1	False	steps/searches/figure1/individualrepsearch_api_batch002/raw/plos/02_open_full_text_value_language_pmc_plos_europepmc_full_text_sample_si_0027_plos.json
2026-05-05_individual_replication_vast_search_batch002	02_open_full_text_value_language_pmc_plos_europepmc_full_text__sample_si_0027__plos	plos	11	Association of OX40L Polymorphisms with Sporadic Breast Cancer in Northeast Chinese Han Population	10.1371/journal.pone.0041277	2012		https://doi.org/10.1371/journal.pone.0041277	0	no_relation_evidence		1	False	steps/searches/figure1/individualrepsearch_api_batch002/raw/plos/02_open_full_text_value_language_pmc_plos_europepmc_full_text_sample_si_0027_plos.json
2026-05-05_individual_replication_vast_search_batch002	02_open_full_text_value_language_pmc_plos_europepmc_full_text__sample_si_0027__plos	plos	12	Development of a polygenic risk score to improve screening for fracture risk: A genetic risk prediction study	10.1371/journal.pmed.1003152	2020	PLOS Medicine	https://doi.org/10.1371/journal.pmed.1003152	0	no_relation_evidence		1	False	steps/searches/figure1/individualrepsearch_api_batch002/raw/plos/02_open_full_text_value_language_pmc_plos_europepmc_full_text_sample_si_0027_plos.json
2026-05-05_individual_replication_vast_search_batch002	07_clinical_d_equivalent_followup_pubmed_pmc_clinicaltrials_gov_crossref_0063__crossref	crossref	1	Why do multicenter randomized controlled trials not confirm the positive findings of single center randomized controlled trials in acute care?	10.23736/s0375-9393.18.13070-7	2019	Minerva Anestesiologica	https://doi.org/10.23736/s0375-9393.18.13070-7	0	no_relation_evidence		0	False	steps/searches/figure1/individualrepsearch_api_batch002/raw/crossref/07_clinical_d_equivalent_followup_pubmed_pmc_clinicaltrials_gov_crossref_0063_crossref.json
2026-05-05_individual_replication_vast_search_batch002	07_clinical_d_equivalent_followup_pubmed_pmc_clinicaltrials_gov_crossref_0063__crossref	crossref	2	Spinal cord stimulation vs conventional medical management: a multicenter randomized controlled trial of patients with failed back surgery syndrome (PROCESS study)	10.1016/j.surneu.2007.06.056	2007	Surgical Neurology	https://doi.org/10.1016/j.surneu.2007.06.056	0	no_relation_evidence		1	False	steps/searches/figure1/individualrepsearch_api_batch002/raw/crossref/07_clinical_d_equivalent_followup_pubmed_pmc_clinicaltrials_gov_crossref_0063_crossref.json
2026-05-05_individual_replication_vast_search_batch002	07_clinical_d_equivalent_followup_pubmed_pmc_clinicaltrials_gov_crossref_0063__crossref	crossref	3	P5648Efficiency and accuracy of arrhythmia detection using implantable cardiac monitor: A prospective multicenter randomized clinical trial comparing Reveal LINQ and Confirm Rx	10.1093/eurheartj/ehz746.0591	2019	European Heart Journal	https://doi.org/10.1093/eurheartj/ehz746.0591	0	no_relation_evidence		1	False	steps/searches/figure1/individualrepsearch_api_batch002/raw/crossref/07_clinical_d_equivalent_followup_pubmed_pmc_clinicaltrials_gov_crossref_0063_crossref.json
2026-05-05_individual_replication_vast_search_batch002	07_clinical_d_equivalent_followup_pubmed_pmc_clinicaltrials_gov_crossref_0063__crossref	crossref	4	Sample size calculation for multicenter randomized trial: Taking the center effect into account	10.1016/j.cct.2006.11.003	2007	Contemporary Clinical Trials	https://doi.org/10.1016/j.cct.2006.11.003	0	no_relation_evidence		1	False	steps/searches/figure1/individualrepsearch_api_batch002/raw/crossref/07_clinical_d_equivalent_followup_pubmed_pmc_clinicaltrials_gov_crossref_0063_crossref.json
2026-05-05_individual_replication_vast_search_batch002	07_clinical_d_equivalent_followup_pubmed_pmc_clinicaltrials_gov_crossref_0063__crossref	crossref	5	Letter by Singh Regarding Article, “Enalapril in Infants With Single Ventricle: Results of a Multicenter Randomized Trial”	10.1161/circulationaha.110.989897	2011	Circulation	https://doi.org/10.1161/circulationaha.110.989897	0	no_relation_evidence		0	False	steps/searches/figure1/individualrepsearch_api_batch002/raw/crossref/07_clinical_d_equivalent_followup_pubmed_pmc_clinicaltrials_gov_crossref_0063_crossref.json
2026-05-05_individual_replication_vast_search_batch002	07_clinical_d_equivalent_followup_pubmed_pmc_clinicaltrials_gov_crossref_0063__crossref	crossref	6	Poster 35: Spinal Cord Stimulation Versus Conventional Medical Management: A Multicenter Randomized Controlled Trial of Patients With Failed Back Surgery Syndrome	10.1016/j.apmr.2007.06.543	2007	Archives of Physical Medicine and Rehabilitation	https://doi.org/10.1016/j.apmr.2007.06.543	0	no_relation_evidence		1	False	steps/searches/figure1/individualrepsearch_api_batch002/raw/crossref/07_clinical_d_equivalent_followup_pubmed_pmc_clinicaltrials_gov_crossref_0063_crossref.json
2026-05-05_individual_replication_vast_search_batch002	07_clinical_d_equivalent_followup_pubmed_pmc_clinicaltrials_gov_crossref_0063__crossref	crossref	7	Intensive Maintenance Treatment in Acute Myelogenous Leukemia (AML): Single Institution Experience of a Multicenter Randomized Trial	10.1159/000216473	2009	Onkologie	https://doi.org/10.1159/000216473	0	no_relation_evidence		0	False	steps/searches/figure1/individualrepsearch_api_batch002/raw/crossref/07_clinical_d_equivalent_followup_pubmed_pmc_clinicaltrials_gov_crossref_0063_crossref.json
2026-05-05_individual_replication_vast_search_batch002	07_clinical_d_equivalent_followup_pubmed_pmc_clinicaltrials_gov_crossref_0063__crossref	crossref	8	External Stenting of Vein Grafts Is Safe and Effective: Single-Center Report from the Multicenter Randomized VEST III Trial	10.1055/s-0038-1628023	2018	The Thoracic and Cardiovascular Surgeon	https://doi.org/10.1055/s-0038-1628023	0	no_relation_evidence		0	False	steps/searches/figure1/individualrepsearch_api_batch002/raw/crossref/07_clinical_d_equivalent_followup_pubmed_pmc_clinicaltrials_gov_crossref_0063_crossref.json
2026-05-05_individual_replication_vast_search_batch002	07_clinical_d_equivalent_followup_pubmed_pmc_clinicaltrials_gov_crossref_0063__crossref	crossref	9	Single-Dose Ceftriaxone, Ornidazole, and Povidone-lodine Enema in Elective Left Colectomy	10.1001/archsurg.1993.01420140105017	1993	Archives of Surgery	https://doi.org/10.1001/archsurg.1993.01420140105017	0	no_relation_evidence		0	False	steps/searches/figure1/individualrepsearch_api_batch002/raw/crossref/07_clinical_d_equivalent_followup_pubmed_pmc_clinicaltrials_gov_crossref_0063_crossref.json
2026-05-05_individual_replication_vast_search_batch002	07_clinical_d_equivalent_followup_pubmed_pmc_clinicaltrials_gov_crossref_0063__crossref	crossref	10	Positive single-center randomized trials and subsequent multicenter randomized trials in critically ill patients: a systematic review	10.1186/s13054-023-04755-5	2023	Critical Care	https://doi.org/10.1186/s13054-023-04755-5	4	abstract_failed_replication	ts:p> </jats:sec><jats:sec> <jats:title>Conclusion</jats:title> <jats:p>Mortality reduction shown by sRCTs is typically not replicated by mRCTs. The findings of sRCTs should be considered hypothesis-generating and should not contribute to guidelines.</jats:p> </jats:sec>	2	True	steps/searches/figure1/individualrepsearch_api_batch002/raw/crossref/07_clinical_d_equivalent_followup_pubmed_pmc_clinicaltrials_gov_crossref_0063_crossref.json
2026-05-05_individual_replication_vast_search_batch002	07_clinical_d_equivalent_followup_pubmed_pmc_clinicaltrials_gov_crossref_0063__crossref	crossref	11	A Prospective Randomized Trial Comparing Single Anastomosis Dudenoileal Bypass Versus Single Anastomosis Gastroileal Bypass After Failed Laparoscopic Sleeve Gastrectomy	10.21608/ejsur.2024.330103.1248	2025	The Egyptian Journal of Surgery	https://doi.org/10.21608/ejsur.2024.330103.1248	0	no_relation_evidence		0	False	steps/searches/figure1/individualrepsearch_api_batch002/raw/crossref/07_clinical_d_equivalent_followup_pubmed_pmc_clinicaltrials_gov_crossref_0063_crossref.json
2026-05-05_individual_replication_vast_search_batch002	07_clinical_d_equivalent_followup_pubmed_pmc_clinicaltrials_gov_crossref_0063__crossref	crossref	12	Correction to A prospective, randomized, multicenter, open‐label trial comparing survival in subjects receiving peritoneal dialysis or conventional in‐center hemodialysis	10.1002/med4.80	2024	Medicine Advances	https://doi.org/10.1002/med4.80	0	no_relation_evidence		0	False	steps/searches/figure1/individualrepsearch_api_batch002/raw/crossref/07_clinical_d_equivalent_followup_pubmed_pmc_clinicaltrials_gov_crossref_0063_crossref.json
2026-05-05_individual_replication_vast_search_batch002	07_clinical_d_equivalent_followup_pubmed_pmc_clinicaltrials_gov_crossref_0063__europepmc	europepmc	1	Somatostatin Analogs for Preventing Postoperative Pancreatic Fistula: Past Evidence Reveals New Opportunities.	10.1245/s10434-025-17660-8	2025		https://doi.org/10.1245/s10434-025-17660-8	4	clinical_confirmatory_trial	domized control trials demonstrated a benefit of octreotide in reducing POPF, although subsequent single-center studies failed to confirm these results. Despite additional studies demonstrating a significant reduction in POPF with the use of newer SSAs including pasireotide and lanreotide, surgical practices in the use of somatostatin analogs in preventin	0	False	steps/searches/figure1/individualrepsearch_api_batch002/raw/europepmc/07_clinical_d_equivalent_followup_pubmed_pmc_clinicaltrials_gov_crossref_0063_europepmc.json
2026-05-05_individual_replication_vast_search_batch002	07_clinical_d_equivalent_followup_pubmed_pmc_clinicaltrials_gov_crossref_0063__europepmc	europepmc	2	Early Complication Differences Between Laparoscopic and Open Abdominoperineal Resection.	10.7759/cureus.94533	2025		https://doi.org/10.7759/cureus.94533	0	no_relation_evidence		2	False	steps/searches/figure1/individualrepsearch_api_batch002/raw/europepmc/07_clinical_d_equivalent_followup_pubmed_pmc_clinicaltrials_gov_crossref_0063_europepmc.json
2026-05-05_individual_replication_vast_search_batch002	07_clinical_d_equivalent_followup_pubmed_pmc_clinicaltrials_gov_crossref_0063__europepmc	europepmc	3	Resuscitation Targets, Fluids, and Vasoactives in Septic Shock.	10.1016/j.ccm.2025.10.003	2026		https://doi.org/10.1016/j.ccm.2025.10.003	0	no_relation_evidence		1	False	steps/searches/figure1/individualrepsearch_api_batch002/raw/europepmc/07_clinical_d_equivalent_followup_pubmed_pmc_clinicaltrials_gov_crossref_0063_europepmc.json
2026-05-05_individual_replication_vast_search_batch002	07_clinical_d_equivalent_followup_pubmed_pmc_clinicaltrials_gov_crossref_0063__europepmc	europepmc	4	Potential Pharmacologic Treatments in Spinal Cord Injury: A Narrative Review.	10.13004/kjnt.2025.21.e35	2025		https://doi.org/10.13004/kjnt.2025.21.e35	0	no_relation_evidence		0	False	steps/searches/figure1/individualrepsearch_api_batch002/raw/europepmc/07_clinical_d_equivalent_followup_pubmed_pmc_clinicaltrials_gov_crossref_0063_europepmc.json
2026-05-05_individual_replication_vast_search_batch002	07_clinical_d_equivalent_followup_pubmed_pmc_clinicaltrials_gov_crossref_0063__europepmc	europepmc	5	Mavacamten in the Treatment of Obstructive Hypertrophic Cardiomyopathy: from Pathophysiology To Real World Data.	10.1007/s11886-025-02316-6	2025		https://doi.org/10.1007/s11886-025-02316-6	0	no_relation_evidence		0	False	steps/searches/figure1/individualrepsearch_api_batch002/raw/europepmc/07_clinical_d_equivalent_followup_pubmed_pmc_clinicaltrials_gov_crossref_0063_europepmc.json
2026-05-05_individual_replication_vast_search_batch002	07_clinical_d_equivalent_followup_pubmed_pmc_clinicaltrials_gov_crossref_0063__europepmc	europepmc	6	Radiotherapy in the management of PDAC, from past to present.	10.1016/j.tranon.2025.102632	2026		https://doi.org/10.1016/j.tranon.2025.102632	0	no_relation_evidence		1	False	steps/searches/figure1/individualrepsearch_api_batch002/raw/europepmc/07_clinical_d_equivalent_followup_pubmed_pmc_clinicaltrials_gov_crossref_0063_europepmc.json
2026-05-05_individual_replication_vast_search_batch002	07_clinical_d_equivalent_followup_pubmed_pmc_clinicaltrials_gov_crossref_0063__europepmc	europepmc	7	A Randomized Trial of Ionic Silver Dressing to Reduce Surgical Site Infection After Gastrointestinal Surgery.	10.1097/as9.0000000000000402	2024		https://doi.org/10.1097/as9.0000000000000402	0	no_relation_evidence		2	False	steps/searches/figure1/individualrepsearch_api_batch002/raw/europepmc/07_clinical_d_equivalent_followup_pubmed_pmc_clinicaltrials_gov_crossref_0063_europepmc.json
2026-05-05_individual_replication_vast_search_batch002	07_clinical_d_equivalent_followup_pubmed_pmc_clinicaltrials_gov_crossref_0063__europepmc	europepmc	8	Treatment Options for Distal Rectal Cancer in the Era of Organ Preservation.	10.1007/s11864-024-01194-4	2024		https://doi.org/10.1007/s11864-024-01194-4	0	no_relation_evidence		1	False	steps/searches/figure1/individualrepsearch_api_batch002/raw/europepmc/07_clinical_d_equivalent_followup_pubmed_pmc_clinicaltrials_gov_crossref_0063_europepmc.json
2026-05-05_individual_replication_vast_search_batch002	07_clinical_d_equivalent_followup_pubmed_pmc_clinicaltrials_gov_crossref_0063__europepmc	europepmc	9	Optimizing Biologic Therapy for the Prevention of Post-Operative Recurrence in Crohn's Disease: Current Evidence and Future Perspectives.	10.3390/biomedicines13051232	2025		https://doi.org/10.3390/biomedicines13051232	0	no_relation_evidence		1	False	steps/searches/figure1/individualrepsearch_api_batch002/raw/europepmc/07_clinical_d_equivalent_followup_pubmed_pmc_clinicaltrials_gov_crossref_0063_europepmc.json
2026-05-05_individual_replication_vast_search_batch002	07_clinical_d_equivalent_followup_pubmed_pmc_clinicaltrials_gov_crossref_0063__europepmc	europepmc	10	Injectables in the Therapy of Mid-Portion Achilles Tendinopathy, a Descriptive Review.	10.3390/life15050824	2025		https://doi.org/10.3390/life15050824	0	no_relation_evidence		0	False	steps/searches/figure1/individualrepsearch_api_batch002/raw/europepmc/07_clinical_d_equivalent_followup_pubmed_pmc_clinicaltrials_gov_crossref_0063_europepmc.json
2026-05-05_individual_replication_vast_search_batch002	07_clinical_d_equivalent_followup_pubmed_pmc_clinicaltrials_gov_crossref_0063__europepmc	europepmc	11	Guidelines for Parkinson's disease management part II: consensus from the movement disorders scientific department of the Brazilian Academy of Neurology - non-motor symptoms.	10.1055/s-0045-1802962	2025		https://doi.org/10.1055/s-0045-1802962	0	no_relation_evidence		0	False	steps/searches/figure1/individualrepsearch_api_batch002/raw/europepmc/07_clinical_d_equivalent_followup_pubmed_pmc_clinicaltrials_gov_crossref_0063_europepmc.json
2026-05-05_individual_replication_vast_search_batch002	07_clinical_d_equivalent_followup_pubmed_pmc_clinicaltrials_gov_crossref_0063__europepmc	europepmc	12	Targeting the pylorus in gastroparesis: From physiology to endoscopic pyloromyotomy.	10.1111/nmo.14529	2023		https://doi.org/10.1111/nmo.14529	0	no_relation_evidence		0	False	steps/searches/figure1/individualrepsearch_api_batch002/raw/europepmc/07_clinical_d_equivalent_followup_pubmed_pmc_clinicaltrials_gov_crossref_0063_europepmc.json
2026-05-05_individual_replication_vast_search_batch002	07_clinical_d_equivalent_followup_pubmed_pmc_clinicaltrials_gov_crossref_0064__crossref	crossref	1	Pravastatin	10.2165/00128413-199811630-00031	1998	Inpharma Weekly	https://doi.org/10.2165/00128413-199811630-00031	0	no_relation_evidence		0	False	steps/searches/figure1/individualrepsearch_api_batch002/raw/crossref/07_clinical_d_equivalent_followup_pubmed_pmc_clinicaltrials_gov_crossref_0064_crossref.json
2026-05-05_individual_replication_vast_search_batch002	07_clinical_d_equivalent_followup_pubmed_pmc_clinicaltrials_gov_crossref_0064__crossref	crossref	2	Pravastatin	10.1007/bf03273528	1998	PharmacoEconomics &amp; Outcomes News	https://doi.org/10.1007/bf03273528	0	no_relation_evidence		0	False	steps/searches/figure1/individualrepsearch_api_batch002/raw/crossref/07_clinical_d_equivalent_followup_pubmed_pmc_clinicaltrials_gov_crossref_0064_crossref.json
2026-05-05_individual_replication_vast_search_batch002	07_clinical_d_equivalent_followup_pubmed_pmc_clinicaltrials_gov_crossref_0064__crossref	crossref	3	Landmark Double-Blind Trial Confirms Shunt Benefit in iNPH, but Some Remain Skeptical	10.1097/01.wnt.0001177704.31589.35	2026	Neurology Today	https://doi.org/10.1097/01.wnt.0001177704.31589.35	0	no_relation_evidence		0	False	steps/searches/figure1/individualrepsearch_api_batch002/raw/crossref/07_clinical_d_equivalent_followup_pubmed_pmc_clinicaltrials_gov_crossref_0064_crossref.json
2026-05-05_individual_replication_vast_search_batch002	07_clinical_d_equivalent_followup_pubmed_pmc_clinicaltrials_gov_crossref_0064__crossref	crossref	4	Landmark stem cell trial delayed	10.1016/s0262-4079(09)62238-7	2009	New Scientist	https://doi.org/10.1016/s0262-4079(09)62238-7	0	no_relation_evidence		0	False	steps/searches/figure1/individualrepsearch_api_batch002/raw/crossref/07_clinical_d_equivalent_followup_pubmed_pmc_clinicaltrials_gov_crossref_0064_crossref.json
2026-05-05_individual_replication_vast_search_batch002	07_clinical_d_equivalent_followup_pubmed_pmc_clinicaltrials_gov_crossref_0064__crossref	crossref	5	Assisted dying: Belgian doctors stand trial in landmark case	10.1136/bmj.m259	2020	BMJ	https://doi.org/10.1136/bmj.m259	0	no_relation_evidence		0	False	steps/searches/figure1/individualrepsearch_api_batch002/raw/crossref/07_clinical_d_equivalent_followup_pubmed_pmc_clinicaltrials_gov_crossref_0064_crossref.json
2026-05-05_individual_replication_vast_search_batch002	07_clinical_d_equivalent_followup_pubmed_pmc_clinicaltrials_gov_crossref_0064__crossref	crossref	6	Doubts over landmark heart drug trial: ticagrelor PLATO study	10.1136/bmj.q2550	2024	BMJ	https://doi.org/10.1136/bmj.q2550	0	no_relation_evidence		0	False	steps/searches/figure1/individualrepsearch_api_batch002/raw/crossref/07_clinical_d_equivalent_followup_pubmed_pmc_clinicaltrials_gov_crossref_0064_crossref.json
2026-05-05_individual_replication_vast_search_batch002	07_clinical_d_equivalent_followup_pubmed_pmc_clinicaltrials_gov_crossref_0064__crossref	crossref	7	Landmark CRISPR trial shows promise against deadly disease	10.1038/d41586-021-01776-4	2021	Nature	https://doi.org/10.1038/d41586-021-01776-4	0	no_relation_evidence		0	False	steps/searches/figure1/individualrepsearch_api_batch002/raw/crossref/07_clinical_d_equivalent_followup_pubmed_pmc_clinicaltrials_gov_crossref_0064_crossref.json
