run_id	query_id	surface	rank	title	doi	year	journal	url	relation_score	relation_evidence_type	relation_quote	value_score	negative_flag	raw_record_path
2026-05-05_individual_replication_vast_search_batch002	01_metadata_replication_language_openalex_crossref_semanticscholar__we_a_0010__openalex	openalex	5	Revisiting the decoy effect: replication and extension of Ariely and Wallsten (1995) and Connolly, Reb, and Kausel (2013)	10.1080/23743603.2021.1878340	2020	Comprehensive Results in Social Psychology	https://openalex.org/W3138016342	4	abstract_direct_replication	ed option. In two pre-registered experiments with an Amazon Mechanical Turk (MTurk) sample (N after exclusion = 1,001), we attempted to replicate two experiments from the decoy effect literature. We failed to replicate the original results in Study 1. The observed effects were not in the predicted direction, and their sizes were trivial. We replicated the decoy e	2	False	steps/searches/figure1/individualrepsearch_api_batch002/raw/openalex/01_metadata_replication_language_openalex_crossref_semanticscholar_we_a_0010_openalex.json
2026-05-05_individual_replication_vast_search_batch002	01_metadata_replication_language_openalex_crossref_semanticscholar__we_a_0010__openalex	openalex	6	Numbing or sensitization? Replications and extensions of Fetherstonhaugh et al. (1997)'s “Insensitivity to the Value of Human Life”	10.1016/j.jesp.2021.104222	2021	Journal of Experimental Social Psychology	https://openalex.org/W3198223862	0	no_relation_evidence		0	False	steps/searches/figure1/individualrepsearch_api_batch002/raw/openalex/01_metadata_replication_language_openalex_crossref_semanticscholar_we_a_0010_openalex.json
2026-05-05_individual_replication_vast_search_batch002	01_metadata_replication_language_openalex_crossref_semanticscholar__we_a_0010__openalex	openalex	7	Effects of Preferred versus Nonpreferred Music on Bench Press Performance	10.51224/cik.2024.60	2024	Communications in Kinesiology	https://openalex.org/W4390732818	4	abstract_direct_replication	n a repeated-measures counterbalanced design, while completing bench press repetitions to failure (RTF). Concerning the replication attempt, we found no difference between music conditions for RTF (p = 0.545, Cohen’s dz = 0.12), and the replication and original effect sizes were incompatible (z = -1.88, p = 0.036). For motivation there was no difference bet	2	False	steps/searches/figure1/individualrepsearch_api_batch002/raw/openalex/01_metadata_replication_language_openalex_crossref_semanticscholar_we_a_0010_openalex.json
2026-05-05_individual_replication_vast_search_batch002	01_metadata_replication_language_openalex_crossref_semanticscholar__we_a_0010__openalex	openalex	8	A genome-wide linkage and association scan reveals novel loci for autism	10.1038/nature08490	2009	Nature	https://openalex.org/W2109529720	0	no_relation_evidence		0	False	steps/searches/figure1/individualrepsearch_api_batch002/raw/openalex/01_metadata_replication_language_openalex_crossref_semanticscholar_we_a_0010_openalex.json
2026-05-05_individual_replication_vast_search_batch002	01_metadata_replication_language_openalex_crossref_semanticscholar__we_a_0010__openalex	openalex	9	Priming Intelligent Behavior: An Elusive Phenomenon	10.1371/journal.pone.0056515	2013	PLoS ONE	https://openalex.org/W1985877093	0	no_relation_evidence		1	False	steps/searches/figure1/individualrepsearch_api_batch002/raw/openalex/01_metadata_replication_language_openalex_crossref_semanticscholar_we_a_0010_openalex.json
2026-05-05_individual_replication_vast_search_batch002	01_metadata_replication_language_openalex_crossref_semanticscholar__we_a_0010__openalex	openalex	10	Replication of genome-wide association studies (GWAS) loci for fasting plasma glucose in African-Americans	10.1007/s00125-010-2002-7	2010	Diabetologia	https://openalex.org/W2151363231	5	title_exact_replication	Replication of genome-wide association studies (GWAS) loci for fasting plasma glucose in African-Americans	0	False	steps/searches/figure1/individualrepsearch_api_batch002/raw/openalex/01_metadata_replication_language_openalex_crossref_semanticscholar_we_a_0010_openalex.json
2026-05-05_individual_replication_vast_search_batch002	01_metadata_replication_language_openalex_crossref_semanticscholar__we_a_0010__openalex	openalex	11	Automating creativity assessment with SemDis: An open platform for computing semantic distance	10.3758/s13428-020-01453-w	2020	Behavior Research Methods	https://openalex.org/W3081924543	0	no_relation_evidence		1	False	steps/searches/figure1/individualrepsearch_api_batch002/raw/openalex/01_metadata_replication_language_openalex_crossref_semanticscholar_we_a_0010_openalex.json
2026-05-05_individual_replication_vast_search_batch002	01_metadata_replication_language_openalex_crossref_semanticscholar__we_a_0010__openalex	openalex	12	Efficient Replication of over 180 Genetic Associations with Self-Reported Medical Data	10.1371/journal.pone.0023473	2011	PLoS ONE	https://openalex.org/W2130260471	5	title_exact_replication	Efficient Replication of over 180 Genetic Associations with Self-Reported Medical Data	0	False	steps/searches/figure1/individualrepsearch_api_batch002/raw/openalex/01_metadata_replication_language_openalex_crossref_semanticscholar_we_a_0010_openalex.json
2026-05-05_individual_replication_vast_search_batch002	01_metadata_replication_language_openalex_crossref_semanticscholar__we_a_0010__crossref	crossref	1	We Don't Replicate Academic Accounting Research Or Do We?	10.2139/ssrn.2548839	2014	SSRN Electronic Journal	https://doi.org/10.2139/ssrn.2548839	0	no_relation_evidence		0	False	steps/searches/figure1/individualrepsearch_api_batch002/raw/crossref/01_metadata_replication_language_openalex_crossref_semanticscholar_we_a_0010_crossref.json
2026-05-05_individual_replication_vast_search_batch002	01_metadata_replication_language_openalex_crossref_semanticscholar__we_a_0010__crossref	crossref	2	We Don't Replicate Accounting Research—Or Do We?	10.1111/1911-3846.12102	2014	Contemporary Accounting Research	https://doi.org/10.1111/1911-3846.12102	0	no_relation_evidence		0	False	steps/searches/figure1/individualrepsearch_api_batch002/raw/crossref/01_metadata_replication_language_openalex_crossref_semanticscholar_we_a_0010_crossref.json
2026-05-05_individual_replication_vast_search_batch002	01_metadata_replication_language_openalex_crossref_semanticscholar__we_a_0010__crossref	crossref	3	The Size Effect: Should We Care?	10.5791/0882-2875-39.1.2	2020	Business Valuation Review	https://doi.org/10.5791/0882-2875-39.1.2	0	no_relation_evidence		0	False	steps/searches/figure1/individualrepsearch_api_batch002/raw/crossref/01_metadata_replication_language_openalex_crossref_semanticscholar_we_a_0010_crossref.json
2026-05-05_individual_replication_vast_search_batch002	01_metadata_replication_language_openalex_crossref_semanticscholar__we_a_0010__crossref	crossref	4	Comment to the paper: To replicate or not to replicate, or when did we start to ignore the concept of statistical power?	10.1016/j.foodqual.2019.01.004	2020	Food Quality and Preference	https://doi.org/10.1016/j.foodqual.2019.01.004	0	no_relation_evidence		0	False	steps/searches/figure1/individualrepsearch_api_batch002/raw/crossref/01_metadata_replication_language_openalex_crossref_semanticscholar_we_a_0010_crossref.json
2026-05-05_individual_replication_vast_search_batch002	01_metadata_replication_language_openalex_crossref_semanticscholar__we_a_0010__crossref	crossref	5	Editorial Comment on “Effect of tumor size on recurrence-free survival of upper tract urothelial carcinoma following surgical resection”	10.1016/j.urolonc.2014.03.009	2014	Urologic Oncology: Seminars and Original Investigations	https://doi.org/10.1016/j.urolonc.2014.03.009	-5	same_data_or_review_negative		0	True	steps/searches/figure1/individualrepsearch_api_batch002/raw/crossref/01_metadata_replication_language_openalex_crossref_semanticscholar_we_a_0010_crossref.json
2026-05-05_individual_replication_vast_search_batch002	01_metadata_replication_language_openalex_crossref_semanticscholar__we_a_0010__crossref	crossref	6	To replicate or not to replicate, or when did we start to ignore the concept of statistical power?	10.1016/j.foodqual.2019.01.005	2020	Food Quality and Preference	https://doi.org/10.1016/j.foodqual.2019.01.005	0	no_relation_evidence		0	False	steps/searches/figure1/individualrepsearch_api_batch002/raw/crossref/01_metadata_replication_language_openalex_crossref_semanticscholar_we_a_0010_crossref.json
2026-05-05_individual_replication_vast_search_batch002	01_metadata_replication_language_openalex_crossref_semanticscholar__we_a_0010__crossref	crossref	7	Comment on Meyners, Carr and Hasted “To replicate or not to replicate, or when did we start to ignore the concept of statistical power?”	10.1016/j.foodqual.2019.01.003	2020	Food Quality and Preference	https://doi.org/10.1016/j.foodqual.2019.01.003	0	no_relation_evidence		0	False	steps/searches/figure1/individualrepsearch_api_batch002/raw/crossref/01_metadata_replication_language_openalex_crossref_semanticscholar_we_a_0010_crossref.json
2026-05-05_individual_replication_vast_search_batch002	01_metadata_replication_language_openalex_crossref_semanticscholar__we_a_0010__crossref	crossref	8	Commentary on Meyners, Carr, and Hasted: “To replicate or not to replicate, or when did we start to ignore the concept of statistical power?”	10.1016/j.foodqual.2019.02.009	2020	Food Quality and Preference	https://doi.org/10.1016/j.foodqual.2019.02.009	-5	same_data_or_review_negative		0	True	steps/searches/figure1/individualrepsearch_api_batch002/raw/crossref/01_metadata_replication_language_openalex_crossref_semanticscholar_we_a_0010_crossref.json
2026-05-05_individual_replication_vast_search_batch002	01_metadata_replication_language_openalex_crossref_semanticscholar__we_a_0010__crossref	crossref	9	Can we improve upon an attempted headcount?	10.1007/bf02712618	2001	Society	https://doi.org/10.1007/bf02712618	0	no_relation_evidence		0	False	steps/searches/figure1/individualrepsearch_api_batch002/raw/crossref/01_metadata_replication_language_openalex_crossref_semanticscholar_we_a_0010_crossref.json
2026-05-05_individual_replication_vast_search_batch002	01_metadata_replication_language_openalex_crossref_semanticscholar__we_a_0010__crossref	crossref	10	Lot-to-lot reagent verification: Effect of sample size and replicate measurement on linear regression approaches	10.1016/j.cca.2022.07.006	2022	Clinica Chimica Acta	https://doi.org/10.1016/j.cca.2022.07.006	0	no_relation_evidence		1	False	steps/searches/figure1/individualrepsearch_api_batch002/raw/crossref/01_metadata_replication_language_openalex_crossref_semanticscholar_we_a_0010_crossref.json
2026-05-05_individual_replication_vast_search_batch002	01_metadata_replication_language_openalex_crossref_semanticscholar__we_a_0010__crossref	crossref	11	Commentary on “To replicate or not to replicate, or when did we start to ignore the concept of statistical power?” by Meyners, Carr and Hasted	10.1016/j.foodqual.2019.01.022	2020	Food Quality and Preference	https://doi.org/10.1016/j.foodqual.2019.01.022	-5	same_data_or_review_negative		0	True	steps/searches/figure1/individualrepsearch_api_batch002/raw/crossref/01_metadata_replication_language_openalex_crossref_semanticscholar_we_a_0010_crossref.json
2026-05-05_individual_replication_vast_search_batch002	01_metadata_replication_language_openalex_crossref_semanticscholar__we_a_0010__crossref	crossref	12	2008 Whitmore Lecture: Radical prostatectomy—where we were and where we are going	10.1016/j.urolonc.2008.07.022	2009	Urologic Oncology: Seminars and Original Investigations	https://doi.org/10.1016/j.urolonc.2008.07.022	0	no_relation_evidence		0	False	steps/searches/figure1/individualrepsearch_api_batch002/raw/crossref/01_metadata_replication_language_openalex_crossref_semanticscholar_we_a_0010_crossref.json
2026-05-05_individual_replication_vast_search_batch002	01_metadata_replication_language_openalex_crossref_semanticscholar__has__0011__crossref	crossref	1	Edmonton's islet success has indeed been replicated elsewhere	10.1016/s0140-6736(03)14526-6	2003	The Lancet	https://doi.org/10.1016/s0140-6736(03)14526-6	0	no_relation_evidence		0	False	steps/searches/figure1/individualrepsearch_api_batch002/raw/crossref/01_metadata_replication_language_openalex_crossref_semanticscholar_has_0011_crossref.json
2026-05-05_individual_replication_vast_search_batch002	01_metadata_replication_language_openalex_crossref_semanticscholar__has__0011__crossref	crossref	2	Has the national fall in smoking rate in Ireland been replicated in cancer patients? a 5-year report	10.1093/eurpub/ckab165.232	2021	European Journal of Public Health	https://doi.org/10.1093/eurpub/ckab165.232	0	no_relation_evidence		1	False	steps/searches/figure1/individualrepsearch_api_batch002/raw/crossref/01_metadata_replication_language_openalex_crossref_semanticscholar_has_0011_crossref.json
2026-05-05_individual_replication_vast_search_batch002	01_metadata_replication_language_openalex_crossref_semanticscholar__has__0011__crossref	crossref	3	Reconsidering Social Work 100 Years Post-Flexner: Where Are We Now, Where Are We Headed, What Has Been Gained, What Has Been Lost?	10.1080/10437797.2016.1192932	2016	Journal of Social Work Education	https://doi.org/10.1080/10437797.2016.1192932	0	no_relation_evidence		0	False	steps/searches/figure1/individualrepsearch_api_batch002/raw/crossref/01_metadata_replication_language_openalex_crossref_semanticscholar_has_0011_crossref.json
2026-05-05_individual_replication_vast_search_batch002	01_metadata_replication_language_openalex_crossref_semanticscholar__has__0011__crossref	crossref	4	"The ""United Nations World Drug Report 2023 "" has been announced..."	10.32739/uha.id.44505	2024	üha	https://doi.org/10.32739/uha.id.44505	0	no_relation_evidence		0	False	steps/searches/figure1/individualrepsearch_api_batch002/raw/crossref/01_metadata_replication_language_openalex_crossref_semanticscholar_has_0011_crossref.json
2026-05-05_individual_replication_vast_search_batch002	01_metadata_replication_language_openalex_crossref_semanticscholar__has__0011__crossref	crossref	5	Has the National Fall in Smoking Rates in Ireland Been Replicated in Cancer Patients? A 5-Year Report	10.3390/ijerph19042348	2022	International Journal of Environmental Research and Public Health	https://doi.org/10.3390/ijerph19042348	0	no_relation_evidence		1	False	steps/searches/figure1/individualrepsearch_api_batch002/raw/crossref/01_metadata_replication_language_openalex_crossref_semanticscholar_has_0011_crossref.json
2026-05-05_individual_replication_vast_search_batch002	01_metadata_replication_language_openalex_crossref_semanticscholar__has__0011__crossref	crossref	6	Report shows health has been underutilised in Nigeria	10.1038/d44148-022-00045-4	2022	Nature Africa	https://doi.org/10.1038/d44148-022-00045-4	0	no_relation_evidence		0	False	steps/searches/figure1/individualrepsearch_api_batch002/raw/crossref/01_metadata_replication_language_openalex_crossref_semanticscholar_has_0011_crossref.json
2026-05-05_individual_replication_vast_search_batch002	01_metadata_replication_language_openalex_crossref_semanticscholar__has__0011__crossref	crossref	7	Flu vaccination coverage has been declining in Europe, WHO report reveals	10.1211/pj.2018.20204375	2018	The Pharmaceutical Journal	https://doi.org/10.1211/pj.2018.20204375	0	no_relation_evidence		0	False	steps/searches/figure1/individualrepsearch_api_batch002/raw/crossref/01_metadata_replication_language_openalex_crossref_semanticscholar_has_0011_crossref.json
2026-05-05_individual_replication_vast_search_batch002	01_metadata_replication_language_openalex_crossref_semanticscholar__has__0011__crossref	crossref	8	H5N1: Has there been human-to-human transmission, and do we have a vaccine?	10.1136/bmj.p510	2023	BMJ	https://doi.org/10.1136/bmj.p510	0	no_relation_evidence		0	False	steps/searches/figure1/individualrepsearch_api_batch002/raw/crossref/01_metadata_replication_language_openalex_crossref_semanticscholar_has_0011_crossref.json
2026-05-05_individual_replication_vast_search_batch002	01_metadata_replication_language_openalex_crossref_semanticscholar__has__0011__crossref	crossref	9	Has the Lorentz-covariant electromagnetic force law been directly tested experimentally?	10.1007/bf00665730	1993	Foundations of Physics Letters	https://doi.org/10.1007/bf00665730	0	no_relation_evidence		0	False	steps/searches/figure1/individualrepsearch_api_batch002/raw/crossref/01_metadata_replication_language_openalex_crossref_semanticscholar_has_0011_crossref.json
2026-05-05_individual_replication_vast_search_batch002	01_metadata_replication_language_openalex_crossref_semanticscholar__has__0011__crossref	crossref	10	Nicotine Replacement Therapy	10.2165/00003495-199345020-00001	1993	Drugs	https://doi.org/10.2165/00003495-199345020-00001	0	no_relation_evidence		0	False	steps/searches/figure1/individualrepsearch_api_batch002/raw/crossref/01_metadata_replication_language_openalex_crossref_semanticscholar_has_0011_crossref.json
2026-05-05_individual_replication_vast_search_batch002	01_metadata_replication_language_openalex_crossref_semanticscholar__has__0011__crossref	crossref	11	How Can We Determine if Seepage Water Has Been Treated?	10.1002/j.1551-8701.2009.tb02966.x	2009	Opflow	https://doi.org/10.1002/j.1551-8701.2009.tb02966.x	0	no_relation_evidence		0	False	steps/searches/figure1/individualrepsearch_api_batch002/raw/crossref/01_metadata_replication_language_openalex_crossref_semanticscholar_has_0011_crossref.json
2026-05-05_individual_replication_vast_search_batch002	01_metadata_replication_language_openalex_crossref_semanticscholar__has__0011__crossref	crossref	12	Article has been redacted	10.5032/jae.2003.03012	2003	Journal of Agricultural Education	https://doi.org/10.5032/jae.2003.03012	0	no_relation_evidence		0	False	steps/searches/figure1/individualrepsearch_api_batch002/raw/crossref/01_metadata_replication_language_openalex_crossref_semanticscholar_has_0011_crossref.json
2026-05-05_individual_replication_vast_search_batch002	01_metadata_replication_language_openalex_crossref_semanticscholar__not__0012__openalex	openalex	1	Episodic memory improvements due to noninvasive stimulation targeting the cortical–hippocampal network: A replication and extension experiment	10.1002/brb3.1393	2019	Brain and Behavior	https://openalex.org/W2978032884	4	abstract_direct_replication	ed after the stimulation regimen via cued recall (Wang et al., Science, 2014, 345, 1054). This finding has not yet been directly replicated. Furthermore, evidence for long-lasting effects of stimulation on paired-associate learning was obtained by analyzing relatively small subsamples (Wang & Voss, Hippocampus, 2015, 25, 877) and requires further evaluation	1	False	steps/searches/figure1/individualrepsearch_api_batch002/raw/openalex/01_metadata_replication_language_openalex_crossref_semanticscholar_not_0012_openalex.json
2026-05-05_individual_replication_vast_search_batch002	01_metadata_replication_language_openalex_crossref_semanticscholar__not__0012__openalex	openalex	2	The effect of animacy on structural Priming: A replication of Bock, Loebell and Morey (1992)	10.1016/j.jml.2022.104354	2022	Journal of Memory and Language	https://openalex.org/W4289766339	5	title_exact_replication	The effect of animacy on structural Priming: A replication of Bock, Loebell and Morey (1992)	0	False	steps/searches/figure1/individualrepsearch_api_batch002/raw/openalex/01_metadata_replication_language_openalex_crossref_semanticscholar_not_0012_openalex.json
2026-05-05_individual_replication_vast_search_batch002	01_metadata_replication_language_openalex_crossref_semanticscholar__not__0012__openalex	openalex	3	Does Social Exclusion Improve Detection of Real and Fake Smiles? A Replication Study	10.3389/fpsyg.2021.626087	2021	Frontiers in Psychology	https://openalex.org/W3128143484	4	abstract_direct_replication	r in correctly categorizing a target person's smile as real or fake. Although highly cited, this finding has never been directly replicated. The present study aimed to fill that gap. 201 participants (79.1% female) were randomly assigned to a social exclusion, social inclusion or control condition. Next, participants watched 20 videos of smiling persons and	1	False	steps/searches/figure1/individualrepsearch_api_batch002/raw/openalex/01_metadata_replication_language_openalex_crossref_semanticscholar_not_0012_openalex.json
2026-05-05_individual_replication_vast_search_batch002	01_metadata_replication_language_openalex_crossref_semanticscholar__not__0012__openalex	openalex	4	Recall of Speech is Impaired by Subsequent Masking Noise: A Replication of Rabbitt (1968) Experiment 2	10.1080/25742442.2021.1896908	2020	Auditory Perception & Cognition	https://openalex.org/W3122990348	5	title_exact_replication	Recall of Speech is Impaired by Subsequent Masking Noise: A Replication of Rabbitt (1968) Experiment 2	1	False	steps/searches/figure1/individualrepsearch_api_batch002/raw/openalex/01_metadata_replication_language_openalex_crossref_semanticscholar_not_0012_openalex.json
2026-05-05_individual_replication_vast_search_batch002	01_metadata_replication_language_openalex_crossref_semanticscholar__not__0012__openalex	openalex	5	On the scientific superiority of conceptual replications for scientific progress	10.1016/j.jesp.2015.10.002	2016	Journal of Experimental Social Psychology	https://openalex.org/W2303311849	0	no_relation_evidence		0	False	steps/searches/figure1/individualrepsearch_api_batch002/raw/openalex/01_metadata_replication_language_openalex_crossref_semanticscholar_not_0012_openalex.json
2026-05-05_individual_replication_vast_search_batch002	01_metadata_replication_language_openalex_crossref_semanticscholar__not__0012__openalex	openalex	6	Two Failures to Replicate High-Performance-Goal Priming Effects	10.1371/journal.pone.0072467	2013	PLoS ONE	https://openalex.org/W2156734073	4	abstract_direct_replication	. Because the paper has been cited well over 1100 times, an attempt to replicate its findings would seem warranted. Two direct replication attempts were performed. Results from the first experiment (n = 98) found no effect of priming, and the means were in the opposite direction from those reported by Bargh and colleagues. The second experiment followed up	0	False	steps/searches/figure1/individualrepsearch_api_batch002/raw/openalex/01_metadata_replication_language_openalex_crossref_semanticscholar_not_0012_openalex.json
2026-05-05_individual_replication_vast_search_batch002	01_metadata_replication_language_openalex_crossref_semanticscholar__not__0012__openalex	openalex	7	Priming of Social Distance? Failure to Replicate Effects on Social and Food Judgments	10.1371/journal.pone.0042510	2012	PLoS ONE	https://openalex.org/W2106777508	5	title_exact_replication	Priming of Social Distance? Failure to Replicate Effects on Social and Food Judgments	1	False	steps/searches/figure1/individualrepsearch_api_batch002/raw/openalex/01_metadata_replication_language_openalex_crossref_semanticscholar_not_0012_openalex.json
2026-05-05_individual_replication_vast_search_batch002	01_metadata_replication_language_openalex_crossref_semanticscholar__not__0012__openalex	openalex	8	Large-scale replication study reveals a limit on probabilistic prediction in language comprehension	10.7554/elife.33468	2018	eLife	https://openalex.org/W2796350793	0	no_relation_evidence		0	False	steps/searches/figure1/individualrepsearch_api_batch002/raw/openalex/01_metadata_replication_language_openalex_crossref_semanticscholar_not_0012_openalex.json
2026-05-05_individual_replication_vast_search_batch002	01_metadata_replication_language_openalex_crossref_semanticscholar__not__0012__openalex	openalex	9	Crowdsourcing hypothesis tests: Making transparent how design choices shape research results.	10.1037/bul0000220	2020	Psychological Bulletin	https://openalex.org/W2991191531	-5	same_data_or_review_negative		1	True	steps/searches/figure1/individualrepsearch_api_batch002/raw/openalex/01_metadata_replication_language_openalex_crossref_semanticscholar_not_0012_openalex.json
2026-05-05_individual_replication_vast_search_batch002	01_metadata_replication_language_openalex_crossref_semanticscholar__not__0012__openalex	openalex	10	No evidence that priming analytic thinking reduces belief in conspiracy theories: A Registered Report of high-powered direct replications of Study 2 and Study 4 from	10.1016/j.jesp.2023.104549	2023	Journal of Experimental Social Psychology	https://openalex.org/W4387693592	0	no_relation_evidence		0	False	steps/searches/figure1/individualrepsearch_api_batch002/raw/openalex/01_metadata_replication_language_openalex_crossref_semanticscholar_not_0012_openalex.json
2026-05-05_individual_replication_vast_search_batch002	01_metadata_replication_language_openalex_crossref_semanticscholar__not__0012__openalex	openalex	11	A cross‐cultural replication of “citizens' blame of politicians for public service failure: Experimental evidence about blame reduction through delegation and contracting”	10.1111/puar.13845	2024	Public Administration Review	https://openalex.org/W4398229317	5	title_exact_replication	A cross‐cultural replication of “citizens' blame of politicians for public service failure: Experimental evidence about blame reduction through delegation and contracting”	0	False	steps/searches/figure1/individualrepsearch_api_batch002/raw/openalex/01_metadata_replication_language_openalex_crossref_semanticscholar_not_0012_openalex.json
