run_id	query_id	surface	rank	title	doi	year	journal	url	relation_score	relation_evidence_type	relation_quote	value_score	negative_flag	raw_record_path
2026-05-05_individual_replication_vast_search_batch002	02_open_full_text_value_language_pmc_plos_europepmc_full_text__original__0020__europepmc	europepmc	3	The Effects of Augmented Feedback, Focus of Attention, and Monetary Reward on Vertical Jump Height: A Replication Study.	10.70252/nkky8370	2025		https://doi.org/10.70252/nkky8370	4	abstract_failed_replication	study demonstrated that each combination of AF, EF, and RE did not affect vertical jump performance. Therefore, we were unable to replicate the findings from the original study in this close replication.	2	False	steps/searches/figure1/individualrepsearch_api_batch002/raw/europepmc/02_open_full_text_value_language_pmc_plos_europepmc_full_text_original_0020_europepmc.json
2026-05-05_individual_replication_vast_search_batch002	02_open_full_text_value_language_pmc_plos_europepmc_full_text__original__0020__europepmc	europepmc	4	Examining the replicability of online experiments selected by a decision market.	10.1038/s41562-024-02062-9	2025		https://doi.org/10.1038/s41562-024-02062-9	0	no_relation_evidence		1	False	steps/searches/figure1/individualrepsearch_api_batch002/raw/europepmc/02_open_full_text_value_language_pmc_plos_europepmc_full_text_original_0020_europepmc.json
2026-05-05_individual_replication_vast_search_batch002	02_open_full_text_value_language_pmc_plos_europepmc_full_text__original__0020__europepmc	europepmc	5	A scoping review on metrics to quantify reproducibility: a multitude of questions leads to a multitude of metrics.	10.1098/rsos.242076	2025		https://doi.org/10.1098/rsos.242076	0	no_relation_evidence		0	False	steps/searches/figure1/individualrepsearch_api_batch002/raw/europepmc/02_open_full_text_value_language_pmc_plos_europepmc_full_text_original_0020_europepmc.json
2026-05-05_individual_replication_vast_search_batch002	02_open_full_text_value_language_pmc_plos_europepmc_full_text__original__0020__europepmc	europepmc	6	The Replication Database: Documenting the Replicability of Psychological Science.	10.5334/jopd.101	2024		https://doi.org/10.5334/jopd.101	0	no_relation_evidence		0	False	steps/searches/figure1/individualrepsearch_api_batch002/raw/europepmc/02_open_full_text_value_language_pmc_plos_europepmc_full_text_original_0020_europepmc.json
2026-05-05_individual_replication_vast_search_batch002	02_open_full_text_value_language_pmc_plos_europepmc_full_text__original__0020__europepmc	europepmc	7	Reflections on Conducting a Large Replication Project in Sports and Exercise Science.	10.1007/s40279-025-02200-x	2025		https://doi.org/10.1007/s40279-025-02200-x	0	no_relation_evidence		0	False	steps/searches/figure1/individualrepsearch_api_batch002/raw/europepmc/02_open_full_text_value_language_pmc_plos_europepmc_full_text_original_0020_europepmc.json
2026-05-05_individual_replication_vast_search_batch002	02_open_full_text_value_language_pmc_plos_europepmc_full_text__original__0020__europepmc	europepmc	8	Meta-regression to explain shrinkage and heterogeneity in large-scale replication projects.	10.1371/journal.pone.0327799	2025		https://doi.org/10.1371/journal.pone.0327799	-5	same_data_or_review_negative		1	True	steps/searches/figure1/individualrepsearch_api_batch002/raw/europepmc/02_open_full_text_value_language_pmc_plos_europepmc_full_text_original_0020_europepmc.json
2026-05-05_individual_replication_vast_search_batch002	02_open_full_text_value_language_pmc_plos_europepmc_full_text__original__0020__europepmc	europepmc	9	The assessment of replicability using the sum of <i>p</i>-values.	10.1098/rsos.240149	2024		https://doi.org/10.1098/rsos.240149	-5	same_data_or_review_negative		1	True	steps/searches/figure1/individualrepsearch_api_batch002/raw/europepmc/02_open_full_text_value_language_pmc_plos_europepmc_full_text_original_0020_europepmc.json
2026-05-05_individual_replication_vast_search_batch002	02_open_full_text_value_language_pmc_plos_europepmc_full_text__original__0020__europepmc	europepmc	10	Eleven years of student replication projects provide evidence on the correlates of replicability in psychology.	10.1098/rsos.231240	2023		https://doi.org/10.1098/rsos.231240	4	abstract_failed_replication	ts that are robust enough to support theory construction and extension. Yet in psychology, some prominent findings have failed to replicate, and large-scale studies suggest replicability issues are widespread. The identification of predictors of replication success is limited by the difficulty of conducting large samples of independent replication experimen	1	False	steps/searches/figure1/individualrepsearch_api_batch002/raw/europepmc/02_open_full_text_value_language_pmc_plos_europepmc_full_text_original_0020_europepmc.json
2026-05-05_individual_replication_vast_search_batch002	02_open_full_text_value_language_pmc_plos_europepmc_full_text__original__0020__europepmc	europepmc	11	Power priors for replication studies.	10.1007/s11749-023-00888-5	2024		https://doi.org/10.1007/s11749-023-00888-5	0	no_relation_evidence		0	False	steps/searches/figure1/individualrepsearch_api_batch002/raw/europepmc/02_open_full_text_value_language_pmc_plos_europepmc_full_text_original_0020_europepmc.json
2026-05-05_individual_replication_vast_search_batch002	02_open_full_text_value_language_pmc_plos_europepmc_full_text__original__0020__europepmc	europepmc	12	Proposal of a Selection Protocol for Replication of Studies in Sports and Exercise Science.	10.1007/s40279-022-01749-1	2023		https://doi.org/10.1007/s40279-022-01749-1	5	title_exact_replication	Proposal of a Selection Protocol for Replication of Studies in Sports and Exercise Science.	0	True	steps/searches/figure1/individualrepsearch_api_batch002/raw/europepmc/02_open_full_text_value_language_pmc_plos_europepmc_full_text_original_0020_europepmc.json
2026-05-05_individual_replication_vast_search_batch002	02_open_full_text_value_language_pmc_plos_europepmc_full_text__original__0020__plos	plos	1	Evaluating meta-analysis as a replication success measure	10.1371/journal.pone.0308495	2024	PLOS ONE	https://doi.org/10.1371/journal.pone.0308495	-5	same_data_or_review_negative		0	True	steps/searches/figure1/individualrepsearch_api_batch002/raw/plos/02_open_full_text_value_language_pmc_plos_europepmc_full_text_original_0020_plos.json
2026-05-05_individual_replication_vast_search_batch002	02_open_full_text_value_language_pmc_plos_europepmc_full_text__original__0020__plos	plos	2	Bayesian evaluation of effect size after replicating an original study	10.1371/journal.pone.0175302	2017	PLOS ONE	https://doi.org/10.1371/journal.pone.0175302	-5	same_data_or_review_negative		2	True	steps/searches/figure1/individualrepsearch_api_batch002/raw/plos/02_open_full_text_value_language_pmc_plos_europepmc_full_text_original_0020_plos.json
2026-05-05_individual_replication_vast_search_batch002	02_open_full_text_value_language_pmc_plos_europepmc_full_text__original__0020__plos	plos	3	Meta-regression to explain shrinkage and heterogeneity in large-scale replication projects	10.1371/journal.pone.0327799	2025	PLOS One	https://doi.org/10.1371/journal.pone.0327799	-5	same_data_or_review_negative		1	True	steps/searches/figure1/individualrepsearch_api_batch002/raw/plos/02_open_full_text_value_language_pmc_plos_europepmc_full_text_original_0020_plos.json
2026-05-05_individual_replication_vast_search_batch002	02_open_full_text_value_language_pmc_plos_europepmc_full_text__original__0020__plos	plos	4	Predicting the replicability of social science lab experiments	10.1371/journal.pone.0225826	2019	PLOS ONE	https://doi.org/10.1371/journal.pone.0225826	0	no_relation_evidence		1	False	steps/searches/figure1/individualrepsearch_api_batch002/raw/plos/02_open_full_text_value_language_pmc_plos_europepmc_full_text_original_0020_plos.json
2026-05-05_individual_replication_vast_search_batch002	02_open_full_text_value_language_pmc_plos_europepmc_full_text__original__0020__plos	plos	5	Review and further developments in statistical corrections for Winner’s Curse in genetic association studies	10.1371/journal.pgen.1010546	2023	PLOS Genetics	https://doi.org/10.1371/journal.pgen.1010546	0	no_relation_evidence		0	False	steps/searches/figure1/individualrepsearch_api_batch002/raw/plos/02_open_full_text_value_language_pmc_plos_europepmc_full_text_original_0020_plos.json
2026-05-05_individual_replication_vast_search_batch002	02_open_full_text_value_language_pmc_plos_europepmc_full_text__original__0020__plos	plos	6	Prediction Interval: What to Expect When You’re Expecting … A Replication	10.1371/journal.pone.0162874	2016	PLOS ONE	https://doi.org/10.1371/journal.pone.0162874	0	no_relation_evidence		1	False	steps/searches/figure1/individualrepsearch_api_batch002/raw/plos/02_open_full_text_value_language_pmc_plos_europepmc_full_text_original_0020_plos.json
2026-05-05_individual_replication_vast_search_batch002	02_open_full_text_value_language_pmc_plos_europepmc_full_text__original__0020__plos	plos	7	Can cancer researchers accurately judge whether preclinical reports will reproduce?	10.1371/journal.pbio.2002212	2017	PLOS Biology	https://doi.org/10.1371/journal.pbio.2002212	0	no_relation_evidence		1	False	steps/searches/figure1/individualrepsearch_api_batch002/raw/plos/02_open_full_text_value_language_pmc_plos_europepmc_full_text_original_0020_plos.json
2026-05-05_individual_replication_vast_search_batch002	02_open_full_text_value_language_pmc_plos_europepmc_full_text__original__0020__plos	plos	8	Testing the reproducibility of ecological studies on insect behavior in a multi-laboratory setting identifies opportunities for improving experimental rigor	10.1371/journal.pbio.3003019	2025	PLOS Biology	https://doi.org/10.1371/journal.pbio.3003019	-5	same_data_or_review_negative		1	True	steps/searches/figure1/individualrepsearch_api_batch002/raw/plos/02_open_full_text_value_language_pmc_plos_europepmc_full_text_original_0020_plos.json
2026-05-05_individual_replication_vast_search_batch002	02_open_full_text_value_language_pmc_plos_europepmc_full_text__original__0020__plos	plos	9	Data sharing upon request and statistical consistency errors in psychology: A replication of Wicherts, Bakker and Molenaar (2011)	10.1371/journal.pone.0284243	2023	PLOS ONE	https://doi.org/10.1371/journal.pone.0284243	5	title_exact_replication	Data sharing upon request and statistical consistency errors in psychology: A replication of Wicherts, Bakker and Molenaar (2011)	0	True	steps/searches/figure1/individualrepsearch_api_batch002/raw/plos/02_open_full_text_value_language_pmc_plos_europepmc_full_text_original_0020_plos.json
2026-05-05_individual_replication_vast_search_batch002	02_open_full_text_value_language_pmc_plos_europepmc_full_text__original__0021__europepmc	europepmc	1	Predictable changes within fast-paced sound sequences do not elicit the mismatch negativity: A conceptual in-class replication study.	10.1016/j.ijpsycho.2026.113330	2026		https://doi.org/10.1016/j.ijpsycho.2026.113330	4	abstract_direct_replication	at sufficiently fast stimulus onset asynchronies (SOAs) but deviants presented in the random condition elicited an MMN. We replicated a subset of the original conditions in a sample of 25 participants. Although we had changed some aspects of the original design we found frequentist and Bayesian statistical evidence in favor of ERP-differences in the p	1	False	steps/searches/figure1/individualrepsearch_api_batch002/raw/europepmc/02_open_full_text_value_language_pmc_plos_europepmc_full_text_original_0021_europepmc.json
2026-05-05_individual_replication_vast_search_batch002	02_open_full_text_value_language_pmc_plos_europepmc_full_text__original__0021__europepmc	europepmc	2	A scoping review on metrics to quantify reproducibility: a multitude of questions leads to a multitude of metrics.	10.1098/rsos.242076	2025		https://doi.org/10.1098/rsos.242076	0	no_relation_evidence		0	False	steps/searches/figure1/individualrepsearch_api_batch002/raw/europepmc/02_open_full_text_value_language_pmc_plos_europepmc_full_text_original_0021_europepmc.json
2026-05-05_individual_replication_vast_search_batch002	02_open_full_text_value_language_pmc_plos_europepmc_full_text__original__0021__europepmc	europepmc	3	Epigenetic signatures of different types of childhood maltreatment in a high-risk sample: a preregistered replication study	10.31234/osf.io/9j2v7_v1	2025		https://doi.org/10.31234/osf.io/9j2v7_v1	5	title_exact_replication	Epigenetic signatures of different types of childhood maltreatment in a high-risk sample: a preregistered replication study	1	False	steps/searches/figure1/individualrepsearch_api_batch002/raw/europepmc/02_open_full_text_value_language_pmc_plos_europepmc_full_text_original_0021_europepmc.json
2026-05-05_individual_replication_vast_search_batch002	02_open_full_text_value_language_pmc_plos_europepmc_full_text__original__0021__europepmc	europepmc	4	Reflections on Conducting a Large Replication Project in Sports and Exercise Science.	10.1007/s40279-025-02200-x	2025		https://doi.org/10.1007/s40279-025-02200-x	0	no_relation_evidence		0	False	steps/searches/figure1/individualrepsearch_api_batch002/raw/europepmc/02_open_full_text_value_language_pmc_plos_europepmc_full_text_original_0021_europepmc.json
2026-05-05_individual_replication_vast_search_batch002	02_open_full_text_value_language_pmc_plos_europepmc_full_text__original__0021__europepmc	europepmc	5	Meta-regression to explain shrinkage and heterogeneity in large-scale replication projects.	10.1371/journal.pone.0327799	2025		https://doi.org/10.1371/journal.pone.0327799	-5	same_data_or_review_negative		1	True	steps/searches/figure1/individualrepsearch_api_batch002/raw/europepmc/02_open_full_text_value_language_pmc_plos_europepmc_full_text_original_0021_europepmc.json
2026-05-05_individual_replication_vast_search_batch002	02_open_full_text_value_language_pmc_plos_europepmc_full_text__original__0021__europepmc	europepmc	6	Examining the associations between manic symptoms and cognitive performance in bipolar disorders: evidence from a cross-sectional replication study in the FACE-BD cohort.	10.1186/s40345-026-00420-2	2026		https://doi.org/10.1186/s40345-026-00420-2	4	abstract_failed_replication	and executive performance in the bivariable models nor after adjusting for covariates in 2,739 adults with BD. We were unable to replicate the findings reported by Koenders and collaborators. The low variance and mean severity of manic symptoms in our sample may partly explain the absence of significant associations. Our results suggest that subclinical hy	1	False	steps/searches/figure1/individualrepsearch_api_batch002/raw/europepmc/02_open_full_text_value_language_pmc_plos_europepmc_full_text_original_0021_europepmc.json
2026-05-05_individual_replication_vast_search_batch002	02_open_full_text_value_language_pmc_plos_europepmc_full_text__original__0021__europepmc	europepmc	7	Shared neural representation between motor execution and kinesthetic imagery in the primary motor cortex.	10.1162/imag.a.1141	2026		https://doi.org/10.1162/imag.a.1141	0	no_relation_evidence		1	False	steps/searches/figure1/individualrepsearch_api_batch002/raw/europepmc/02_open_full_text_value_language_pmc_plos_europepmc_full_text_original_0021_europepmc.json
2026-05-05_individual_replication_vast_search_batch002	02_open_full_text_value_language_pmc_plos_europepmc_full_text__original__0021__europepmc	europepmc	8	Do infants use cues of saliva-sharing to infer close relationships? A replication of Thomas &lt;i&gt;et al&lt;/i&gt;. (2022).	10.1098/rsos.240229	2025		https://doi.org/10.1098/rsos.240229	5	title_exact_replication	Do infants use cues of saliva-sharing to infer close relationships? A replication of Thomas &lt;i&gt;et al&lt;/i&gt;. (2022).	0	False	steps/searches/figure1/individualrepsearch_api_batch002/raw/europepmc/02_open_full_text_value_language_pmc_plos_europepmc_full_text_original_0021_europepmc.json
2026-05-05_individual_replication_vast_search_batch002	02_open_full_text_value_language_pmc_plos_europepmc_full_text__original__0021__europepmc	europepmc	9	Estimating the Replicability of Sports and Exercise Science Research.	10.1007/s40279-025-02201-w	2025		https://doi.org/10.1007/s40279-025-02201-w	-5	same_data_or_review_negative		1	True	steps/searches/figure1/individualrepsearch_api_batch002/raw/europepmc/02_open_full_text_value_language_pmc_plos_europepmc_full_text_original_0021_europepmc.json
2026-05-05_individual_replication_vast_search_batch002	02_open_full_text_value_language_pmc_plos_europepmc_full_text__original__0021__europepmc	europepmc	10	Neuroscience: large-scale evidence for perceptual entrainment to auditory rhythms.	10.1038/s44271-025-00315-5	2025		https://doi.org/10.1038/s44271-025-00315-5	0	no_relation_evidence		0	False	steps/searches/figure1/individualrepsearch_api_batch002/raw/europepmc/02_open_full_text_value_language_pmc_plos_europepmc_full_text_original_0021_europepmc.json
2026-05-05_individual_replication_vast_search_batch002	02_open_full_text_value_language_pmc_plos_europepmc_full_text__original__0021__europepmc	europepmc	11	Evaluating meta-analysis as a replication success measure.	10.1371/journal.pone.0308495	2024		https://doi.org/10.1371/journal.pone.0308495	-5	same_data_or_review_negative		0	True	steps/searches/figure1/individualrepsearch_api_batch002/raw/europepmc/02_open_full_text_value_language_pmc_plos_europepmc_full_text_original_0021_europepmc.json
2026-05-05_individual_replication_vast_search_batch002	02_open_full_text_value_language_pmc_plos_europepmc_full_text__original__0021__europepmc	europepmc	12	Impact of processing and analysis methodology on thalamic susceptibility assessment in multiple sclerosis.	10.1371/journal.pone.0332478	2025		https://doi.org/10.1371/journal.pone.0332478	0	no_relation_evidence		0	False	steps/searches/figure1/individualrepsearch_api_batch002/raw/europepmc/02_open_full_text_value_language_pmc_plos_europepmc_full_text_original_0021_europepmc.json
2026-05-05_individual_replication_vast_search_batch002	02_open_full_text_value_language_pmc_plos_europepmc_full_text__original__0021__plos	plos	1	Evaluating meta-analysis as a replication success measure	10.1371/journal.pone.0308495	2024	PLOS ONE	https://doi.org/10.1371/journal.pone.0308495	-5	same_data_or_review_negative		0	True	steps/searches/figure1/individualrepsearch_api_batch002/raw/plos/02_open_full_text_value_language_pmc_plos_europepmc_full_text_original_0021_plos.json
2026-05-05_individual_replication_vast_search_batch002	02_open_full_text_value_language_pmc_plos_europepmc_full_text__original__0021__plos	plos	2	Replication of influential studies on biomedical, social, behavioural and structural interventions for HIV prevention and treatment	10.1371/journal.pone.0240159	2020	PLOS ONE	https://doi.org/10.1371/journal.pone.0240159	5	title_exact_replication	Replication of influential studies on biomedical, social, behavioural and structural interventions for HIV prevention and treatment	0	False	steps/searches/figure1/individualrepsearch_api_batch002/raw/plos/02_open_full_text_value_language_pmc_plos_europepmc_full_text_original_0021_plos.json
2026-05-05_individual_replication_vast_search_batch002	02_open_full_text_value_language_pmc_plos_europepmc_full_text__original__0021__plos	plos	3	Meta-regression to explain shrinkage and heterogeneity in large-scale replication projects	10.1371/journal.pone.0327799	2025	PLOS One	https://doi.org/10.1371/journal.pone.0327799	-5	same_data_or_review_negative		1	True	steps/searches/figure1/individualrepsearch_api_batch002/raw/plos/02_open_full_text_value_language_pmc_plos_europepmc_full_text_original_0021_plos.json
2026-05-05_individual_replication_vast_search_batch002	02_open_full_text_value_language_pmc_plos_europepmc_full_text__original__0021__plos	plos	4	Probabilistic forecasting of replication studies	10.1371/journal.pone.0231416	2020	PLOS ONE	https://doi.org/10.1371/journal.pone.0231416	0	no_relation_evidence		0	False	steps/searches/figure1/individualrepsearch_api_batch002/raw/plos/02_open_full_text_value_language_pmc_plos_europepmc_full_text_original_0021_plos.json
2026-05-05_individual_replication_vast_search_batch002	02_open_full_text_value_language_pmc_plos_europepmc_full_text__original__0021__plos	plos	5	Ten simple rules for designing and conducting undergraduate replication projects	10.1371/journal.pcbi.1010957	2023	PLOS Computational Biology	https://doi.org/10.1371/journal.pcbi.1010957	0	no_relation_evidence		0	False	steps/searches/figure1/individualrepsearch_api_batch002/raw/plos/02_open_full_text_value_language_pmc_plos_europepmc_full_text_original_0021_plos.json
2026-05-05_individual_replication_vast_search_batch002	02_open_full_text_value_language_pmc_plos_europepmc_full_text__original__0021__plos	plos	6	Prediction Interval: What to Expect When You’re Expecting … A Replication	10.1371/journal.pone.0162874	2016	PLOS ONE	https://doi.org/10.1371/journal.pone.0162874	0	no_relation_evidence		1	False	steps/searches/figure1/individualrepsearch_api_batch002/raw/plos/02_open_full_text_value_language_pmc_plos_europepmc_full_text_original_0021_plos.json
2026-05-05_individual_replication_vast_search_batch002	02_open_full_text_value_language_pmc_plos_europepmc_full_text__original__0021__plos	plos	7	Can cancer researchers accurately judge whether preclinical reports will reproduce?	10.1371/journal.pbio.2002212	2017	PLOS Biology	https://doi.org/10.1371/journal.pbio.2002212	0	no_relation_evidence		1	False	steps/searches/figure1/individualrepsearch_api_batch002/raw/plos/02_open_full_text_value_language_pmc_plos_europepmc_full_text_original_0021_plos.json
2026-05-05_individual_replication_vast_search_batch002	02_open_full_text_value_language_pmc_plos_europepmc_full_text__original__0021__plos	plos	8	Next-Generation Sequencing and In Vitro Expression Study of ADAMTS13 Single Nucleotide Variants in Deep Vein Thrombosis	10.1371/journal.pone.0165665	2016	PLOS ONE	https://doi.org/10.1371/journal.pone.0165665	0	no_relation_evidence		2	False	steps/searches/figure1/individualrepsearch_api_batch002/raw/plos/02_open_full_text_value_language_pmc_plos_europepmc_full_text_original_0021_plos.json
2026-05-05_individual_replication_vast_search_batch002	02_open_full_text_value_language_pmc_plos_europepmc_full_text__original__0021__plos	plos	9	MicroRNA Expression in Abdominal and Gluteal Adipose Tissue Is Associated with mRNA Expression Levels and Partly Genetically Driven	10.1371/journal.pone.0027338	2011	PLoS ONE	https://doi.org/10.1371/journal.pone.0027338	0	no_relation_evidence		0	False	steps/searches/figure1/individualrepsearch_api_batch002/raw/plos/02_open_full_text_value_language_pmc_plos_europepmc_full_text_original_0021_plos.json
2026-05-05_individual_replication_vast_search_batch002	02_open_full_text_value_language_pmc_plos_europepmc_full_text__original__0021__plos	plos	10	A Bayesian Perspective on the Reproducibility Project: Psychology	10.1371/journal.pone.0149794	2016	PLOS ONE	https://doi.org/10.1371/journal.pone.0149794	0	no_relation_evidence		1	False	steps/searches/figure1/individualrepsearch_api_batch002/raw/plos/02_open_full_text_value_language_pmc_plos_europepmc_full_text_original_0021_plos.json
2026-05-05_individual_replication_vast_search_batch002	02_open_full_text_value_language_pmc_plos_europepmc_full_text__original__0021__plos	plos	11	The challenges of replication: A worked example of methods reproducibility using electronic health record data	10.1371/journal.pone.0326335	2025	PLOS One	https://doi.org/10.1371/journal.pone.0326335	4	abstract_direct_replication	iables. Our aim is to identify the barriers to methods reproducibility for replication studies using EHR data. Methods: We replicated a study that examined the risk of hospitalisation following a positive COVID-19 test in individuals with diabetes. Using EHR data from the NHS England’s Secure Data Environment (SDE) covering the whole of England, UK (p	0	False	steps/searches/figure1/individualrepsearch_api_batch002/raw/plos/02_open_full_text_value_language_pmc_plos_europepmc_full_text_original_0021_plos.json
2026-05-05_individual_replication_vast_search_batch002	02_open_full_text_value_language_pmc_plos_europepmc_full_text__original__0021__plos	plos	12	Impact of processing and analysis methodology on thalamic susceptibility assessment in multiple sclerosis	10.1371/journal.pone.0332478	2025	PLOS One	https://doi.org/10.1371/journal.pone.0332478	0	no_relation_evidence		0	False	steps/searches/figure1/individualrepsearch_api_batch002/raw/plos/02_open_full_text_value_language_pmc_plos_europepmc_full_text_original_0021_plos.json
2026-05-05_individual_replication_vast_search_batch002	02_open_full_text_value_language_pmc_plos_europepmc_full_text__we_replic_0022__europepmc	europepmc	1	The influence of visibility and prevalence rate on visual search.	10.1167/jov.26.2.4	2026		https://doi.org/10.1167/jov.26.2.4	0	no_relation_evidence		1	False	steps/searches/figure1/individualrepsearch_api_batch002/raw/europepmc/02_open_full_text_value_language_pmc_plos_europepmc_full_text_we_replic_0022_europepmc.json
