corpus_database_id	merge_key	merge_basis	name	record_kind	inventory_status	source_family	domain_or_field	description	why_relevant	plot_universe_ids	current_scope_roles	figure1_replication_relevance	figure2_published_relevance	figure3_prereg_relevance	discovery_source	discovery_source_path	source_key	citation_key	landing_url	raw_url	host	access_class	access_status	local_raw_paths	backing_files	staged_paths	promoted_paths	expected_rows	known_rows	known_pair_rows	known_paper_units	known_test_rows	result_fields_available	has_d_or_convertible_effect	has_n	has_replication_pair_mapping	has_prereg_or_planning_info	has_publication_links	parser_family	parser_status	blocker_codes	next_action	notes	last_seen
citation_search_openalex_bb828bb93d4f	search_title:replication_study_transcriptional_amplification_in_tumor_cells_with_elevated_c_myc	search_title	Replication Study: Transcriptional amplification in tumor cells with elevated c-Myc	candidate_corpus_or_database	discovered_search_lead	figure1_citation_search	unknown	As part of the Reproducibility Project: Cancer Biology, we published a Registered Report (Blum et al., 2015), that described how we intended to replicate selected experiments from the paper 'Transcriptional amplification in tumor cells with elevated c-Myc' (Lin et al., 2012). Here we report the results. We found overexpression of c-Myc increased total levels of RNA in P493-6 Burkitt's lymphoma cells; however, while the effect was in the same direction as the original study (Figure 3E; Lin et al., 2012), statistical significance and the size of the effect varied between the original study and the two different lots of serum tested in this replication. Digital gene expression analysis for a set of genes was also performed on P493-6 cells before and after c-Myc overexpression. Transcripts from genes that were active before c-Myc induction increased in expression following c-Myc overexpression, similar to the original study (Figure 3F; Lin et al., 2012). Transcripts from genes that were silent before c-Myc induction also increased in expression following c-Myc overexpression, while the original study concluded elevated c-Myc had no effect on silent genes (Figure 3F; Lin et al., 2012). Treating the data as paired, we found a statistically significant increase in gene expression for both active and silent genes upon c-Myc induction, with the change in gene expression greater for active genes compared to silent genes. Finally, we report meta-analyses for each result.	"Matched Figure 1 citation search query '""Reproducibility Project: Cancer Biology"" effect level data'; lead_classification=corpus_database_or_project_signal; score=14; reasons=strong_phrase:reproducibility project | pair_term:original study | data_term:data | replication_word | original_word | metadata_corpus_signal"	plot1_replication_pairs	figure1_corpus_database_candidate	yes	unknown	unknown	figure1_citation_openalex_search	steps/searches/figure1/corporasearch-citation-snowball-known-replication-corpora.json	https://openalex.org/W2782642204		https://doi.org/10.7554/elife.30274		doi.org	public_metadata	search_metadata_seen										unknown; search metadata only	unknown	unknown	yes	unknown	yes	not_assigned	not_started	metadata_only_search_hit	triage_landing_page_or_package_for_pair_table	provider=openalex; external_id=https://openalex.org/W2782642204; doi=https://doi.org/10.7554/elife.30274	2026-05-01
manual_search_manual_tracker_058c6ee82383	search_title:replicationsuccess_package_data_rprojects_ssrp_protzko2020	search_title	ReplicationSuccess package data (`RProjects`, `SSRP`, `protzko2020`)	candidate_corpus_or_database	discovered_search_lead	figure1_manual_search	unknown	Manual suggestion tracker row; status=partial / overlap cross-check; row=ReplicationSuccess package data (`RProjects`, `SSRP`, `protzko2020`) | partial / overlap cross-check | Downloaded the CRAN tarball and extracted the packaged `.rda` objects. | `RProjects`: 143 rows; `SSRP`: 21 rows; `protzko2020`: 80 rows, all with original/replication effect-size and sample-size fields. | Useful for validation and crosswalks across replication projects, but not a clean net-new corpus relative to FReD/RPP.	Matched Figure 1 manual search query 'user-suggested replication datasets'; lead_classification=corpus_database_or_project_signal; score=14; reasons=strong_phrase:replication project | pair_term:replication effect | data_term:data | replication_word | original_word | manual_tracker_status_signal	plot1_replication_pairs	figure1_corpus_database_candidate	yes	unknown	unknown	figure1_manual_manual_tracker_search	steps/searches/figure1/corporasearch-manual-expert-suggestion-tracker.json	manual_tracker_row_replicationsuccess_package_data_rprojects_ssrp_protzko2020_1b5be81d2b16		reports/corpus_suggestion_tracker.md	reports/corpus_suggestion_tracker.md	manual_tracker	public_metadata	search_metadata_seen										unknown; search metadata only	unknown	unknown	unknown	unknown	unknown	not_assigned	not_started	metadata_only_search_hit	triage_landing_page_or_package_for_pair_table	provider=manual_tracker; external_id=manual_tracker_row_replicationsuccess_package_data_rprojects_ssrp_protzko2020_1b5be81d2b16; doi=	2026-05-01
repo_search_osf_3c6cdcbee4b9	search_title:reproducibility_project_psychology_design	search_title	Reproducibility Project - Psychology: Design	candidate_corpus_or_database	needs_source_inventory	figure1_repository_search	unknown		"Matched Figure 1 repository search query '""Reproducibility Project"" coded data'; lead_classification=corpus_database_or_project_signal; score=5; reasons=strong_phrase:reproducibility project"	plot1_replication_pairs	figure1_corpus_database_candidate | figure1_candidate	yes	unknown	unknown	figure1_repository_osf_search	steps/searches/figure1/corporasearch-repository-osf-dataverse-replication-project-effect-size.json	i68pe | osf:i68pe		https://osf.io/i68pe/		osf.io	public_metadata	search_metadata_seen										unknown; search metadata only	unknown	unknown	unknown	unknown	unknown	not_assigned	not_started	metadata_only_search_hit	inventory_osf_project_files_for_pair_table_or_crosswalk	provider=osf | external_id=i68pe | doi= | review_cue=figure1_search_leads | decision=keep_in_corpora_and_databases | confidence=high | reason=This is a real Reproducibility Project: Psychology OSF project/source-family lead. It belongs in the root corpus/database inventory because it can expose multiple original/replication pair rows after file-level inventory.	2026-05-02
repo_search_osf_187d493c5dae	search_title:reproducibility_project_in_special_education	search_title	Reproducibility Project in Special Education	candidate_corpus_or_database	discovered_search_lead	figure1_repository_search	unknown	This page will contain project information, preregistrations, data, and preprints for five replication studies in special education.	"Matched Figure 1 repository search query '""Reproducibility Project"" coded data'; lead_classification=corpus_database_or_project_signal; score=14; reasons=strong_phrase:reproducibility project | strong_phrase:replication studies | data_term:data | replication_word | repository_data_surface"	plot1_replication_pairs	figure1_corpus_database_candidate	yes	unknown	unknown	figure1_repository_osf_search	steps/searches/figure1/corporasearch-repository-osf-dataverse-replication-project-effect-size.json	m2xpj		https://osf.io/m2xpj/		osf.io	public_metadata	search_metadata_seen										unknown; search metadata only	unknown	unknown	unknown	unknown	unknown	not_assigned	not_started	metadata_only_search_hit	triage_landing_page_or_package_for_pair_table	provider=osf; external_id=m2xpj; doi=	2026-05-01
manual_search_manual_tracker_85ec777fb6f4	search_title:reproducibility_project_cancer_biology	search_title	Reproducibility Project: Cancer Biology	candidate_corpus_or_database	discovered_search_lead	figure1_manual_search	unknown	Manual suggestion tracker row; status=working comparator; row=Reproducibility Project: Cancer Biology | working comparator | Used OSF API for node `e5nvr`; downloaded paper-, experiment-, and effect-level CSVs. | Effect-level data include original and replication sample sizes, test statistics, p-values, effect sizes, SEs, and CIs. | Very small biomedical replication comparator, not a main corpus.	Matched Figure 1 manual search query 'user-suggested replication datasets'; lead_classification=corpus_database_or_project_signal; score=15; reasons=strong_phrase:reproducibility project | pair_term:effect size | pair_term:sample size | data_term:data | data_term:osf | replication_word | original_word	plot1_replication_pairs	figure1_corpus_database_candidate	yes	unknown	unknown	figure1_manual_manual_tracker_search	steps/searches/figure1/corporasearch-manual-expert-suggestion-tracker.json	manual_tracker_row_reproducibility_project_cancer_biology_af358cb46e72		reports/corpus_suggestion_tracker.md	reports/corpus_suggestion_tracker.md	manual_tracker	public_metadata	search_metadata_seen										unknown; search metadata only	yes	yes	yes	unknown	unknown	not_assigned	not_started	metadata_only_search_hit	triage_landing_page_or_package_for_pair_table	provider=manual_tracker; external_id=manual_tracker_row_reproducibility_project_cancer_biology_af358cb46e72; doi=	2026-05-01
repo_search_dataverse_62327a47981a	search_title:reproducibility_project_psychology	search_title	Reproducibility Project: Psychology	candidate_corpus_or_database	discovered_search_lead	figure1_repository_search	unknown	Back up for master data file for RPP.	"Matched Figure 1 repository search query '""Reproducibility Project"" coded data'; lead_classification=corpus_database_or_project_signal; score=7; reasons=strong_phrase:reproducibility project | data_term:data | repository_data_surface"	plot1_replication_pairs	figure1_corpus_database_candidate	yes	unknown	unknown	figure1_repository_dataverse_search	steps/searches/figure1/corporasearch-repository-osf-dataverse-replication-project-effect-size.json	doi:10.7910/DVN/28838		https://doi.org/10.7910/DVN/28838		doi.org	public_metadata	search_metadata_seen										unknown; search metadata only	unknown	unknown	unknown	unknown	yes	not_assigned	not_started	metadata_only_search_hit	triage_landing_page_or_package_for_pair_table	provider=dataverse; external_id=doi:10.7910/DVN/28838; doi=doi:10.7910/DVN/28838	2026-05-01
manual_search_manual_tracker_c23f70c3fdd3	search_title:reproducibility_project_psychology_converted_data	search_title	Reproducibility Project: Psychology converted data	candidate_corpus_or_database	discovered_search_lead	figure1_manual_search	unknown	Manual suggestion tracker row; status=partial / overlap cross-check; row=Reproducibility Project: Psychology converted data | partial / overlap cross-check | Downloaded the public CSV/XLSX export with original and replication fields. | 168 replication-target rows, 158 unique original titles, rich original-study columns (`N.O`, p-values, parsed test statistics, converted `T.r.O`). | Real public dataset, but it overlaps FReD heavily and should not be merged without a global dedupe key.	Matched Figure 1 manual search query 'user-suggested replication datasets'; lead_classification=corpus_database_or_project_signal; score=13; reasons=strong_phrase:reproducibility project | data_term:data | data_term:dataset | replication_word | original_word | manual_tracker_status_signal	plot1_replication_pairs	figure1_corpus_database_candidate	yes	unknown	unknown	figure1_manual_manual_tracker_search	steps/searches/figure1/corporasearch-manual-expert-suggestion-tracker.json	manual_tracker_row_reproducibility_project_psychology_converted_data_7e4cfd2cb659		reports/corpus_suggestion_tracker.md	reports/corpus_suggestion_tracker.md	manual_tracker	public_metadata	search_metadata_seen										unknown; search metadata only	unknown	unknown	yes	unknown	unknown	not_assigned	not_started	metadata_only_search_hit	triage_landing_page_or_package_for_pair_table	provider=manual_tracker; external_id=manual_tracker_row_reproducibility_project_psychology_converted_data_7e4cfd2cb659; doi=	2026-05-01
reviewcue_title_rescience_c_contents			Rescience C Contents	candidate_corpus_or_database	needs_source_inventory				ReScience C is a journal/source-family contents page for computational replication articles, with many article records and code/review metadata. It is a reusable source-family object rather than a single paper.	plot1_replication_pairs	figure1_candidate	yes					https://rescience.github.io/read/																							not_started		inventory_rescience_c_static_contents_and_site_repository_for_replication_article_metadata_code_doi_and_original_paper_links	review_cue=figure1_search_leads | decision=promote_to_corpora_and_databases | confidence=high | reason=ReScience C is a journal/source-family contents page for computational replication articles, with many article records and code/review metadata. It is a reusable source-family object rather than a single paper.	2026-05-02
domain_search_osf_346003e74a16	search_title:rollout_design_replication_project	search_title	Rollout Design Replication Project	candidate_corpus_or_database	discovered_search_lead	figure1_domain_search	unknown	"A common research design in economics is difference-in-differences with treatment rollout, i.e. variation in treatment timing. Recent work has popularized the problems with estimating the results of this research design using two-way fixed effects. In this project, we will: 1. Look in every issue of the journals American Economic Review, American Economic Journal: Economic Policy, and American Economic Journal: Applied Economics from 2015-2020 for empirical papers that use a difference-in-differences design (by looking for the phrases ""in difference"" and ""in-difference"" and checking for context) 2. Each of the studies will be evaluated to determine (a) if they use treatment timing variation, (b) their estimation method, and (c) whether data and code is publicly available to allow them to be replicated 3. For each* study that uses two-way fixed effects with variation in treatment timing and for which replication data and code is available, I will (a) replicate the study, (b) use the bacondecomp (Goodman-Bacon, Goldring, and Nichols 2019) module, or its other-language equivalents, to look for negative treatment effect weights, and (c) use an alternative estimator, in most cases Callaway &amp; Sant'anna (2019) to estimate the treatment effect 4. Capacity permitting, additional analysis will add more replicable studies from the set of ""top-cited difference-in-difference studies in economics"" as determined using citation counts on Google Scholar. * Depending on the number of qualifying studies identified, this may instead be a random subsample of the studies. This will be no sma"	Matched Figure 1 domain search query 'economics replication project original estimates'; lead_classification=corpus_database_or_project_signal; score=12; reasons=strong_phrase:replication project | data_term:data | data_term:code | replication_word | repository_data_surface | metadata_corpus_signal	plot1_replication_pairs	figure1_corpus_database_candidate	yes	unknown	unknown	figure1_domain_osf_search	steps/searches/figure1/corporasearch-domain-multifield-replication-database-effect-size.json	rkqab		https://osf.io/rkqab/		osf.io	public_metadata	search_metadata_seen										unknown; search metadata only	unknown	unknown	unknown	unknown	unknown	not_assigned	not_started	metadata_only_search_hit	triage_landing_page_or_package_for_pair_table	provider=osf; external_id=rkqab; doi=	2026-05-01
code_search_local_file_bb9775936aac	search_title:rp_cb_final_analysis_effect_level_data	search_title	RP CB Final Analysis - Effect level data	candidate_corpus_or_database	discovered_search_lead	figure1_code_search	unknown	Local scan hit; file_type=table_or_package; matched_query=effect_size sample_size original replication; path=data/raw/corpus_candidates/rpcb/RP_CB Final Analysis - Effect level data.csv; snippet=Paper #,Experiment #,Effect #,Internal replication #,Effect description,Expected difference based on the original paper?,Observed difference in replication?,Original sample size,Replication sample size,Was a statistical test reported in the original paper?,What statistical test was reported?,Statistical test applied to original data,Original test	Matched Figure 1 code search query 'effect_size sample_size original replication'; lead_classification=corpus_database_or_project_signal; score=13; reasons=pair_term:sample size | data_term:data | replication_word | original_word | effect_or_sample_size_phrase | local_table_or_code_surface | query_phrase_in_text	plot1_replication_pairs	figure1_corpus_database_candidate	yes	unknown	unknown	figure1_code_local_file_search	steps/searches/figure1/corporasearch-code-local-original-replication-fields.json	data/raw/corpus_candidates/rpcb/RP_CB Final Analysis - Effect level data.csv		data/raw/corpus_candidates/rpcb/RP_CB Final Analysis - Effect level data.csv	data/raw/corpus_candidates/rpcb/RP_CB Final Analysis - Effect level data.csv	local_file	public_metadata	search_metadata_seen										unknown; search metadata only	unknown	yes	unknown	unknown	unknown	not_assigned	not_started	metadata_only_search_hit	triage_landing_page_or_package_for_pair_table	provider=local_file; external_id=data/raw/corpus_candidates/rpcb/RP_CB Final Analysis - Effect level data.csv; doi=	2026-05-01
code_search_local_file_9783c0d5aec4	search_title:rp_cb_final_analysis_effect_level_data_dictionary	search_title	RP CB Final Analysis - Effect level data dictionary	candidate_corpus_or_database	discovered_search_lead	figure1_code_search	unknown	"Local scan hit; file_type=table_or_package; matched_query=effect_size sample_size original replication; path=data/raw/corpus_candidates/rpcb/RP_CB Final Analysis - Effect level data dictionary.csv; snippet=tes direction of replication effect relative to the original effect. Null-positive and Null-negative indicate the direction of the null effect releative to the original effect when a statistical test was conducted on the replication data.,""categorical: Positive, Null, Negative, Null-positive, Null-negative"" Original sample size,""Original sample size of the focal statistical test (e.g., to"	Matched Figure 1 code search query 'effect_size sample_size original replication'; lead_classification=corpus_database_or_project_signal; score=17; reasons=pair_term:original effect | pair_term:replication effect | pair_term:sample size | data_term:data | replication_word | original_word | effect_or_sample_size_phrase | local_table_or_code_surface | query_phrase_in_text	plot1_replication_pairs	figure1_corpus_database_candidate	yes	unknown	unknown	figure1_code_local_file_search	steps/searches/figure1/corporasearch-code-local-original-replication-fields.json	data/raw/corpus_candidates/rpcb/RP_CB Final Analysis - Effect level data dictionary.csv		data/raw/corpus_candidates/rpcb/RP_CB Final Analysis - Effect level data dictionary.csv	data/raw/corpus_candidates/rpcb/RP_CB Final Analysis - Effect level data dictionary.csv	local_file	public_metadata	search_metadata_seen										unknown; search metadata only	unknown	yes	yes	unknown	unknown	not_assigned	not_started	metadata_only_search_hit	triage_landing_page_or_package_for_pair_table	provider=local_file; external_id=data/raw/corpus_candidates/rpcb/RP_CB Final Analysis - Effect level data dictionary.csv; doi=	2026-05-01
code_search_local_file_11474bf4fa24	search_title:rp_cb_final_analysis_experiment_level_data	search_title	RP CB Final Analysis - Experiment level data	candidate_corpus_or_database	discovered_search_lead	figure1_code_search	unknown	"Local scan hit; file_type=table_or_package; matched_query=effect_size sample_size original replication; path=data/raw/corpus_candidates/rpcb/RP_CB Final Analysis - Experiment level data.csv; snippet=techniques were utilized?,Number of lab(s) contracted for the experiment,Lab(s) contracted for the experiment,Registered Report protocol,Experiment description,Original sample number (reported),Replication sample number (power),Replication sample number (reported),Replication experiment attempted,Replication experiment completed,""If experiment incomplete, why?"",Changes needed during experimentati"	Matched Figure 1 code search query 'effect_size sample_size original replication'; lead_classification=corpus_database_or_project_signal; score=9; reasons=data_term:data | replication_word | original_word | local_table_or_code_surface | query_phrase_in_text	plot1_replication_pairs	figure1_corpus_database_candidate	yes	unknown	unknown	figure1_code_local_file_search	steps/searches/figure1/corporasearch-code-local-original-replication-fields.json	data/raw/corpus_candidates/rpcb/RP_CB Final Analysis - Experiment level data.csv		data/raw/corpus_candidates/rpcb/RP_CB Final Analysis - Experiment level data.csv	data/raw/corpus_candidates/rpcb/RP_CB Final Analysis - Experiment level data.csv	local_file	public_metadata	search_metadata_seen										unknown; search metadata only	unknown	unknown	unknown	unknown	unknown	not_assigned	not_started	metadata_only_search_hit	triage_landing_page_or_package_for_pair_table	provider=local_file; external_id=data/raw/corpus_candidates/rpcb/RP_CB Final Analysis - Experiment level data.csv; doi=	2026-05-01
code_search_local_file_16c8471428f8	search_title:rp_cb_final_analysis_experiment_level_data_dictionary	search_title	RP CB Final Analysis - Experiment level data dictionary	candidate_corpus_or_database	discovered_search_lead	figure1_code_search	unknown	"Local scan hit; file_type=table_or_package; matched_query=effect_size sample_size original replication; path=data/raw/corpus_candidates/rpcb/RP_CB Final Analysis - Experiment level data dictionary.csv; snippet=e original paper that report the original experimental results.,string Was experiment originally identified by RP:CB team,Indicates if the experiment from the original paper was included at the beginning of the replication design. This coincides with the first draft of the protocols shared with original author(s) for input.,""categorical: Yes, No"" Did experiment continue after sh"	Matched Figure 1 code search query 'effect_size sample_size original replication'; lead_classification=corpus_database_or_project_signal; score=9; reasons=data_term:data | replication_word | original_word | local_table_or_code_surface | query_phrase_in_text	plot1_replication_pairs	figure1_corpus_database_candidate	yes	unknown	unknown	figure1_code_local_file_search	steps/searches/figure1/corporasearch-code-local-original-replication-fields.json	data/raw/corpus_candidates/rpcb/RP_CB Final Analysis - Experiment level data dictionary.csv		data/raw/corpus_candidates/rpcb/RP_CB Final Analysis - Experiment level data dictionary.csv	data/raw/corpus_candidates/rpcb/RP_CB Final Analysis - Experiment level data dictionary.csv	local_file	public_metadata	search_metadata_seen										unknown; search metadata only	unknown	unknown	unknown	unknown	unknown	not_assigned	not_started	metadata_only_search_hit	triage_landing_page_or_package_for_pair_table	provider=local_file; external_id=data/raw/corpus_candidates/rpcb/RP_CB Final Analysis - Experiment level data dictionary.csv; doi=	2026-05-01
code_search_local_file_e6fafb14a0db	search_title:rp_cb_final_analysis_paper_level_data	search_title	RP CB Final Analysis - Paper level data	candidate_corpus_or_database	discovered_search_lead	figure1_code_search	unknown	"Local scan hit; file_type=table_or_package; matched_query=effect_size sample_size original replication; path=data/raw/corpus_candidates/rpcb/RP_CB Final Analysis - Paper level data.csv; snippet=plete, why?"",Replication study submission date,Replication study acceptance date ,Link to Replication study,Did original authors respond to any emails?,Did the original paper have a potential conflict of issue statement?,Did the replication study have a potential conflict of issue statement?,Number of lab(s) contracted for the entire paper,Contracted lab(s) for the entire paper,Notes 1,A coding-i"	Matched Figure 1 code search query 'effect_size sample_size original replication'; lead_classification=corpus_database_or_project_signal; score=9; reasons=data_term:data | replication_word | original_word | local_table_or_code_surface | query_phrase_in_text	plot1_replication_pairs	figure1_corpus_database_candidate	yes	unknown	unknown	figure1_code_local_file_search	steps/searches/figure1/corporasearch-code-local-original-replication-fields.json	data/raw/corpus_candidates/rpcb/RP_CB Final Analysis - Paper level data.csv		data/raw/corpus_candidates/rpcb/RP_CB Final Analysis - Paper level data.csv	data/raw/corpus_candidates/rpcb/RP_CB Final Analysis - Paper level data.csv	local_file	public_metadata	search_metadata_seen										unknown; search metadata only	unknown	unknown	unknown	unknown	unknown	not_assigned	not_started	metadata_only_search_hit	triage_landing_page_or_package_for_pair_table	provider=local_file; external_id=data/raw/corpus_candidates/rpcb/RP_CB Final Analysis - Paper level data.csv; doi=	2026-05-01
