corpus_database_id	merge_key	merge_basis	name	record_kind	inventory_status	source_family	domain_or_field	description	why_relevant	plot_universe_ids	current_scope_roles	figure1_replication_relevance	figure2_published_relevance	figure3_prereg_relevance	discovery_source	discovery_source_path	source_key	citation_key	landing_url	raw_url	host	access_class	access_status	local_raw_paths	backing_files	staged_paths	promoted_paths	expected_rows	known_rows	known_pair_rows	known_paper_units	known_test_rows	result_fields_available	has_d_or_convertible_effect	has_n	has_replication_pair_mapping	has_prereg_or_planning_info	has_publication_links	parser_family	parser_status	blocker_codes	next_action	notes	last_seen
corpus_db_bangladesh_authoritarian_election_information_campaign_preregistered_field_experiment	source_key:bangladesh_authoritarian_election_information_campaign_preregistered_field_experiment	source_key	Bangladesh authoritarian-election information-campaign preregistered field experiment	corpus_or_database	included			Bangladesh election information field experiment	included as paper/project median from the political-science rescue layer	plot3_preregistered_results	figure3_source	unknown	unknown	yes	plot3_source_catalog	data/derived/effect_inflation_dataset/plot3_preregistered_source_catalog.csv	bangladesh_authoritarian_election_information_campaign_preregistered_field_experiment	bangladeshElectionZenodo							data/raw/corpus_candidates/political_science_unlock/zenodo/10059860/3-replication-package_ufvur.zip; Data/Election_project_data_full_sample.dta; Main_figures_and_tables.do Table 2; AEA RCT Registry trial 3509; raw Policy/Legitimacy versus control event-count reconstruction for ink-mark and self-reported voting outcomes; component contrast AL_government_villages:policy:respondent_ink_mark; promoted from package-derived political-science rescue audit rows; median collapse of 16 preregistered result rows				1				Confirmed locally: 16 extracted preregistered component/result row(s) collapse to 1 plotted paper/project median row(s); D, N, source files, and selector notes are stored in the result CSV and political-science median audit table.	yes	yes		yes	yes				Included: extraction-backed political-science source family enters the strict plotted layer as one median row per paper/project; underlying component rows remain in the audit files rather than inflating the plot.	included as paper/project median from the political-science rescue layer	2026-05-01
corpus_db_bangladesh_school_wash_transparency_preregistered_field_experiment	source_key:bangladesh_school_wash_transparency_preregistered_field_experiment	source_key	Bangladesh school-WASH transparency preregistered field experiment	corpus_or_database	included			Bangladesh school WASH transparency	included as paper/project median from the political-science rescue layer	plot3_preregistered_results	figure3_source	unknown	unknown	yes	plot3_source_catalog	data/derived/effect_inflation_dataset/plot3_preregistered_source_catalog.csv	bangladesh_school_wash_transparency_preregistered_field_experiment	bangladeshWashDataverse							data/raw/corpus_candidates/political_science_unlock/dataverse/U9I4Z2/Replication_Folder_only.zip; table_analysis_A.tex and table_analysis_B.tex; AEA RCT Registry AEARCTR-0003111; published treatment-by-post effects for source-standardized knowledge/institutional-quality and WASH-quality index outcomes; component contrast table_a:headteacher_knowledge; promoted from package-derived political-science rescue audit rows; median collapse of 8 preregistered result rows				1				Confirmed locally: 8 extracted preregistered component/result row(s) collapse to 1 plotted paper/project median row(s); D, N, source files, and selector notes are stored in the result CSV and political-science median audit table.	yes	yes		yes	yes				Included: extraction-backed political-science source family enters the strict plotted layer as one median row per paper/project; underlying component rows remain in the audit files rather than inflating the plot.	included as paper/project median from the political-science rescue layer	2026-05-01
corpus_db_baraza_public_service_delivery_preregistered_community_monitoring_field_experiment	source_key:baraza_public_service_delivery_preregistered_community_monitoring_field_experiment	source_key	Baraza public-service delivery preregistered community-monitoring field experiment	corpus_or_database	included			Baraza public-service delivery	included as paper/project median from the political-science rescue layer	plot3_preregistered_results	figure3_source	unknown	unknown	yes	plot3_source_catalog	data/derived/effect_inflation_dataset/plot3_preregistered_source_catalog.csv	baraza_public_service_delivery_preregistered_community_monitoring_field_experiment	barazaGithub							data/raw/corpus_candidates/political_science_unlock/github/baraza/report/results/final/df_ancova.Rd; analysis_report.R Figure impact_summary_ancova; five preregistered sector/overall public-service indices and four planned intervention contrasts, using author ANCOVA effects labeled in SD units; component contrast agriculture_index:subcounty_baraza; promoted from package-derived political-science rescue audit rows; median collapse of 20 preregistered result rows				1				Confirmed locally: 20 extracted preregistered component/result row(s) collapse to 1 plotted paper/project median row(s); D, N, source files, and selector notes are stored in the result CSV and political-science median audit table.	yes	yes		yes	yes				Included: extraction-backed political-science source family enters the strict plotted layer as one median row per paper/project; underlying component rows remain in the audit files rather than inflating the plot.	included as paper/project median from the political-science rescue layer	2026-05-01
corpus_db_economics_brodeur_2024	source_key:economics_brodeur_2024	source_key	Brodeur economics corpus	corpus_or_database	included	economics_brodeur_2024	economics	published economics extracted tests; scope: published top journal economics tables; field(s): economics.	current published-paper figure includes this source corpus	plot2_published_paper_d_vs_n	figure2_source	unknown	yes	unknown	plot2_source_catalog	data/derived/effect_inflation_dataset/plot2_published_source_catalog.csv	economics_brodeur_2024	brodeur2020											217		217	10071	Known: 217 paper units, 10,071 test/effect rows. Confirmed: journal provenance: yes (217); paper grouping: yes (217); paper D/N: yes (217); main selector: no.	yes	yes			yes				Included: causal-test corpus but not main-result selected. Rows are RCT/IV/DID table test statistics from published economics articles with N; no flag for the paper's main result.	Rows are RCT/IV/DID table test statistics from published economics articles with N; no flag for the paper's main result.	2026-05-01
corpus_db_brodeur_et_al_2024_preregistered_pap_economics_table_tests	source_key:brodeur_et_al_2024_preregistered_pap_economics_table_tests	source_key	Brodeur et al. 2024 preregistered/PAP economics table tests	corpus_or_database	included			Top-journal economics table-test extraction with row-level preregistration, pre-analysis-plan, and PAP-power flags in the local raw notes.	included as one paper-level median per preregistration/PAP-flagged economics paper	plot3_preregistered_results	figure3_source	unknown	unknown	yes	plot3_source_catalog	data/derived/effect_inflation_dataset/plot3_preregistered_source_catalog.csv	brodeur_et_al_2024_preregistered_pap_economics_table_tests	brodeur2020							data/derived/corpus_candidates/candidate_d_n_rows.csv.gz				70				Known locally: 10,071 extracted economics test rows, 3,724 D/N-ready rows with preregistration/PAP/PAP-power flags, collapsing to 70 paper medians. Confirmed: preregistration flag rows: 3,547; pre-analysis-plan flag rows: 2,006; PAP-power flag rows: 1,720; D/N: yes; exact test-level PAP-to-outcome mapping: no, so source-level notes mark the median selector.	yes	yes		yes	yes				Included: the preregistration/PAP flags account for 3,724 D/N-ready extracted table-test rows. To avoid coefficient-level inflation, Plot 3 contributes 70 paper-level median dots rather than all table tests. These rows remain flagged as median selectors, not exact PAP-outcome matches.	included as one paper-level median per preregistration/PAP-flagged economics paper	2026-05-01
corpus_db_button_nord_neuroscience	source_key:button_nord_neuroscience	source_key	Button/Nord neuroscience	corpus_or_database	raw_available	button_nord_neuroscience	neuroscience	published meta analysis primary studies; scope: published primary studies; field(s): neuroscience.	current published-paper figure includes this source corpus	plot2_published_paper_d_vs_n | unknown_future_or_current	figure2_source | future_seed	unknown	yes	unknown	plot2_source_catalog | raw_corpus_candidates_dir	data/derived/effect_inflation_dataset/plot2_published_source_catalog.csv | data/raw/corpus_candidates/button_nord_neuroscience	button_nord_neuroscience	button2013					local_raw_dir_present	data/raw/corpus_candidates/button_nord_neuroscience					649		649	688	Known: 649 paper units, 688 test/effect rows. Confirmed: journal provenance: no; paper grouping: yes (649); paper D/N: yes (649); main selector: no.	yes	yes			yes				Included: meta-analysis-mediated. Published-study rows from meta-analyses; no direct journal-paper main-result flag.	Published-study rows from meta-analyses | no direct journal-paper main-result flag.	2026-05-01
corpus_db_clinicaltrials_gov_api_registered_outcome_result_universe	source_key:clinicaltrials_gov_api_registered_outcome_result_universe	source_key	ClinicalTrials.gov API registered outcome-result universe	corpus_or_database	not_included			ClinicalTrials.gov API v2 result records parsed into registered primary, secondary, and other pre-specified two-group outcome-analysis rows with API denominators.	not included because this is a registered outcome-result universe, not the current standalone published analytic-preregistration layer	plot3_preregistered_results	figure3_source	unknown	unknown	yes	plot3_source_catalog	data/derived/effect_inflation_dataset/plot3_preregistered_source_catalog.csv	clinicaltrials_gov_api_registered_outcome_result_universe	du2024							data/derived/effect_inflation_dataset/plot3_ctgov_api_registered_outcome_ratio_event_rows.csv.gz; data/derived/effect_inflation_dataset/plot3_ctgov_api_registered_trial_medians.csv; data/derived/corpus_candidates/candidate_d_n_papers.csv				0				Known locally from the API pull: 190,836 registered outcome-analysis D/N rows across 17,726 randomized interventional trials, collapsed to 17,726 one-trial median rows for non-inflated plotting. The row-level file includes 40,587 primary-outcome rows; 55,321 rows use direct ratio/event-count conversion and 135,515 use a p-value-to-D proxy with actual API group denominators. Older local sidecars remain available: 7,722 KG trial medians and 3,149 cleaner phase-2+ primary randomized trial medians.	yes	yes		yes	yes				Not included in strict Plot 3: the 190,836 API rows are real registered medical outcome results and solve the scale problem, but they are registry-result rows rather than paper-level analytic preregistration rows. They should be plotted as a clinical registered-results field layer or as one-trial medians, not silently merged with Registered Reports and matched psychology preregistration corpora.	not included because this is a registered outcome-result universe, not the current standalone published analytic-preregistration layer	2026-05-01
corpus_db_clinicaltrials_gov_phase_2_primary_randomized_registry_rows	source_key:clinicaltrials_gov_phase_2_primary_randomized_registry_rows	source_key	ClinicalTrials.gov phase-2+ primary randomized registry rows	corpus_or_database	included			Cleaner ClinicalTrials.gov registered-primary-outcome subset: phase-2+ randomized interventional trials with exactly one locally eligible primary two-group registry result.	included as one registered primary randomized trial dot per trial	plot3_preregistered_results	figure3_source	unknown	unknown	yes	plot3_source_catalog	data/derived/effect_inflation_dataset/plot3_preregistered_source_catalog.csv	clinicaltrials_gov_phase_2_primary_randomized_registry_rows	du2024							data/derived/effect_inflation_dataset/plot3_ctgov_phase2plus_primary_randomized_sidecar_rows.csv				3149				Known locally: 3,149 phase-2+ randomized one-primary-outcome trial rows. Confirmed: registered primary outcome: yes; randomized interventional design: yes; phase-2+ filter: yes (3,149 rows); D/N: yes via registry p-value and enrollment proxy; published-paper endpoint: no.	yes	yes		yes	yes				Included: 3,149 phase-2+ randomized trials have exactly one locally eligible registered primary two-group result, so they can enter Plot 3 as trial-level registered confirmatory dots. These are registry-result D proxies, not journal-published paper extractions, and are labeled separately as clinical medicine.	included as one registered primary randomized trial dot per trial	2026-05-01
corpus_db_clinifact_published_trial_primary_outcome_rows	source_key:clinifact_published_trial_primary_outcome_rows	source_key	CliniFact published trial primary-outcome rows	corpus_or_database	not_included			Published clinical-trial reports linked to ClinicalTrials.gov primary outcomes.	not included under the current narrow Plot 3 rule; retained in Plot 2 as published clinical-trial primary-outcome evidence	plot3_preregistered_results	figure3_source	unknown	unknown	yes	plot3_source_catalog	data/derived/effect_inflation_dataset/plot3_preregistered_source_catalog.csv	clinifact_published_trial_primary_outcome_rows	zhang2025clinifact							data/derived/corpus_candidates/candidate_d_n_papers.csv				0				Known locally: 339 published trial primary-outcome rows, 339 D/N-ready rows. Confirmed: journal provenance: yes; primary-outcome registry linkage: yes; D/N: yes; article-level analytic preregistration/hypothesis text: not confirmed.	yes	yes		no	yes				Not included here: 339 D/N rows exist and are already represented in the published-paper endpoint surface. The current Plot 3 gate requires explicit analytic preregistered confirmatory rows, not only registry-linked primary outcomes.	not included under the current narrow Plot 3 rule; retained in Plot 2 as published clinical-trial primary-outcome evidence	2026-05-01
corpus_db_communication_privacy_preregistered_replication_corpus	source_key:communication_privacy_preregistered_replication_corpus	source_key	Communication privacy preregistered replication corpus	corpus_or_database	not_included			Preregistered three-study communication privacy replication with public data and analysis artifacts.	not included because those rows currently serve as replication-pair/path evidence and need a separate SEM/path metric policy	plot3_preregistered_results	figure3_source	unknown	unknown	yes	plot3_source_catalog	data/derived/effect_inflation_dataset/plot3_preregistered_source_catalog.csv	communication_privacy_preregistered_replication_corpus	masur2025privacy							data/derived/replication_pairs/harvest/staged/communication_privacy_2025__stage.csv				0				Known locally: 31 promoted/staged path rows and 8 downloaded source files. Confirmed: preregistration: yes; D/N or path-like rows: yes in Plot 1 context; standalone confirmatory result table for Plot 3: no; metric conversion policy: unresolved.	yes	yes		yes	yes				Not included: the preregistered corpus is real and local, but adding the path rows here would mix SEM/path metrics with the D/N confirmatory-result layer and double-count Plot 1-adjacent evidence.	not included because those rows currently serve as replication-pair/path evidence and need a separate SEM/path metric policy	2026-05-01
corpus_db_compare_prespecified_clinical_trial_outcome_audit	source_key:compare_prespecified_clinical_trial_outcome_audit	source_key	COMPare prespecified clinical-trial outcome audit	corpus_or_database	not_included			Outcome-reporting audit for clinical trials in top medical journals, parsed into prespecified and non-prespecified outcome rows.	not included because it audits whether prespecified outcomes were reported, but does not contain effect estimates or analytic sample sizes	plot3_preregistered_results	figure3_source	unknown	unknown	yes	plot3_source_catalog	data/derived/effect_inflation_dataset/plot3_preregistered_source_catalog.csv	compare_prespecified_clinical_trial_outcome_audit	internalCompareClinicalOutcomeAudit							data/derived/corpus_candidates/compare_trials/compare_trials_outcome_rows.csv				0				Known locally: 72 trial reports and 1,171 outcome rows: 89 prespecified primary, 660 prespecified secondary, 422 non-prespecified publication outcomes. Confirmed: prespecified-outcome status: yes; trial/publication provenance: yes; effect estimate and N fields: no.	no	no		yes	yes				Not included: the prespecified-outcome labels are exactly the kind of audit trail we wanted to check, but the parsed rows stop at outcome text/reporting status. There is no D/N layer to plot.	not included because it audits whether prespecified outcomes were reported, but does not contain effect estimates or analytic sample sizes	2026-05-01
corpus_db_covid_emperor_social_norm_preregistered_survey_experiment	source_key:covid_emperor_social_norm_preregistered_survey_experiment	source_key	COVID Emperor social-norm preregistered survey experiment	corpus_or_database	included			COVID Emperor social-norm experiment	included as paper/project median from the political-science rescue layer	plot3_preregistered_results	figure3_source	unknown	unknown	yes	plot3_source_catalog	data/derived/effect_inflation_dataset/plot3_preregistered_source_catalog.csv	covid_emperor_social_norm_preregistered_survey_experiment	covidEmperorOsf							data/raw/corpus_candidates/political_science_unlock/osf/covid_emperor_tejmf/replication.zip; replication/data/data_use_rep.dta; make_tables_rep.do Tables A.7/1 model with baseline Group A; treatment-cell coefficients divided by the matching omitted control-cell outcome SD reported by the source script; component contrast wkend_post:treat2_ab; promoted from package-derived political-science rescue audit rows; median collapse of 12 preregistered result rows				1				Confirmed locally: 12 extracted preregistered component/result row(s) collapse to 1 plotted paper/project median row(s); D, N, source files, and selector notes are stored in the result CSV and political-science median audit table.	yes	yes		yes	yes				Included: extraction-backed political-science source family enters the strict plotted layer as one median row per paper/project; underlying component rows remain in the audit files rather than inflating the plot.	included as paper/project median from the political-science rescue layer	2026-05-01
corpus_db_covid_vaccine_hesitancy_targeted_message_preregistered_survey_experiment	source_key:covid_vaccine_hesitancy_targeted_message_preregistered_survey_experiment	source_key	COVID vaccine-hesitancy targeted-message preregistered survey experiment	corpus_or_database	included			COVID vaccine-hesitancy message experiment	included as paper/project median from the political-science rescue layer	plot3_preregistered_results	figure3_source	unknown	unknown	yes	plot3_source_catalog	data/derived/effect_inflation_dataset/plot3_preregistered_source_catalog.csv	covid_vaccine_hesitancy_targeted_message_preregistered_survey_experiment	vaccineHesitancyOsf							data/raw/corpus_candidates/political_science_unlock/osf/vaccine_hesitancy_c8dvm/data__Reddinger_Levine_Charness_vaccination_rct.zip; Reddinger_Levine_Charness_vaccination_rct.csv; programs__sampling.do and programs__concordant_score.do; exact source samples B/C reconstructed (N=2621 and N=1032), OLS concordant-score effects divided by outcome SD; component contrast sampleB_self; promoted from package-derived political-science rescue audit rows; median collapse of 2 preregistered result rows				1				Confirmed locally: 2 extracted preregistered component/result row(s) collapse to 1 plotted paper/project median row(s); D, N, source files, and selector notes are stored in the result CSV and political-science median audit table.	yes	yes		yes	yes				Included: extraction-backed political-science source family enters the strict plotted layer as one median row per paper/project; underlying component rows remain in the audit files rather than inflating the plot.	included as paper/project median from the political-science rescue layer	2026-05-01
corpus_db_score_cos_claims	source_key:score_cos_claims	source_key	DARPA SCORE / COS claims	corpus_or_database	included	score_cos_claims	business; economics and finance; education; political science; +2 more	score extracted claims free text; score structured orig outcomes; scope: sampled social behavioral journal claims; field(s): business; economics and finance; education; political science; +2 more.	current published-paper figure includes this source corpus	plot2_published_paper_d_vs_n	figure2_source	unknown	yes	unknown	plot2_source_catalog	data/derived/effect_inflation_dataset/plot2_published_source_catalog.csv	score_cos_claims	tyner2026											3193		3193	3684	Known: 3,193 paper units, 3,684 test/effect rows. Confirmed: journal provenance: yes (3,193); paper grouping: yes (3,193); paper D/N: yes (3,193); main selector: no.	yes	yes			yes				Included: parsed with caveats. Parser yields 2,893 free-text claim rows and 791 structured focal-test rows with D/N; representative/focal claims from journal papers, but not guaranteed declared headline treatment result.	Parser yields 2,893 free-text claim rows and 791 structured focal-test rows with D/N; representative/focal claims from journal papers, but not guaranteed declared headline treatment result.	2026-05-01
corpus_db_direct_aid_humanitarian_governance_preregistered_field_experiment	source_key:direct_aid_humanitarian_governance_preregistered_field_experiment	source_key	Direct-aid humanitarian-governance preregistered field experiment	corpus_or_database	included			Direct Aid to Afghan Women	included as paper/project median from the political-science rescue layer	plot3_preregistered_results	figure3_source	unknown	unknown	yes	plot3_source_catalog	data/derived/effect_inflation_dataset/plot3_preregistered_source_catalog.csv	direct_aid_humanitarian_governance_preregistered_field_experiment	directAidGithub							data/raw/corpus_candidates/political_science_unlock/github/Direct-Aid-Replication-Materials/Replication Materials/Data/surveysDataset.dta; Table_2_A3.do and Table_3_A7.do; AEA RCT Registry AEARCTR-0010189; first two follow-up rounds, source index outcomes reconstructed as treatment-control mean differences over the control-group SD; component contrast nutrition_index; promoted from package-derived political-science rescue audit rows; median collapse of 3 preregistered result rows				1				Confirmed locally: 3 extracted preregistered component/result row(s) collapse to 1 plotted paper/project median row(s); D, N, source files, and selector notes are stored in the result CSV and political-science median audit table.	yes	yes		yes	yes				Included: extraction-backed political-science source family enters the strict plotted layer as one median row per paper/project; underlying component rows remain in the audit files rather than inflating the plot.	included as paper/project median from the political-science rescue layer	2026-05-01
corpus_db_dorison_et_al_2022_psa_cr001_pooled_preregistered_rows	source_key:dorison_et_al_2022_psa_cr001_pooled_preregistered_rows	source_key	Dorison et al. 2022 PSA-CR001 pooled preregistered rows	corpus_or_database	included			Pooled primary preregistered PSA-CR001 confirmatory rows.	adds pooled confirmatory preregistered rows that belong in the same comparison layer	plot3_preregistered_results	figure3_source	unknown	unknown	yes	plot3_source_catalog	data/derived/effect_inflation_dataset/plot3_preregistered_source_catalog.csv	dorison_et_al_2022_psa_cr001_pooled_preregistered_rows	dorison2022							data/derived/paper_tables/table_41_added_preregistered_rows_from_psa_cr001_dorison_et_al_2022.csv				1				Known: 4 pooled primary outcomes, collapsed to 1 paper dot under the one-dot-per-paper rule. Confirmed: analytic preregistration: yes (4); support status: yes (4); pooled N: yes (4); pooled D: yes (4).	yes	yes		yes	yes				Included: the four primary PSA-CR001 confirmatory outcomes are represented by one paper median. Country-level cells stay collapsed here to avoid nested non-independent Plot 3 rows.	adds pooled confirmatory preregistered rows that belong in the same comparison layer	2026-05-01
